user_input,retrieved_contexts,response,reference,faithfulness,context_precision,context_recall,chunk_size,chunk_overlap
How do I reset Wi-Fi on Roborock S7 Pro Ultra?,"['To maintain the performance of the high-\nperformance lithium-ion rechargeable \nbattery pack, keep the robot charged.\nPlace the dock on a hard and flat floor \n(wood/tile/concrete etc.), flat against a \nwall. Keep at least 0.5 m (1.6 ft) of \nclearance on either side, 1.5 m (4.9 ft) \nin front, and 1 m (3.3 ft) above. Make \nsure the location has good WiFi for a \nbetter experience with the mobile \napp, and then plug it in.\nB1-4—\n❷ Reset WiFi\n1. Open the top cover and find the WiFi \nindicator.\n2. Press and hold the  and  buttons until \nyou hear the “Resetting WiFi” voice alert. \nThe reset is complete when the WiFi \nindicator flashes slowly. The robot will then \nwait for a connection.\nOpen the Roborock App, tap the “Search for \ndevice” button, or open Xiaomi Home app, \ntap “+” in the top right corner and add the \ndevice as instructed in the app. \nNotes:\n • The actual process may vary due to ongoing app updates. \nFollow the instructions provided in the app.\n • Only 2.4 GHz WiFi is supported.\n • If the robot waits more than 1 hour for a connection, WiFi \nwill be automatically disabled. If you want to reconnect, \nreset the WiFi before proceeding.\n❸ Add device\nIf you cannot connect to the robot due to your router \nconfiguration, a forgotten password, or any other reason, reset \nthe WiFi and add your robot as a new device.\nNote:', '008\nConnecting to the App\nSearch for “Roborock” in the App Store or \nGoogle Play or scan the QR code to download \nand install the app.\n1. Download App\na. Open the top cover and find the WiFi \nindicator light.\n2. Reset WiFi\nb. Press and hold the  and  buttons \nuntil you hear the “Resetting WiFi” voice \nmessage. The reset is complete when the \nWiFi indicator light flashes slowly. The \nrobot will then wait for a connection.\nIf you cannot connect to the robot due to your \nrouter configuration, a forgotten password, or any other \nreason, reset the WiFi and add your robot as a new device.\nNote:\nNotes:\n • The actual process may vary due to ongoing app updates. \nFollow the guide provided in the app.\n • Only 2.4 GHz WiFi is supported.\nOpen the Roborock app, tap the “Scan to \nConnect” or “Search for Device” button and \nadd your device as instructed in the app.\n3. Add Device\nC2-1—Zone 1 – Cleaned.\nC2-2—Zone 2 – Cleaned.\nC2-3—Zone 3 – In Progress.\nC2-4—Zone 4 – Next Zone.\nNotes:\n •To allow the robot to automatically vacuum and return \nto the dock, start the robot from the dock. Do not move \nthe dock during cleaning.\n • Cleaning cannot start if the battery level is too low. \nAllow the robot to charge before starting the cleanup.\n • Before cleaning, tidy cords (including the power cord \nof the dock) and valuables from the floor. Loose \nitems may be dragged by the robot, resulting in the \ndisconnection of electrical appliances or damage of \ncords and property.\n • If cleaning is completed in less than 10 minutes, the \narea will be cleaned twice.\n • If the battery runs low during a cleaning cycle, the robot \nwill automatically return to the dock. After charging, \nthe robot will resume where it left off.\n • The robot will retract mop cloth mounts when cleaning \nthe carpet. You can also set the carpet as a no-go \nzone in the app to avoid it.\n • Before starting each cleaning task, make sure that the \nmop cloths have been properly installed.\nSpot Cleaning\nPress and hold the  button to start spot \ncleaning in pause mode.\nCleaning range: The robot cleans a 1.5 m (4.9 ft) x \n1.5 m (4.9 ft) square area centered on itself.\nPress and hold  to turn on the robot. The \npower indicator light will come on, and the \nrobot will wait for orders.\nPress and hold the  button to turn off the \nrobot and complete the cleaning cycle.\nOn/Off\nThe robot cannot be turned off when it is being charged.Note:\nInstructions for UseC\nRemove and open the clean water tank and \nfill the tank with water to MAX. Close the lid, \nlock the latch, and fit the tank back in place.\nNotes:\n • To prevent corrosion or damage, do not use any disinfectant \nand only use cleaning solution recommended by Roborock \nin the water tank.\n • Do not add too much cleaning solution to prevent the \nrobot from working improperly due to slipping.\n • To avoid water tank deformation, do not place hot water \nin the tank. \n • If water marks remain on the water tank, wipe them \nclean before reinstallation.', '13\nIf the robot does not respond when a button \nis pressed or cannot be turned off, reset the \nsystem by pressing the Reset button.\nResetting the SystemC17\nNote: After resetting the system, existing settings such \nas scheduled cleaning and WiFi will be restored to \nfactory settings.\nTo disconnect the robot from WiFi, press \nthe Reset button until you hear a voice \nmessage. Then wait for 5 minutes and the \nWiFi will be automatically deactivated. If you \nwant to reconnect, please follow the related \nconnecting instructions.\nIf the robot does not function properly after \na system reset, switch it on. Press and hold  \n and at the same time, press the Reset \nbutton until you hear the “Restoring \nfactory settings” voice message. The robot \nwill then be restored to factory settings.\nDeactivating WiFiC18\nRestoring Factory SettingsC19\nNote: The frequency of replacement may vary with the \nactual situation. If abnormal wear occurs, replace the \nparts immediately.\n* Clean every 2 weeks and replace every 6-12 months.\nMain BrushesD1\nRoutine MaintenanceD\nD1-1—Hair-Blocking Rings \nD1-2—Main Brush Caps \nD1-3—Main Brush Cover \nD1-4—Latches \nD1-5—Main Brushes \nD1-6—Main Brush Bearing\nTurn over the robot and press the \ntwo latches inwards to remove the \nmain brush cover.\nD1-7—\nPull out the main brushes and \nremove the main brush bearings, \nmain brush caps, and hair-blocking \nrings. Remove any entangled hair \nor dirt at both ends of the main \nbrushes. Then, reinstall the hair-\nblocking rings, main brush caps, and \nthen main brush bearings. \nD1-8—\nUnscrew the side brush screw. Remove and \nclean the side brush. Reinstall the brush \nand tighten the screw.\nNotes:\n • It is recommended to wipe the main brushes with a \nwet cloth. If the main brushes are wet, air-dry them \naway from direct sunlight.\n • Do not use corrosive cleaning fluid or disinfectant to \nclean the main brushes.\n* Clean monthly and replace every 3-6 months.\nFlexible Side BrushD2\nReinstall the main brushes. Firmly snap \nthe main brush bearings into place. \nOnly after the bearings are securely \ninstalled, fit the main brush cover.\nD1-9—\nReinstall the main brush cover. Make \nsure its four teeth are fully seated in \nthe slots, and press the main brush \ncover until you hear it lock with a click.\nD1-10 —\n • Placing a malfunctioning robot on the dock manually \nwill end the current cleanup.\n •To prevent injury caused by blades used to cut hair inside \nthe main brush cover, make sure to install two main \nbrushes in place before installing the main brush cover.\nUse a tool, such as a small \nscrewdriver, to pry out the axle and \ntake out the wheel.\nD3-1—\n* Clean as required.\nOmnidirectional WheelD3\nThe omnidirectional wheel bracket cannot be \nremoved.\nNote:\nRinse the wheel and the axle with \nwater to remove any hair and dirt. \nAir-dry, reinstall, and press the wheel \nand axle back in place.\nD3-2—\nClean the main wheels with a soft, dry cloth.', '07\nEmpty Wash Fill Dock AutoA11\nA11-1—Charging Contacts\nA11-2—Robot Refill Port\nA11-3—Dust Container Cover\nA11-4—Drying Air Outlets\nPress any button to pause the robot during \ncleaning or docking.\nNote:\n • White: Battery level ≥ 15%\n • Red: Battery level < 15%\n • Breathing: Charging or starting up\n • Flashing red: Error\n • Flashing red and white alternately: \nRemote viewing or cruising\n • Press and hold to turn the robot \non or off\n • Press to start cleaning\n—Power/Clean\n—Power Indicator Light\n • Press to start docking/emptying\n • Press and hold to wash the mop \ncloths\n—Dock\n • Press to start Mop Only\n • Press and hold for 3 seconds to \nenable/disable Child Lock \n—Mop Only/Child Lock\n • Off: WiFi disabled\n • Flashing slowly: Waiting for \nconnection\n • Flashing quickly: Connecting\n • Steady: WiFi connected\n • Flashing slowly: Starting up\n • Flashing quickly: Waiting for voice \ncommands\nProduct OverviewA\nA1  Robot (Top View)\nA2  Robot (Bottom View)\nA3  Robot (Top Cover Removed)\nA1-1—Voice Assistant Indicator Light\nA2-1—Cliff Sensors\nA2-2—Carpet Sensor\nA2-3—Omnidirectional Wheel\nA2-4—Flexible Side Brush\nA2-5—Main Brushes\nA2-6—Main Brush Cover Latches\nA2-7—Main Wheels\nA3-1—Magnetic Top Cover\nA3-2—WiFi Indicator Light\nA3-3—Reset Button\nA3-4—Charging Contacts\nA3-5—Communication Sensor\nA3-6—Self-Filling Port\nA3-7—Positioning Button\nA3-8—Air Outlets\nA3-9—VibraRise Module\nA3-10—Bumper\nThe mop cloth mounts are non-detachable.Note:\nVibraRise ModuleA4\nA5-1—Hook and Loop Pads\nA6-1—Mop Cloth Screw\nA7-1—Dustbin Latch\nA7-2—Filter Latch\nA7-3—Air Inlet\nA7-4—Washable Filter\nA7-5—Suction Inlet\nVibraRise Mop ClothA5\nDustbin A7\nDock BaseA8\nDisposable Dust BagA9\nEdgewise Mop ClothA6\nPower CordA10\n •For use with video calls and voice \ncontrol.\nA1-2—Vertical Bumper\nA1-3—LiDAR Sensor\nA1-4—Microphones\nA1-5—Wall Sensor\nA1-6—Reactive AI Obstacle Recognition \nSensor\nA1-7—Dock Locator\nA1-8—LED Fill Light\nNote: Secure the mop cloth flat in place.\nA4-1—Mop Cloth Attachment Slot\nA4-2—Vibration Module\nA4-3—Edgewise Mopping Module', '08\nInstructions\nNotes:\n • To prevent corrosion or damage, only use the Roborock \nbranded floor cleaner in the water tank.\n • To avoid water tank deformation, do not place hot water \nin the tank.\n • If water marks remain on the water tank, wipe them clean \nbefore reinstallation.\nFilling the Clean Water Tank\nOpen the clean water tank. Fill with water \nuntil the Max line. Close the lid, lock the \nlatch, and fit the tank back in place.\nThe robot cannot be turned off when it is being \ncharged.\nNote:\nPress and hold the  button to turn on the \nrobot. The power indicator will turn on and \nthe robot will enter standby mode. Press \nand hold the  button to turn off the robot \nand complete the cleaning cycle.\nOn/Off\nPress the  button to start cleaning. The \nrobot will plan its cleaning route according \nto its scan of the room. It splits a room into \nzones, first draws out zone edges, and then \nfills the zone in a zigzag pattern. In so \ndoing, the robot cleans all zones one by \none, efficiently cleaning the house.\nStarting Cleaning\nZone 1 – Cleaned\nZone 4 – Next Zone\nZone 2 – Cleaned\nZone 3 – In Progress\nNotes:\n • To allow the robot to automatically vacuum and return to \nthe dock, start the robot from the dock. Do not move the \ndock during cleaning.\n • Cleaning cannot start if the battery level is too low. Allow the \nrobot to charge before starting cleanup.\n • If cleaning is completed in less than 10 minutes, the area \nwill be cleaned twice.\n • If the battery runs low during the cleaning cycle, the robot \nwill automatically return to the dock. After charging, the \nrobot will resume where it left off.\n • Automatic mop washing will not work if the dock \nencounters an error during cleaning. Wash the mop \nmanually to restore.\n • When the mop mount is attached, the robot will retract it \nwhen cleaning the carpet. You can also set the carpet as a \nno-go zone in the app to avoid it.\n • Before starting each mopping task, make sure that the \nVibraRise mop has been properly installed.\nAfter spot cleaning, the robot will automatically return \nto the starting point and enter Standby mode.\nNote:\nPress the  button to start spot cleaning.\nCleaning range: The robot cleans a 1.5 m \n(4.9 ft) x 1.5 m (4.9 ft) square area centered \non itself.\nSpot Cleaning Manually Activated Emptying\nAuto-Emptying\nEmptying can be triggered manually by \npressing the  button while the robot is \ncharging.\nAuto-emptying will begin when the robot \nreturns to the dock after cleaning.\nAvoid frequent manual emptying.Note:\nNotes:\n • If the dock has not emptied for an extended period, \nempty the robot dustbin manually and clear the air \ninlet of any debris to ensure optimum performance.\n • If necessary, auto-emptying can be disabled in the \napp.\nManually Activated Mop \nWashing\nDuring cleaning, press any button to pause, \nthen press and hold the  button to send \nthe robot back for mop washing.\nAuto Mop Washing\nDuring cleaning, the robot automatically \ndetermines when it should return to dock \nfor mop washing and water tank refilling to \nmaximize its mopping performance.', '11\nNotes:\n • The actual process may vary due to ongoing app \nupdates. Follow the guide provided in the app.\n • Only 2.4 GHz WiFi is supported.\n3. Add Device\nOpen the Roborock app, tap the ""Scan to \nConnect"" or ""Search for Device"" button and \nadd your device following the in-app guide. During operation, the dock will automatically \nfill and drain water.\nFilling/DrainingC2\nPress and hold  to turn on the robot. The \npower indicator light will come on, and the \nrobot will wait for orders.\nPress and hold  to turn off the robot and \ncomplete the cleaning cycle.\nTurning On/OffC3\nPress  to start cleaning. The robot will plan its \ncleaning route and in each room, it firstly draws \nout zone edges and then fills the room in a \nzigzag pattern. In so doing, the robot cleans all \nrooms one by one, thoroughly and efficiently.\nStarting CleaningC4\nZone 1 – Cleaned\nZone 4 – Next Zone\nZone 2 – Cleaned\nZone 3 – In Progress\nNotes:\n • To make sure the robot returns to the dock \nautomatically, start the robot from the dock and do \nnot move the dock during cleaning.\n • Cleaning cannot start if the battery level is too low. \nAllow the robot to charge before starting a cleanup.\n • If cleaning is completed in less than 10 minutes, the \nrobot will clean the area twice.\n • If the battery runs low during a cleaning cycle, the \nrobot will automatically return to the dock. After \ncharging, the robot will resume where it left off.\n • The robot will retract the mop cloth mounts to clean \nthe carpet. You can also set the carpet as a no-go \nzone in the app to avoid it.\n • Before starting each cleaning task, make sure that the \nmop cloths have been properly installed.\nNote: The robot cannot be turned off when it is being charged.\nInstructions for UseC\nAdding the Cleaning SolutionC1\nRemove the dust container cover, \npull out the entire cleaning solution \ncartridge by its bottom handle, and \nthen place it on a hard, flat surface.\nC1-1—\nOpen the lid of the cartridge and \nadd cleaning solution.\nC1-2—\nClose the lid and put the cartridge back \nto the dock. Press down the cartridge \nuntil you hear it lock with a click. \nC1-3—\nInstall the dust container cover in place \nto make sure the dust container is \nsecurely sealed.\nC1-4—\nNotes:\n • Make sure that the cleaning solution cartridge is \nNote: To prevent the dust container cover from falling \nand hitting the robot, remove the cover with both \nhands, one on each side.\nPress  to start Mop Only. The main brushes \nrise, the main brushes and fan stop operating, \nand the VibraRise module lowers.\nNote: Compared with the traditional cleaning mode, \nnoise emanating from Mop Only is much lower.\nPress  and  simultaneously to start spot \ncleaning.\nCleaning range: The robot cleans a 1.5 m \n(4.9 ft) × 1.5 m (4.9 ft) square area centered \non itself.\nNote: After spot cleaning, the robot will automatically \nreturn to the starting point and wait for orders.']","To reset the Wi-Fi on your Roborock S7 Pro Ultra, open the top cover to locate the Wi-Fi indicator. Then, press and hold both the and buttons until you hear a ""Resetting WiFi"" voice alert. The Wi-Fi indicator will flash slowly, signifying that the reset is complete and the robot is ready for connection.",Open the top cover and locate the Wi-Fi indicator. Press and hold the Power and Home buttons until you hear 'Resetting WiFi'. The reset is complete when the Wi-Fi indicator flashes slowly and the robot waits for connection.,1.0,0.9166666666361111,1.0,800,250
Can I use detergent in the water tank?,"['Cleaning range: The robot cleans a 1.5 m (4.9 ft) x \n1.5 m (4.9 ft) square area centered on itself.\nPress and hold  to turn on the robot. The \npower indicator light will come on, and the \nrobot will wait for orders.\nPress and hold the  button to turn off the \nrobot and complete the cleaning cycle.\nOn/Off\nThe robot cannot be turned off when it is being charged.Note:\nInstructions for UseC\nRemove and open the clean water tank and \nfill the tank with water to MAX. Close the lid, \nlock the latch, and fit the tank back in place.\nNotes:\n • To prevent corrosion or damage, do not use any disinfectant \nand only use cleaning solution recommended by Roborock \nin the water tank.\n • Do not add too much cleaning solution to prevent the \nrobot from working improperly due to slipping.\n • To avoid water tank deformation, do not place hot water \nin the tank. \n • If water marks remain on the water tank, wipe them \nclean before reinstallation.\nC1 Filling the Water Tank\nPress the  button to start cleaning. The \nrobot will plan its cleaning route according \nto its scan of the room. It splits a room \nC2 Starting Cleaning\ninto zones, first draws out zone edges, and \nthen fills the zone in a zigzag pattern. In \nso doing, the robot cleans all zones one by \none, efficiently cleaning the house.\nAfter spot cleaning, the robot will automatically \nreturn to the starting point and wait for orders.\nNote:', 'Moving the DockD11\nWash the mop cloth and air-dry it.D7-2—\nReinstall the mop cloth and tighten \nthe screw.\nD7-3—\nA dirty mop cloth will affect the mopping \nperformance. Clean it before use.\nNote:\nRemove the filter.D6-1—\nRinse the filter repeatedly and tap it \nto remove as much dirt as possible.\nD6-2—\nDo not touch the surface of the filter with hands, \nbrush, or hard objects to avoid potential damage.\nNote:\n* Clean every 2 weeks and replace every 6-12 months.\nWashable FilterD6\nReinstall the cleaning tank.D14-3—\nRinse the cleaning tank with water.D14-2—\nLeave the dustbin and the washable \nfilter to dry.\nD5-4—\nTo prevent blockage, only use clean water without \nany cleaning liquid.\nNote:\nFill the dustbin with clean water and \nreinstall the washable filter. Gently \nshake the dustbin, and then pour \nout the dirty water.\nD5-3— Do not lift the base directly to prevent the \ndock from falling off.', '010\nD5-1—Open the top cover of the robot and \npress the dustbin latch to take out \nthe dustbin.\n* Clean as required.\nD5-2—Open the washable filter and empty \nthe dustbin.\nD5-3—Fill the dustbin with clean water and \nreinstall the washable filter. Gently \nshake the dustbin, and then pour out \nthe dirty water.\n* Clean every 2 weeks and replace the filter every 6-12 months.\nD6-1—Remove the filter.\nD6-2—Rinse the filter repeatedly and tap it \nto remove as much dirt as possible.\nD6-3—Allow at least 24 hours for the filter \nto dry thoroughly and reinstall it.\nDo not touch the surface of the filter with your \nhands, brush, or hard objects to avoid potential damage.\nNote:\nTo prevent blockage, only use clean water without \nany cleaning liquid.\nNote:\nD5-4—Leave the dustbin and the washable \nfilter to dry.\nD1-8—Reinstall the main brush.\nD7-1—Remove the mop cloth from the mop \ncloth mount. Clean the mop cloth and \nair-dry it.\n* Clean as required and replace every 1-3 months.\nD1-9—Reinstall the main brush cover. Make \nsure that the four teeth are fully seated \nin the slot, and then press on the main \nbrush cover to lock it until you hear a click.\nNotes:\n • Main brush should be wiped down with a wet cloth. If the \nmain brush is wet, air-dry it away from direct sunlight.\n • Do not use corrosive cleaning fluids or disinfectants to \nclean the main brush.\n* Clean monthly and replace every 3-6 months.\nUnscrew the side brush screw. Remove and \nclean the side brush. Reinstall the brush and \ntighten the screw.\nD2 Side Brush\nD3-1—Use a tool, such as a small screwdriver, \nto pry out the axle and take out the wheel.\n* Clean as required.\nThe omnidirectional wheel bracket cannot be removed.Note:\nD3-2—Rinse the wheel and the axle with \nwater to remove any hair and dirt. \nDry and reattach the wheel, pressing \nit firmly in place.\nD3 Omnidirectional Wheel\nClean the main wheel with a soft, dry cloth.\n* Clean as required.\nD4 Main Wheel\nD5 Dustbin\nD6 Washable Filter\nD7 Mop Cloths\nRestoring Factory Settings\nIf the robot does not function properly after \na system reset, switch it on. Press and hold \nthe  button and at the same time, press the \nReset button until you hear the “Restoring \nfactory settings” voice message. The robot \nwill then be restored to factory settings.\n* Clean every 2 weeks and replace every 6-12 months.\nD1-1—Main Brush Cover\nD1-2—Main Brush Cover Latches\nD1-3—Main Brush\nD1-4—Main Brush Caps\nD1-5—Main Brush Bearing\nD1-6—Turn over the robot and press the \nmain brush latches to remove the \nmain brush cover.\nD1-7—Pull out the main brush and remove \nthe main brush bearing.', '08\nInstructions\nNotes:\n • To prevent corrosion or damage, only use the Roborock \nbranded floor cleaner in the water tank.\n • To avoid water tank deformation, do not place hot water \nin the tank.\n • If water marks remain on the water tank, wipe them clean \nbefore reinstallation.\nFilling the Clean Water Tank\nOpen the clean water tank. Fill with water \nuntil the Max line. Close the lid, lock the \nlatch, and fit the tank back in place.\nThe robot cannot be turned off when it is being \ncharged.\nNote:\nPress and hold the  button to turn on the \nrobot. The power indicator will turn on and \nthe robot will enter standby mode. Press \nand hold the  button to turn off the robot \nand complete the cleaning cycle.\nOn/Off\nPress the  button to start cleaning. The \nrobot will plan its cleaning route according \nto its scan of the room. It splits a room into \nzones, first draws out zone edges, and then \nfills the zone in a zigzag pattern. In so \ndoing, the robot cleans all zones one by \none, efficiently cleaning the house.\nStarting Cleaning\nZone 1 – Cleaned\nZone 4 – Next Zone\nZone 2 – Cleaned\nZone 3 – In Progress\nNotes:\n • To allow the robot to automatically vacuum and return to \nthe dock, start the robot from the dock. Do not move the \ndock during cleaning.\n • Cleaning cannot start if the battery level is too low. Allow the \nrobot to charge before starting cleanup.\n • If cleaning is completed in less than 10 minutes, the area \nwill be cleaned twice.\n • If the battery runs low during the cleaning cycle, the robot \nwill automatically return to the dock. After charging, the \nrobot will resume where it left off.\n • Automatic mop washing will not work if the dock \nencounters an error during cleaning. Wash the mop \nmanually to restore.\n • When the mop mount is attached, the robot will retract it \nwhen cleaning the carpet. You can also set the carpet as a \nno-go zone in the app to avoid it.\n • Before starting each mopping task, make sure that the \nVibraRise mop has been properly installed.\nAfter spot cleaning, the robot will automatically return \nto the starting point and enter Standby mode.\nNote:\nPress the  button to start spot cleaning.\nCleaning range: The robot cleans a 1.5 m \n(4.9 ft) x 1.5 m (4.9 ft) square area centered \non itself.\nSpot Cleaning Manually Activated Emptying\nAuto-Emptying\nEmptying can be triggered manually by \npressing the  button while the robot is \ncharging.\nAuto-emptying will begin when the robot \nreturns to the dock after cleaning.\nAvoid frequent manual emptying.Note:\nNotes:\n • If the dock has not emptied for an extended period, \nempty the robot dustbin manually and clear the air \ninlet of any debris to ensure optimum performance.\n • If necessary, auto-emptying can be disabled in the \napp.\nManually Activated Mop \nWashing\nDuring cleaning, press any button to pause, \nthen press and hold the  button to send \nthe robot back for mop washing.\nAuto Mop Washing\nDuring cleaning, the robot automatically \ndetermines when it should return to dock \nfor mop washing and water tank refilling to \nmaximize its mopping performance.', '011\nD7-2—Stick the mop cloth on the mount in \nposition and firmly.\nA dirty mop cloth will affect the washing performance. \nClean it before use.\nNote:\nMake sure the disposable dust bag is properly \nsealed to avoid waste escaping and damaging the dock.\nNote:\nUse a soft, dry cloth to wipe and clean all \nsensors, including:\n* Clean as required.\nLift up and move the dock. Do not move the \ndock by lifting the dock base, water tank handles \nor dust container cover directly to prevent \nthe dock from falling off.\nOpen the dirty water tank lid and pour out \nthe dirty water. Fill the tank with clean water, \nclose the lid, and shake. Pour out the dirty \nwater. Close the lid and then re-install.\n* Clean as required.\nUse a soft dry cloth to wipe the charging \ncontacts on the robot and the dock.\n* Clean monthly.\nNotes:\n • The dust bag handle seals the bag on removal to \nprevent leakage.\n • Always install a dust bag before closing the dust \ncontainer cover to avoid auto-emptying without the \nbag. You can also disable auto-emptying in the app.\nD12-1—Remove the dust container cover.\nD12-2—Remove the disposable dust bag in the \ndirection of the arrow and discard it.\n* Replace as required.\nD12-3—Clean around the filter with a dry \ncloth. Install a new disposable dust \nbag in place along the slot and \nunfold the dust bag to maximize \nemptying performance.\nBasic Parameters\nModel QR1PES\nBattery 14.4 V/5200 mAh (TYP) \nlithium-ion battery\nRated Input 20VDC 1.5A\nCharging Time Approx. 4 hours\nRobot\nThe serial number is on a sticker on the underside \nof the robot.\nNote:\nEmpty Wash Fill Dock\nModel EWFD16HRR\nRated Input Voltage 220-240VAC\nRated Frequency 50-60Hz\nRated Input (Dust \ncollection) 3A \nRated Input\n(Hot water washing \nmop)\n5.6A\nRated Input \n(Charging & drying) 0.6A\nRated Output 20VDC 1.5A\nCharging Battery 14.4 V/5200 mAh (TYP) \nlithium-ion battery\nD8-1—Dock Locator\nD8-2—Reactive Tech Obstacle Avoidance Sensor\nD8-3—Wall Sensor\nD8-4—Communication Sensor\nD8-5—Carpet Sensor\nD8-6—Four Cliff Sensors\nD8 Robot Sensors\nD10 Dirty Water Tank\nD11 Charging Contact Areas\nD12 Replacing Disposable Dust Bag\nD12-4—Close the dust container cover and \nmake sure it is securely sealed.\nD13-1—Remove the cleaning tank.\nD13-2—Rinse the cleaning tank and the filter \nwith water.\nD13-3—Reinstall the cleaning tank.\n* Clean as required.\nD13 Cleaning Tank\nD9 Moving Dock', 'Note:\nPress the  button to start spot cleaning.\nCleaning range: The robot cleans a 1.5 m \n(4.9 ft) x 1.5 m (4.9 ft) square area centered \non itself.\nSpot Cleaning Manually Activated Emptying\nAuto-Emptying\nEmptying can be triggered manually by \npressing the  button while the robot is \ncharging.\nAuto-emptying will begin when the robot \nreturns to the dock after cleaning.\nAvoid frequent manual emptying.Note:\nNotes:\n • If the dock has not emptied for an extended period, \nempty the robot dustbin manually and clear the air \ninlet of any debris to ensure optimum performance.\n • If necessary, auto-emptying can be disabled in the \napp.\nManually Activated Mop \nWashing\nDuring cleaning, press any button to pause, \nthen press and hold the  button to send \nthe robot back for mop washing.\nAuto Mop Washing\nDuring cleaning, the robot automatically \ndetermines when it should return to dock \nfor mop washing and water tank refilling to \nmaximize its mopping performance.\nTo allow the robot to wash the mop automatically, \nstart the robot from the dock once it is fully charged. Do \nnot move the dock during cleaning.\nNote:']","No, you should not use any disinfectant or cleaning solution other than what is recommended by Roborock in the water tank.",Only cleaning solutions officially recommended by Roborock may be used. Other detergents may cause corrosion or damage.,0.5,0.999999999975,1.0,800,250
Which model has automatic mop washing?,"['12\nIf the robot is paused for over 10 minutes, \nit will go to sleep, and the power indicator \nlight will flash every few seconds. Press any \nbutton to wake the robot up.\nNotes:\n • The robot will not go to sleep when it is charging.\n • The robot will automatically shut down if left sleep for \nmore than 12 hours.\nSleepC8\nNotes:\n • To make sure the robot to wash the mop cloths \nautomatically, start the robot from the dock and do \nnot move the dock during cleaning.\n • Mop wash frequency and mode can be modified in \nthe app.\n • To avoid burns from hot water, do not touch the water \noutlets.\nAfter cleaning, the robot will return to \nEmptyingC10\nNotes:\n • When emptying has been left unused for a long \nperiod, empty the dustbin manually and make sure \nthe air inlet is clear for optimal emptying performance.\n • Auto-emptying can be disabled in the app.\n • Avoid frequent manual emptying.\nDuring cleaning, the robot automatically \ndetermines when it should return to the dock \nfor mop washing and water tank refilling \nto maximize its mopping performance. To \nmanually start washing, press and hold  \nor tap the corresponding button in the app. \nPress any button to stop washing.\nWashing the Mop ClothsC9\nDrying starts automatically after mop\nwashing or after cleaning is completed. \nTo manually start or stop drying, tap the \ncorresponding button in the app.\nNotes:\n • Stay away from the drying air outlets during drying.\n • Drying duration can be modified in the app.\n • Auto-drying can be disabled in the app.\nDryingC11\nNote: Smart Cleaning Solution Filling can be disabled \nin the app.\nThe robot will automatically add cleaning \nsolution to the water for mop washing and \nrobot water tank refilling according to the \npreset ratio to ensure optimal mopping \nperformance.\nAuto Cleaning Solution AdditionC12\nNote: If the robot fails to find the dock, it will automatically \nreturn to its starting position. Place the robot on the \ndock manually to recharge.\nAfter cleaning, the robot will automatically \nreturn to the dock to charge.\nChargingC13\nThe default Do Not Disturb (DND) period is \nfrom 22:00 to 08:00. You can use the app to \ndisable the DND mode or modify the DND \nperiod, or set whether to enable auto top-\nup, emptying and drying, to dim the button \nlight, or lower the volume of the voice \nmessage during the DND period.\nDND ModeC14\nPress and hold  to enable/disable Child \nLock. You can also set it in the app. Once \nenabled, the robot will not react to button \npresses when it is stationary. When the \nrobot is cleaning or docking, press any \nbutton to pause it.\nIf an error occurs, the power indicator light \non the robot will flash red or status indicator \nlight on the dock will be steady red. A pop-\nup notification will appear in the app and a \nvoice alert may sound.\nChild LockC15\nErrorC16\nNotes:\n • The robot will go to sleep automatically if left in a \nmalfunctioning state for over 10 minutes.\nNote: Placing a paused robot on the dock manually will \nend the current cleanup.\npress and hold  to wash the mop cloths \nand then resume cleaning.', 'After resetting the system, existing settings such \nas scheduled cleaning and WiFi will be restored to factory \nsettings. \nNote:\nAuto-emptying will automatically begin when \nthe robot returns to the dock after cleaning. \nTo manually emptying, press  button on the \ndocked robot or tap the corresponding button \nin the app. Press any button to stop emptying. \nEmptying\n • When auto-emptying has been left unused for a long \nperiod, empty the dustbin manually and make sure \nthe air inlet is clear for optimal emptying performance.\n • Auto-emptying can be disabled through the app.\n • Avoid frequent manual emptying.\nNotes:\nDrying starts automatically after mop washing \nor after cleaning is completed. To manually \nstart or stopping drying, tap the corresponding \nbutton in the app. \nDrying\n • To allow the robot to wash the mop automatically, \nstart the robot from the dock and do not move the \ndock during cleaning.\n • Watch out for hot water and do not touch the water outlet.\n • Mop wash frequency and washing mode can be modified \nin the app. \nNotes:\nperformance. During cleaning, tap Dock \nbutton in the app to send robot back for \nmop washing. When the robot is charging, \npress and hold the  button on the robot or \ntap Wash button in the app to manually start \nwashing. Press any button to stop washing.\nDeactivating WiFi\nTo disconnect the robot from WiFi, press \nthe Reset button until you hear a voice', 'Moving the DockD11\nWash the mop cloth and air-dry it.D7-2—\nReinstall the mop cloth and tighten \nthe screw.\nD7-3—\nA dirty mop cloth will affect the mopping \nperformance. Clean it before use.\nNote:\nRemove the filter.D6-1—\nRinse the filter repeatedly and tap it \nto remove as much dirt as possible.\nD6-2—\nDo not touch the surface of the filter with hands, \nbrush, or hard objects to avoid potential damage.\nNote:\n* Clean every 2 weeks and replace every 6-12 months.\nWashable FilterD6\nReinstall the cleaning tank.D14-3—\nRinse the cleaning tank with water.D14-2—\nLeave the dustbin and the washable \nfilter to dry.\nD5-4—\nTo prevent blockage, only use clean water without \nany cleaning liquid.\nNote:\nFill the dustbin with clean water and \nreinstall the washable filter. Gently \nshake the dustbin, and then pour \nout the dirty water.\nD5-3— Do not lift the base directly to prevent the \ndock from falling off.', 'Note:\nPress the  button to start spot cleaning.\nCleaning range: The robot cleans a 1.5 m \n(4.9 ft) x 1.5 m (4.9 ft) square area centered \non itself.\nSpot Cleaning Manually Activated Emptying\nAuto-Emptying\nEmptying can be triggered manually by \npressing the  button while the robot is \ncharging.\nAuto-emptying will begin when the robot \nreturns to the dock after cleaning.\nAvoid frequent manual emptying.Note:\nNotes:\n • If the dock has not emptied for an extended period, \nempty the robot dustbin manually and clear the air \ninlet of any debris to ensure optimum performance.\n • If necessary, auto-emptying can be disabled in the \napp.\nManually Activated Mop \nWashing\nDuring cleaning, press any button to pause, \nthen press and hold the  button to send \nthe robot back for mop washing.\nAuto Mop Washing\nDuring cleaning, the robot automatically \ndetermines when it should return to dock \nfor mop washing and water tank refilling to \nmaximize its mopping performance.\nTo allow the robot to wash the mop automatically, \nstart the robot from the dock once it is fully charged. Do \nnot move the dock during cleaning.\nNote:', '11\nNotes:\n • The actual process may vary due to ongoing app \nupdates. Follow the guide provided in the app.\n • Only 2.4 GHz WiFi is supported.\n3. Add Device\nOpen the Roborock app, tap the ""Scan to \nConnect"" or ""Search for Device"" button and \nadd your device following the in-app guide. During operation, the dock will automatically \nfill and drain water.\nFilling/DrainingC2\nPress and hold  to turn on the robot. The \npower indicator light will come on, and the \nrobot will wait for orders.\nPress and hold  to turn off the robot and \ncomplete the cleaning cycle.\nTurning On/OffC3\nPress  to start cleaning. The robot will plan its \ncleaning route and in each room, it firstly draws \nout zone edges and then fills the room in a \nzigzag pattern. In so doing, the robot cleans all \nrooms one by one, thoroughly and efficiently.\nStarting CleaningC4\nZone 1 – Cleaned\nZone 4 – Next Zone\nZone 2 – Cleaned\nZone 3 – In Progress\nNotes:\n • To make sure the robot returns to the dock \nautomatically, start the robot from the dock and do \nnot move the dock during cleaning.\n • Cleaning cannot start if the battery level is too low. \nAllow the robot to charge before starting a cleanup.\n • If cleaning is completed in less than 10 minutes, the \nrobot will clean the area twice.\n • If the battery runs low during a cleaning cycle, the \nrobot will automatically return to the dock. After \ncharging, the robot will resume where it left off.\n • The robot will retract the mop cloth mounts to clean \nthe carpet. You can also set the carpet as a no-go \nzone in the app to avoid it.\n • Before starting each cleaning task, make sure that the \nmop cloths have been properly installed.\nNote: The robot cannot be turned off when it is being charged.\nInstructions for UseC\nAdding the Cleaning SolutionC1\nRemove the dust container cover, \npull out the entire cleaning solution \ncartridge by its bottom handle, and \nthen place it on a hard, flat surface.\nC1-1—\nOpen the lid of the cartridge and \nadd cleaning solution.\nC1-2—\nClose the lid and put the cartridge back \nto the dock. Press down the cartridge \nuntil you hear it lock with a click. \nC1-3—\nInstall the dust container cover in place \nto make sure the dust container is \nsecurely sealed.\nC1-4—\nNotes:\n • Make sure that the cleaning solution cartridge is \nNote: To prevent the dust container cover from falling \nand hitting the robot, remove the cover with both \nhands, one on each side.\nPress  to start Mop Only. The main brushes \nrise, the main brushes and fan stop operating, \nand the VibraRise module lowers.\nNote: Compared with the traditional cleaning mode, \nnoise emanating from Mop Only is much lower.\nPress  and  simultaneously to start spot \ncleaning.\nCleaning range: The robot cleans a 1.5 m \n(4.9 ft) × 1.5 m (4.9 ft) square area centered \non itself.\nNote: After spot cleaning, the robot will automatically \nreturn to the starting point and wait for orders.', 'C1-2—\nClose the lid and put the cartridge back \nto the dock. Press down the cartridge \nuntil you hear it lock with a click. \nC1-3—\nInstall the dust container cover in place \nto make sure the dust container is \nsecurely sealed.\nC1-4—\nNotes:\n • Make sure that the cleaning solution cartridge is \nNote: To prevent the dust container cover from falling \nand hitting the robot, remove the cover with both \nhands, one on each side.\nPress  to start Mop Only. The main brushes \nrise, the main brushes and fan stop operating, \nand the VibraRise module lowers.\nNote: Compared with the traditional cleaning mode, \nnoise emanating from Mop Only is much lower.\nPress  and  simultaneously to start spot \ncleaning.\nCleaning range: The robot cleans a 1.5 m \n(4.9 ft) × 1.5 m (4.9 ft) square area centered \non itself.\nNote: After spot cleaning, the robot will automatically \nreturn to the starting point and wait for orders.\nWhen the robot is running, press any button \nto pause it, press  to resume cleaning, \npress  to send it back to the dock, and \nSpot CleaningC5\nMop OnlyC6\nPauseC7\nIf you cannot connect to the robot due to your \nrouter configuration, a forgotten password, or any other \nreason, reset the WiFi and add your robot as a new device.\nNote: entirely removed before adding cleaning solution.\n • To prevent corrosion or damage, do not use \nany disinfectant and only use cleaning solution \nrecommended by Roborock in the solution cartridge.\n • Cleaning solution is not included in the package. \nPurchase one if needed.']",The Roborock S8 MaxV Ultra and the Roborock S7 Pro Ultra both feature automatic mop washing.,"Roborock S7 Pro Ultra, S8 MaxV Ultra and Qrevo Pro support automatic mop washing.",0.5,0.0,0.0,800,250
Does Roborock S9 exist?,"['05\nRestrictions\n • Only use the product in accordance with the User Manual. Any loss or damage caused by improper use will be borne by the user.\n • Roborock assumes responsibility only for losses resulting from installation performed by authorized Roborock technicians, excluding losses \narising from incorrect installation by other people.\n • Before installing/removing the dock and its pipes, make sure the dock is disconnected from the power source.\n • Make sure dustbin, washable filter, dust bag, side brush, mop cloths, main brushes and main brush cover are installed in place before \ncleaning.\n • Do not sit or stand on the robot or dock.\n •To prevent corrosion or damage, do not use any disinfectant and only use cleaning solution recommended by Roborock in the solution cartridge.\n •Do not put any low objects (such as shoes, mats) near raised areas like stairs. Otherwise, the robot may fall down caused by malfunctional sensors.\n • To prevent water damage, make sure that the floor where the robot operates is free of water.\n • Do not use this product on elevated surfaces without barriers such as the floor of a loft, an open-ended terrace, a slide, or top of furniture.\n • To prevent blocking the product and to avoid damage to valuables, remove lightweight items (such as plastic bags) and fragile objects (such \nas vases) from the floor before cleaning.\n • Do not use the product to clean hard or sharp objects (such as decoration wastes, glass, and nails) to avoid scratching the robot or the floor.\nSafety Information\nWARNING \nCAUTION\n • For the purposes of recharging the battery, only use the detachable supply unit roborock EWFD13HRR or EWFD14HRR provided with this product.\n • To prevent injury caused by blades used to cut hair inside the main brush cover, make sure to install two main brushes in place before \ninstalling the main brush cover.\n • The product must be switched off and the plug must be removed from socket outlet before cleaning or maintaining the product.\n • In order to avoid a hazard due to inadvertent resetting of the thermal cut-out, this appliance must not be supplied through an external \nswitching device, such as a timer, or connected to a circuit that is regularly switched on and off by the utility.\n • Old hose-sets should not be reused. Only use new pipes provided with this product or recommended by Roborock.\n • Place the dock in a dry place. Keep it a distance of more than 1.2m (4 ft) from baths and shower heads or isolate it with walls or a door to \nprevent the dock from moisture exposure.\n • Install the dock in compliance with local regulations.\n • Do not move a properly installed dock.\n • Do not rinse the robot and the dock.', '09\nPlacing a paused robot on the dock manually will end \nthe current cleanup.\nNote:\nWhen the robot is running, press any \nbutton to pause it, press the  button to \nresume cleaning, press the  button to \nsend it back to the dock.\nPause\nIf the robot is paused for over 10 minutes, it \nwill go to sleep, and the power indicator will \nflash every few seconds. Press any button \nto wake the robot up.\nSleep\nNotes:\n • The robot will not go to sleep when it is charging.\n • The robot will automatically shut down if left in sleep mode \nfor more than 12 hours.\nThe default Do Not Disturb (DND) period is \nfrom 22:00 to 08:00. You can use the app to \ndisable the DND mode or modify the DND \nperiod. When DND mode is activated, the \nrobot will not automatically resume cleanup, \nthe power indicator light will dim, and the \nvolume of the voice prompts will lower.\nDND Mode\nChild Lock\nPress and hold the  button to enable/\ndisable the child lock. You can also set it in \nthe app. Once enabled, the robot will not \nreact to button presses when it is \nstationary. When the robot is cleaning or \ndocking, press any button to stop it.\nError\nIf an error occurs, the power indicator will \nflash red and a voice alert will sound. See \n“Errors” for solutions.\nNotes:\n • The robot will go to sleep automatically if left in a \nmalfunctioning state for over 10 minutes.\n • Placing a malfunctioning robot on the dock manually will \nend the current cleanup.\nRestore Factory Settings\nIf the robot does not function properly after \na system reset, switch it on. Press and hold \nthe  button and at the same time press \nReset button until you hear the “Restoring \nfactory settings” voice prompt. The robot \nwill then be restored to factory settings.\nApp Features\nCleaning Map\n • Multi-Map Management\n • Real-Time Vacuum and Mop Route\n • Carpet Display\n • Map Zoning\n • Map Editing\nCustom Cleaning Modes\n • Scheduled\n • Selective Room\n • Zone\n • No-Go Zones and Invisible Wall\n • Custom\n • Carpet Boost\n • Mop Wash Interval Settings\nCleaning Mode Switch\n • Suction Power Levels\n • Washing Intensity Levels \n • Mop Washing Modes\n • Custom Modes\nRobot Information\n • Cleaning History\n • Battery Level\n • Care & Maintenance\nStopping Emptying\nPress any button to stop emptying.\nCharging\nAfter cleaning,  the robot will automatically \nreturn to the dock to charge.\nIn Pause mode, press the  button to send \nthe robot back to the dock. The power \nindicator will pulse as the robot charges.\nIf the robot fails to find the dock, it will automatically \nreturn to its starting location. Place the robot on the dock \nmanually to recharge.\nNote:\nSystem Reset\nIf the robot does not respond when a \nbutton is pressed or cannot be turned off, \nreset the system. Press the Reset button, \nand the robot will reset automatically.\nAfter resetting the system, scheduled cleaning, WiFi, \netc. will be restored to factory settings.\nNote:', '07\nOption 2: Search for “Xiaomi Home” in the \nApp Store or Google Play or scan the QR \ncode to download and install the app.\nConnecting to the App\nOption 1: Search for “Roborock” in the App \nStore or Google Play or scan the QR code to \ndownload and install the app.\n❶ Download App\nThis robot supports both Roborock and \nXiaomi Home apps. Choose the one that \nbest meets your needs.\nThe robot may not be turned on when the battery \nis low. In this case, connect the robot to the dock.\nNote:Notes:\n • If the power cable hangs vertically to the ground, it may \nbe caught by the robot, causing the dock to be moved or \ndisconnected.\n • The dock indicator is on when the dock is powered on, and \noff when the robot is charging.\n • The dock indicator turns red if an error occurs.\n • Place the dock on a flat floor away from fire, heat, and \nwater. Avoid narrow spaces or locations where the robot \nmay be suspended in the air.\n • Placing the dock on a soft surface (carpet/mat) may cause \nthe dock to tilt over and cause problems docking and \ndeparting.\n • Keep the dock away from direct sunlight or anything that \nmay block the dock location beacon; otherwise, the robot \nmay fail to return to the dock.\n • Do not use the dock without clean water tank, dirty water \ntank, high-speed maintenance brush, dustbin, dust bag or \nwater filter.\n • Maintain the dock according to the maintenance \ninstructions. Do not clean the dock with a wet cloth or \ntissue.\n • All docks are subject to water-based tests before leaving the \nfactory. It is normal that a small amount of water remains in \nthe waterway of the dock.\nB1-5—more than 0.5 m (1.6 ft)\nB1-6—more than 1.5 m (4.9 ft)\nB1-7—more than 1 m (3.3 ft)\nB2  Power on and charge the \nrobot\nPress and hold the  button to power on \nthe robot. When the power light goes on, \nplace the robot on the dock to charge. Make \nsure the charging dock power indicator \nturns off and a “charging” voice alert sounds. \nTo maintain the performance of the high-\nperformance lithium-ion rechargeable \nbattery pack, keep the robot charged.\nPlace the dock on a hard and flat floor \n(wood/tile/concrete etc.), flat against a \nwall. Keep at least 0.5 m (1.6 ft) of \nclearance on either side, 1.5 m (4.9 ft) \nin front, and 1 m (3.3 ft) above. Make \nsure the location has good WiFi for a \nbetter experience with the mobile \napp, and then plug it in.\nB1-4—\n❷ Reset WiFi\n1. Open the top cover and find the WiFi \nindicator.\n2. Press and hold the  and  buttons until \nyou hear the “Resetting WiFi” voice alert. \nThe reset is complete when the WiFi \nindicator flashes slowly. The robot will then \nwait for a connection.\nOpen the Roborock App, tap the “Search for \ndevice” button, or open Xiaomi Home app, \ntap “+” in the top right corner and add the \ndevice as instructed in the app.', '08\nInstructions\nNotes:\n • To prevent corrosion or damage, only use the Roborock \nbranded floor cleaner in the water tank.\n • To avoid water tank deformation, do not place hot water \nin the tank.\n • If water marks remain on the water tank, wipe them clean \nbefore reinstallation.\nFilling the Clean Water Tank\nOpen the clean water tank. Fill with water \nuntil the Max line. Close the lid, lock the \nlatch, and fit the tank back in place.\nThe robot cannot be turned off when it is being \ncharged.\nNote:\nPress and hold the  button to turn on the \nrobot. The power indicator will turn on and \nthe robot will enter standby mode. Press \nand hold the  button to turn off the robot \nand complete the cleaning cycle.\nOn/Off\nPress the  button to start cleaning. The \nrobot will plan its cleaning route according \nto its scan of the room. It splits a room into \nzones, first draws out zone edges, and then \nfills the zone in a zigzag pattern. In so \ndoing, the robot cleans all zones one by \none, efficiently cleaning the house.\nStarting Cleaning\nZone 1 – Cleaned\nZone 4 – Next Zone\nZone 2 – Cleaned\nZone 3 – In Progress\nNotes:\n • To allow the robot to automatically vacuum and return to \nthe dock, start the robot from the dock. Do not move the \ndock during cleaning.\n • Cleaning cannot start if the battery level is too low. Allow the \nrobot to charge before starting cleanup.\n • If cleaning is completed in less than 10 minutes, the area \nwill be cleaned twice.\n • If the battery runs low during the cleaning cycle, the robot \nwill automatically return to the dock. After charging, the \nrobot will resume where it left off.\n • Automatic mop washing will not work if the dock \nencounters an error during cleaning. Wash the mop \nmanually to restore.\n • When the mop mount is attached, the robot will retract it \nwhen cleaning the carpet. You can also set the carpet as a \nno-go zone in the app to avoid it.\n • Before starting each mopping task, make sure that the \nVibraRise mop has been properly installed.\nAfter spot cleaning, the robot will automatically return \nto the starting point and enter Standby mode.\nNote:\nPress the  button to start spot cleaning.\nCleaning range: The robot cleans a 1.5 m \n(4.9 ft) x 1.5 m (4.9 ft) square area centered \non itself.\nSpot Cleaning Manually Activated Emptying\nAuto-Emptying\nEmptying can be triggered manually by \npressing the  button while the robot is \ncharging.\nAuto-emptying will begin when the robot \nreturns to the dock after cleaning.\nAvoid frequent manual emptying.Note:\nNotes:\n • If the dock has not emptied for an extended period, \nempty the robot dustbin manually and clear the air \ninlet of any debris to ensure optimum performance.\n • If necessary, auto-emptying can be disabled in the \napp.\nManually Activated Mop \nWashing\nDuring cleaning, press any button to pause, \nthen press and hold the  button to send \nthe robot back for mop washing.\nAuto Mop Washing\nDuring cleaning, the robot automatically \ndetermines when it should return to dock \nfor mop washing and water tank refilling to \nmaximize its mopping performance.', '02\nEnglish 02\nFrançais 15\nDeutsch 26\nEspañol 37\nEnglish\nEnglish Contents\n03 Safety Information\n04 International Symbols Explanation\n05 Product Overview\n06 Installation\n07 Connecting to the App\n08 Instructions\n10 Routine Maintenance\n12 Basic Parameters\n13 Common Issues', '12\nIf the robot is paused for over 10 minutes, \nit will go to sleep, and the power indicator \nlight will flash every few seconds. Press any \nbutton to wake the robot up.\nNotes:\n • The robot will not go to sleep when it is charging.\n • The robot will automatically shut down if left sleep for \nmore than 12 hours.\nSleepC8\nNotes:\n • To make sure the robot to wash the mop cloths \nautomatically, start the robot from the dock and do \nnot move the dock during cleaning.\n • Mop wash frequency and mode can be modified in \nthe app.\n • To avoid burns from hot water, do not touch the water \noutlets.\nAfter cleaning, the robot will return to \nEmptyingC10\nNotes:\n • When emptying has been left unused for a long \nperiod, empty the dustbin manually and make sure \nthe air inlet is clear for optimal emptying performance.\n • Auto-emptying can be disabled in the app.\n • Avoid frequent manual emptying.\nDuring cleaning, the robot automatically \ndetermines when it should return to the dock \nfor mop washing and water tank refilling \nto maximize its mopping performance. To \nmanually start washing, press and hold  \nor tap the corresponding button in the app. \nPress any button to stop washing.\nWashing the Mop ClothsC9\nDrying starts automatically after mop\nwashing or after cleaning is completed. \nTo manually start or stop drying, tap the \ncorresponding button in the app.\nNotes:\n • Stay away from the drying air outlets during drying.\n • Drying duration can be modified in the app.\n • Auto-drying can be disabled in the app.\nDryingC11\nNote: Smart Cleaning Solution Filling can be disabled \nin the app.\nThe robot will automatically add cleaning \nsolution to the water for mop washing and \nrobot water tank refilling according to the \npreset ratio to ensure optimal mopping \nperformance.\nAuto Cleaning Solution AdditionC12\nNote: If the robot fails to find the dock, it will automatically \nreturn to its starting position. Place the robot on the \ndock manually to recharge.\nAfter cleaning, the robot will automatically \nreturn to the dock to charge.\nChargingC13\nThe default Do Not Disturb (DND) period is \nfrom 22:00 to 08:00. You can use the app to \ndisable the DND mode or modify the DND \nperiod, or set whether to enable auto top-\nup, emptying and drying, to dim the button \nlight, or lower the volume of the voice \nmessage during the DND period.\nDND ModeC14\nPress and hold  to enable/disable Child \nLock. You can also set it in the app. Once \nenabled, the robot will not react to button \npresses when it is stationary. When the \nrobot is cleaning or docking, press any \nbutton to pause it.\nIf an error occurs, the power indicator light \non the robot will flash red or status indicator \nlight on the dock will be steady red. A pop-\nup notification will appear in the app and a \nvoice alert may sound.\nChild LockC15\nErrorC16\nNotes:\n • The robot will go to sleep automatically if left in a \nmalfunctioning state for over 10 minutes.\nNote: Placing a paused robot on the dock manually will \nend the current cleanup.\npress and hold  to wash the mop cloths \nand then resume cleaning.']",There is no mention of a Roborock S9 in the provided text. The documents discuss the Roborock S8 MaxV Ultra and the Roborock S7 Pro Ultra.,I could not find that information in the provided manuals.,0.3333333333333333,0.0,0.0,800,250
