user_input,retrieved_contexts,response,reference,faithfulness,context_precision,context_recall,chunk_size,chunk_overlap
How do I reset Wi-Fi on Roborock S7 Pro Ultra?,"['008\nConnecting to the App\nSearch for “Roborock” in the App Store or \nGoogle Play or scan the QR code to download \nand install the app.\n1. Download App\na. Open the top cover and find the WiFi \nindicator light.\n2. Reset WiFi\nb. Press and hold the  and  buttons \nuntil you hear the “Resetting WiFi” voice \nmessage. The reset is complete when the \nWiFi indicator light flashes slowly. The \nrobot will then wait for a connection.\nIf you cannot connect to the robot due to your \nrouter configuration, a forgotten password, or any other \nreason, reset the WiFi and add your robot as a new device.\nNote:\nNotes:\n • The actual process may vary due to ongoing app updates. \nFollow the guide provided in the app.\n • Only 2.4 GHz WiFi is supported.\nOpen the Roborock app, tap the “Scan to \nConnect” or “Search for Device” button and \nadd your device as instructed in the app.\n3. Add Device\nC2-1—Zone 1 – Cleaned.\nC2-2—Zone 2 – Cleaned.\nC2-3—Zone 3 – In Progress.\nC2-4—Zone 4 – Next Zone.\nNotes:\n •To allow the robot to automatically vacuum and return \nto the dock, start the robot from the dock. Do not move \nthe dock during cleaning.\n • Cleaning cannot start if the battery level is too low. \nAllow the robot to charge before starting the cleanup.\n • Before cleaning, tidy cords (including the power cord \nof the dock) and valuables from the floor. Loose \nitems may be dragged by the robot, resulting in the \ndisconnection of electrical appliances or damage of \ncords and property.\n • If cleaning is completed in less than 10 minutes, the \narea will be cleaned twice.\n • If the battery runs low during a cleaning cycle, the robot \nwill automatically return to the dock. After charging, \nthe robot will resume where it left off.\n • The robot will retract mop cloth mounts when cleaning \nthe carpet. You can also set the carpet as a no-go \nzone in the app to avoid it.\n • Before starting each cleaning task, make sure that the \nmop cloths have been properly installed.\nSpot Cleaning\nPress and hold the  button to start spot \ncleaning in pause mode.\nCleaning range: The robot cleans a 1.5 m (4.9 ft) x \n1.5 m (4.9 ft) square area centered on itself.\nPress and hold  to turn on the robot. The \npower indicator light will come on, and the \nrobot will wait for orders.\nPress and hold the  button to turn off the \nrobot and complete the cleaning cycle.\nOn/Off\nThe robot cannot be turned off when it is being charged.Note:\nInstructions for UseC\nRemove and open the clean water tank and \nfill the tank with water to MAX. Close the lid, \nlock the latch, and fit the tank back in place.\nNotes:\n • To prevent corrosion or damage, do not use any disinfectant \nand only use cleaning solution recommended by Roborock \nin the water tank.\n • Do not add too much cleaning solution to prevent the \nrobot from working improperly due to slipping.\n • To avoid water tank deformation, do not place hot water \nin the tank. \n • If water marks remain on the water tank, wipe them \nclean before reinstallation.\nC1 Filling the Water Tank\nPress the  button to start cleaning. The \nrobot will plan its cleaning route according \nto its scan of the room. It splits a room \nC2 Starting Cleaning\ninto zones, first draws out zone edges, and \nthen fills the zone in a zigzag pattern. In \nso doing, the robot cleans all zones one by \none, efficiently cleaning the house.\nAfter spot cleaning, the robot will automatically \nreturn to the starting point and wait for orders.\nNote:', '13\nIf the robot does not respond when a button \nis pressed or cannot be turned off, reset the \nsystem by pressing the Reset button.\nResetting the SystemC17\nNote: After resetting the system, existing settings such \nas scheduled cleaning and WiFi will be restored to \nfactory settings.\nTo disconnect the robot from WiFi, press \nthe Reset button until you hear a voice \nmessage. Then wait for 5 minutes and the \nWiFi will be automatically deactivated. If you \nwant to reconnect, please follow the related \nconnecting instructions.\nIf the robot does not function properly after \na system reset, switch it on. Press and hold  \n and at the same time, press the Reset \nbutton until you hear the “Restoring \nfactory settings” voice message. The robot \nwill then be restored to factory settings.\nDeactivating WiFiC18\nRestoring Factory SettingsC19\nNote: The frequency of replacement may vary with the \nactual situation. If abnormal wear occurs, replace the \nparts immediately.\n* Clean every 2 weeks and replace every 6-12 months.\nMain BrushesD1\nRoutine MaintenanceD\nD1-1—Hair-Blocking Rings \nD1-2—Main Brush Caps \nD1-3—Main Brush Cover \nD1-4—Latches \nD1-5—Main Brushes \nD1-6—Main Brush Bearing\nTurn over the robot and press the \ntwo latches inwards to remove the \nmain brush cover.\nD1-7—\nPull out the main brushes and \nremove the main brush bearings, \nmain brush caps, and hair-blocking \nrings. Remove any entangled hair \nor dirt at both ends of the main \nbrushes. Then, reinstall the hair-\nblocking rings, main brush caps, and \nthen main brush bearings. \nD1-8—\nUnscrew the side brush screw. Remove and \nclean the side brush. Reinstall the brush \nand tighten the screw.\nNotes:\n • It is recommended to wipe the main brushes with a \nwet cloth. If the main brushes are wet, air-dry them \naway from direct sunlight.\n • Do not use corrosive cleaning fluid or disinfectant to \nclean the main brushes.\n* Clean monthly and replace every 3-6 months.\nFlexible Side BrushD2\nReinstall the main brushes. Firmly snap \nthe main brush bearings into place. \nOnly after the bearings are securely \ninstalled, fit the main brush cover.\nD1-9—\nReinstall the main brush cover. Make \nsure its four teeth are fully seated in \nthe slots, and press the main brush \ncover until you hear it lock with a click.\nD1-10 —\n • Placing a malfunctioning robot on the dock manually \nwill end the current cleanup.\n •To prevent injury caused by blades used to cut hair inside \nthe main brush cover, make sure to install two main \nbrushes in place before installing the main brush cover.\nUse a tool, such as a small \nscrewdriver, to pry out the axle and \ntake out the wheel.\nD3-1—\n* Clean as required.\nOmnidirectional WheelD3\nThe omnidirectional wheel bracket cannot be \nremoved.\nNote:\nRinse the wheel and the axle with \nwater to remove any hair and dirt. \nAir-dry, reinstall, and press the wheel \nand axle back in place.\nD3-2—\nClean the main wheels with a soft, dry cloth.\n* Clean as required.\nMain WheelsD4\n* Clean as required.\nDustbinD5\nRemove the magnetic top cover and \npress the dustbin latch to take out \nthe dustbin.\nD5-1—\nRemove the washable filter and \nempty the dustbin.\nD5-2—', '07\nEmpty Wash Fill Dock AutoA11\nA11-1—Charging Contacts\nA11-2—Robot Refill Port\nA11-3—Dust Container Cover\nA11-4—Drying Air Outlets\nPress any button to pause the robot during \ncleaning or docking.\nNote:\n • White: Battery level ≥ 15%\n • Red: Battery level < 15%\n • Breathing: Charging or starting up\n • Flashing red: Error\n • Flashing red and white alternately: \nRemote viewing or cruising\n • Press and hold to turn the robot \non or off\n • Press to start cleaning\n—Power/Clean\n—Power Indicator Light\n • Press to start docking/emptying\n • Press and hold to wash the mop \ncloths\n—Dock\n • Press to start Mop Only\n • Press and hold for 3 seconds to \nenable/disable Child Lock \n—Mop Only/Child Lock\n • Off: WiFi disabled\n • Flashing slowly: Waiting for \nconnection\n • Flashing quickly: Connecting\n • Steady: WiFi connected\n • Flashing slowly: Starting up\n • Flashing quickly: Waiting for voice \ncommands\nProduct OverviewA\nA1  Robot (Top View)\nA2  Robot (Bottom View)\nA3  Robot (Top Cover Removed)\nA1-1—Voice Assistant Indicator Light\nA2-1—Cliff Sensors\nA2-2—Carpet Sensor\nA2-3—Omnidirectional Wheel\nA2-4—Flexible Side Brush\nA2-5—Main Brushes\nA2-6—Main Brush Cover Latches\nA2-7—Main Wheels\nA3-1—Magnetic Top Cover\nA3-2—WiFi Indicator Light\nA3-3—Reset Button\nA3-4—Charging Contacts\nA3-5—Communication Sensor\nA3-6—Self-Filling Port\nA3-7—Positioning Button\nA3-8—Air Outlets\nA3-9—VibraRise Module\nA3-10—Bumper\nThe mop cloth mounts are non-detachable.Note:\nVibraRise ModuleA4\nA5-1—Hook and Loop Pads\nA6-1—Mop Cloth Screw\nA7-1—Dustbin Latch\nA7-2—Filter Latch\nA7-3—Air Inlet\nA7-4—Washable Filter\nA7-5—Suction Inlet\nVibraRise Mop ClothA5\nDustbin A7\nDock BaseA8\nDisposable Dust BagA9\nEdgewise Mop ClothA6\nPower CordA10\n •For use with video calls and voice \ncontrol.\nA1-2—Vertical Bumper\nA1-3—LiDAR Sensor\nA1-4—Microphones\nA1-5—Wall Sensor\nA1-6—Reactive AI Obstacle Recognition \nSensor\nA1-7—Dock Locator\nA1-8—LED Fill Light\nNote: Secure the mop cloth flat in place.\nA4-1—Mop Cloth Attachment Slot\nA4-2—Vibration Module\nA4-3—Edgewise Mopping Module', '08\nInstructions\nNotes:\n • To prevent corrosion or damage, only use the Roborock \nbranded floor cleaner in the water tank.\n • To avoid water tank deformation, do not place hot water \nin the tank.\n • If water marks remain on the water tank, wipe them clean \nbefore reinstallation.\nFilling the Clean Water Tank\nOpen the clean water tank. Fill with water \nuntil the Max line. Close the lid, lock the \nlatch, and fit the tank back in place.\nThe robot cannot be turned off when it is being \ncharged.\nNote:\nPress and hold the  button to turn on the \nrobot. The power indicator will turn on and \nthe robot will enter standby mode. Press \nand hold the  button to turn off the robot \nand complete the cleaning cycle.\nOn/Off\nPress the  button to start cleaning. The \nrobot will plan its cleaning route according \nto its scan of the room. It splits a room into \nzones, first draws out zone edges, and then \nfills the zone in a zigzag pattern. In so \ndoing, the robot cleans all zones one by \none, efficiently cleaning the house.\nStarting Cleaning\nZone 1 – Cleaned\nZone 4 – Next Zone\nZone 2 – Cleaned\nZone 3 – In Progress\nNotes:\n • To allow the robot to automatically vacuum and return to \nthe dock, start the robot from the dock. Do not move the \ndock during cleaning.\n • Cleaning cannot start if the battery level is too low. Allow the \nrobot to charge before starting cleanup.\n • If cleaning is completed in less than 10 minutes, the area \nwill be cleaned twice.\n • If the battery runs low during the cleaning cycle, the robot \nwill automatically return to the dock. After charging, the \nrobot will resume where it left off.\n • Automatic mop washing will not work if the dock \nencounters an error during cleaning. Wash the mop \nmanually to restore.\n • When the mop mount is attached, the robot will retract it \nwhen cleaning the carpet. You can also set the carpet as a \nno-go zone in the app to avoid it.\n • Before starting each mopping task, make sure that the \nVibraRise mop has been properly installed.\nAfter spot cleaning, the robot will automatically return \nto the starting point and enter Standby mode.\nNote:\nPress the  button to start spot cleaning.\nCleaning range: The robot cleans a 1.5 m \n(4.9 ft) x 1.5 m (4.9 ft) square area centered \non itself.\nSpot Cleaning Manually Activated Emptying\nAuto-Emptying\nEmptying can be triggered manually by \npressing the  button while the robot is \ncharging.\nAuto-emptying will begin when the robot \nreturns to the dock after cleaning.\nAvoid frequent manual emptying.Note:\nNotes:\n • If the dock has not emptied for an extended period, \nempty the robot dustbin manually and clear the air \ninlet of any debris to ensure optimum performance.\n • If necessary, auto-emptying can be disabled in the \napp.\nManually Activated Mop \nWashing\nDuring cleaning, press any button to pause, \nthen press and hold the  button to send \nthe robot back for mop washing.\nAuto Mop Washing\nDuring cleaning, the robot automatically \ndetermines when it should return to dock \nfor mop washing and water tank refilling to \nmaximize its mopping performance.\nTo allow the robot to wash the mop automatically, \nstart the robot from the dock once it is fully charged. Do \nnot move the dock during cleaning.\nNote:', '11\nNotes:\n • The actual process may vary due to ongoing app \nupdates. Follow the guide provided in the app.\n • Only 2.4 GHz WiFi is supported.\n3. Add Device\nOpen the Roborock app, tap the ""Scan to \nConnect"" or ""Search for Device"" button and \nadd your device following the in-app guide. During operation, the dock will automatically \nfill and drain water.\nFilling/DrainingC2\nPress and hold  to turn on the robot. The \npower indicator light will come on, and the \nrobot will wait for orders.\nPress and hold  to turn off the robot and \ncomplete the cleaning cycle.\nTurning On/OffC3\nPress  to start cleaning. The robot will plan its \ncleaning route and in each room, it firstly draws \nout zone edges and then fills the room in a \nzigzag pattern. In so doing, the robot cleans all \nrooms one by one, thoroughly and efficiently.\nStarting CleaningC4\nZone 1 – Cleaned\nZone 4 – Next Zone\nZone 2 – Cleaned\nZone 3 – In Progress\nNotes:\n • To make sure the robot returns to the dock \nautomatically, start the robot from the dock and do \nnot move the dock during cleaning.\n • Cleaning cannot start if the battery level is too low. \nAllow the robot to charge before starting a cleanup.\n • If cleaning is completed in less than 10 minutes, the \nrobot will clean the area twice.\n • If the battery runs low during a cleaning cycle, the \nrobot will automatically return to the dock. After \ncharging, the robot will resume where it left off.\n • The robot will retract the mop cloth mounts to clean \nthe carpet. You can also set the carpet as a no-go \nzone in the app to avoid it.\n • Before starting each cleaning task, make sure that the \nmop cloths have been properly installed.\nNote: The robot cannot be turned off when it is being charged.\nInstructions for UseC\nAdding the Cleaning SolutionC1\nRemove the dust container cover, \npull out the entire cleaning solution \ncartridge by its bottom handle, and \nthen place it on a hard, flat surface.\nC1-1—\nOpen the lid of the cartridge and \nadd cleaning solution.\nC1-2—\nClose the lid and put the cartridge back \nto the dock. Press down the cartridge \nuntil you hear it lock with a click. \nC1-3—\nInstall the dust container cover in place \nto make sure the dust container is \nsecurely sealed.\nC1-4—\nNotes:\n • Make sure that the cleaning solution cartridge is \nNote: To prevent the dust container cover from falling \nand hitting the robot, remove the cover with both \nhands, one on each side.\nPress  to start Mop Only. The main brushes \nrise, the main brushes and fan stop operating, \nand the VibraRise module lowers.\nNote: Compared with the traditional cleaning mode, \nnoise emanating from Mop Only is much lower.\nPress  and  simultaneously to start spot \ncleaning.\nCleaning range: The robot cleans a 1.5 m \n(4.9 ft) × 1.5 m (4.9 ft) square area centered \non itself.\nNote: After spot cleaning, the robot will automatically \nreturn to the starting point and wait for orders.\nWhen the robot is running, press any button \nto pause it, press  to resume cleaning, \npress  to send it back to the dock, and \nSpot CleaningC5\nMop OnlyC6\nPauseC7\nIf you cannot connect to the robot due to your \nrouter configuration, a forgotten password, or any other \nreason, reset the WiFi and add your robot as a new device.\nNote: entirely removed before adding cleaning solution.\n • To prevent corrosion or damage, do not use \nany disinfectant and only use cleaning solution \nrecommended by Roborock in the solution cartridge.\n • Cleaning solution is not included in the package. \nPurchase one if needed.', '05\nA5  Electric Water Tank\nA5-1—Stopper\nA5-2—Water Filter\nA5-3—Water Tank Latch\nA5-4—Self-Filling Port\nA4  Dustbin\nA4-1—Filter Cover\nA4-2—Dustbin Latch\nA4-3—Cover Latch\nA4-4—Air Inlet\nA4-5—Washable Filter\nA3  Robot (Upper Cover Open)\nA3-1—Vertical Bumper\nA3-2—LiDAR Sensor\nA3-3—WiFi Indicator Light\n • Off: WiFi disabled\n • Flashing slowly: Waiting for \nconnection\n • Flashing quickly: Connecting\n • Steady: WiFi connected\nA3-4—Reset Button\nA3-5—Water Tank\nA3-6—Dustbin\nA3-7—Mop Wash Sensor\nA3-8—Water Tank Latch\nA3-9—Positioning Button\nA3-10—VibraRise Module\nA3-11—Air Outlet\nA3-12—Bumper\nA1  Robot (Top View)\nPress any button to stop the robot during cleaning \nor docking.\nNote:\nA1-1—Dock Locator\n • Press to return to dock/start \nemptying\n • Press and hold to wash mop\nDock\n • Press to Spot clean\n • Press and hold for 3 seconds to \nturn on/off the child lock\nSpot Clean/Child Lock\n • White: Battery level ≥ 20%\n • Red: Battery level < 20%\n • Pulsing: Charging or starting up\n • Flashing red: Error\nPower Indicator\nPower/Clean\n • Press and hold to turn the robot \non or off\n • Press to start cleaning\nProduct OverviewA\nA2  Robot (Bottom View)\nA2-1—Wall Sensor\nA2-2—Charging Contacts\nA2-3—Carpet Sensor\nA2-4—Omni-Directional Wheel\nA2-5—Side Brush \nA2-6—Main Wheel\nA2-7—Main Brush\nA2-8—Main Brush Cover Latches\nA2-9—Cliff Sensors\nA6  VibraRise Mop Mount\nA6-1—Mop Cloth Attachment Slot\nA6-2—Vibration Module\nA8  Power Cable\nA9  Dock Base\nA10 Disposable Dust Bag\nA7  VibraRise Mop Cloth\nA7-1—Hook and Loop Pads\nThe VibraRise mop mount is non-detachable.Note:', '12\nRemove the water filter and wipe off \nany water marks with a cloth.\nCarefully place the the dock upside \ndown on a hard floor covered with \na soft towel.\nUnscrew the eight screws and \nremove the cover.\nWipe the air duct and duct cover \nwith a dry cloth.\nRe-install the cover and screw it \nback in place.\nC16-2—\nC16-3—\nC16-4—\nC16-5—\nC16-6—\nBasic Parameters\nRobot\nThe serial number is on a sticker on the underside of \nthe robot.\nNote:\n< 6 hoursCharging Time\nS300RRModel\n14.4V/5200mAh\nlithium-ion batteryBattery\nRated Input 20VDC 1.8A\nEmpty Wash Fill Dock\nModel EWFD01HRR, EWFD02HRR\nRated Frequency 50-60Hz\n220-240VACRated Input Voltage\n0.5ARated Input (Charge) \nRated Output 20VDC 1.8A\nCharging Battery 14.4V/5200mAh \nlithium-ion battery\n5ARated Input  \n(Dust Collection)', '10\n • Firmware Update\n • Volume Adjustment\n • Language Selection\n • Do Not Disturb Mode\n • Voice Assistant Support\nFunctions and details of the app may vary slightly due \nto the continuous app development and updates.\nNote:\nMore Features\nC1  Main Brush\n* Clean every 2 weeks and replace every 6-12 months.\nC1-1—Main Brush Cover\nC1-2—Latches\nC1-3—Main Brush\nC1-4—Main Brush Caps\nC1-5—Main Brush Bearing\nC1-6—Turn over the robot and press the \nlatches to remove the main brush cover.\nRotate the main brush caps in the \nindicated unlock direction to remove \nthe caps.\nC1-8—\nAfter removing the tangled hair or \ndirt at both ends of the main brush, \nreinstall it, press on the main brush \ncover to lock it in place.\nC1-9—\nNotes:\n • Main brush should be wiped down with wet cloth and left \nto dry away from direct sunlight.\n • Do not use corrosive cleaning fluids or disinfectants to \nclean the main brush.\nC2  Side Brush\n1. Unscrew the side brush screw.\n2. Remove and clean the side brush. \nReinstall the brush and tighten the screw.\n* Clean monthly and replace every 3-6 months.\nPull out the main brush and remove \nthe main brush bearing.\nC1-7—\nRoutine \nMaintenance\nC\nClean the main wheels with a soft, dry cloth.\nC4  Main Wheels\n* Clean monthly.\nC3  Omni-Directional Wheel\nUse a tool, such as a small \nscrewdriver, to pry out the axle and \ntake out the wheel.\nC3-1—\n* Clean as required.\nRinse the wheel and the axle with \nwater to remove any hair and dirt. \nDry and reattach the wheel, pressing \nit firmly in place.\nC3-2—\nThe omni-directional wheel bracket cannot be removed.Note:\nC5  Dustbin\nOpen the dustbin cover and remove \nthe filter, then empty the dustbin.\nC5-2—\nOpen the top cover of the robot and \ntake out the dustbin.\nC5-1—\n* Clean as required.\nFill the dustbin with clean water \nand close the cover. Gently shake \nthe dustbin, and then pour out the \ndirty water.\nC5-3—\nTo prevent blockage, only use clean water without any \ncleaning liquid.\nNote:\nLeave the dustbin and the washable \nfilter to dry.\nC5-4—\nPurchase an additional filter and alternate if necessary.\nRinse the filter repeatedly and tap it \nto remove as much dirt as possible.\nAllow 24 hours for the filter to dry \nthoroughly and reinstall it.\nDo not touch the surface of the filter with your hands, \nbrush, or hard objects to avoid potential damage.\nNote:\nNote:\nC6-3—\nC6-2—\nOpen the water tank and fill it with  \nclean water.\nClose the water tank and shake it \ngently.\nPour out the remaining water as \nshown.\nC7-1—\n* Clean as required.\nC7-2— \nC7-3—\nOpen the filter cover and remove the \nfilter.\nC6  Washable Filter\nC7  Water Tank\n* Clean every 2 weeks and replace every 6-12 months.\nC6-1—']","To reset the Wi-Fi on your Roborock S7 Pro Ultra, open the top cover to locate the Wi-Fi indicator light. Press and hold both the  and  buttons until you hear a voice message indicating ""Resetting WiFi."" The reset is complete when the Wi-Fi indicator light flashes slowly, and the robot will then be ready for a new connection. If you encounter issues connecting due to router configuration, a forgotten password, or other reasons, resetting the Wi-Fi will allow you to add your robot as a new device.",Open the top cover and locate the Wi-Fi indicator. Press and hold the Power and Home buttons until you hear 'Resetting WiFi'. The reset is complete when the Wi-Fi indicator flashes slowly and the robot waits for connection.,1.0,0.8333333332916666,1.0,1000,200
Which model has automatic mop washing?,"['12\nIf the robot is paused for over 10 minutes, \nit will go to sleep, and the power indicator \nlight will flash every few seconds. Press any \nbutton to wake the robot up.\nNotes:\n • The robot will not go to sleep when it is charging.\n • The robot will automatically shut down if left sleep for \nmore than 12 hours.\nSleepC8\nNotes:\n • To make sure the robot to wash the mop cloths \nautomatically, start the robot from the dock and do \nnot move the dock during cleaning.\n • Mop wash frequency and mode can be modified in \nthe app.\n • To avoid burns from hot water, do not touch the water \noutlets.\nAfter cleaning, the robot will return to \nEmptyingC10\nNotes:\n • When emptying has been left unused for a long \nperiod, empty the dustbin manually and make sure \nthe air inlet is clear for optimal emptying performance.\n • Auto-emptying can be disabled in the app.\n • Avoid frequent manual emptying.\nDuring cleaning, the robot automatically \ndetermines when it should return to the dock \nfor mop washing and water tank refilling \nto maximize its mopping performance. To \nmanually start washing, press and hold  \nor tap the corresponding button in the app. \nPress any button to stop washing.\nWashing the Mop ClothsC9\nDrying starts automatically after mop\nwashing or after cleaning is completed. \nTo manually start or stop drying, tap the \ncorresponding button in the app.\nNotes:\n • Stay away from the drying air outlets during drying.\n • Drying duration can be modified in the app.\n • Auto-drying can be disabled in the app.\nDryingC11\nNote: Smart Cleaning Solution Filling can be disabled \nin the app.\nThe robot will automatically add cleaning \nsolution to the water for mop washing and \nrobot water tank refilling according to the \npreset ratio to ensure optimal mopping \nperformance.\nAuto Cleaning Solution AdditionC12\nNote: If the robot fails to find the dock, it will automatically \nreturn to its starting position. Place the robot on the \ndock manually to recharge.\nAfter cleaning, the robot will automatically \nreturn to the dock to charge.\nChargingC13\nThe default Do Not Disturb (DND) period is \nfrom 22:00 to 08:00. You can use the app to \ndisable the DND mode or modify the DND \nperiod, or set whether to enable auto top-\nup, emptying and drying, to dim the button \nlight, or lower the volume of the voice \nmessage during the DND period.\nDND ModeC14\nPress and hold  to enable/disable Child \nLock. You can also set it in the app. Once \nenabled, the robot will not react to button \npresses when it is stationary. When the \nrobot is cleaning or docking, press any \nbutton to pause it.\nIf an error occurs, the power indicator light \non the robot will flash red or status indicator \nlight on the dock will be steady red. A pop-\nup notification will appear in the app and a \nvoice alert may sound.\nChild LockC15\nErrorC16\nNotes:\n • The robot will go to sleep automatically if left in a \nmalfunctioning state for over 10 minutes.\nNote: Placing a paused robot on the dock manually will \nend the current cleanup.\npress and hold  to wash the mop cloths \nand then resume cleaning.\nthe dock and auto-emptying will begin \nas needed. To manually start emptying, \npress  on the docked robot or tap the \ncorresponding button in the app. Press any \nbutton to stop emptying.\nPress  to send the paused robot back \nto the dock. The power indicator light will \nbreathe during robot charging.', '11\nNotes:\n • The actual process may vary due to ongoing app \nupdates. Follow the guide provided in the app.\n • Only 2.4 GHz WiFi is supported.\n3. Add Device\nOpen the Roborock app, tap the ""Scan to \nConnect"" or ""Search for Device"" button and \nadd your device following the in-app guide. During operation, the dock will automatically \nfill and drain water.\nFilling/DrainingC2\nPress and hold  to turn on the robot. The \npower indicator light will come on, and the \nrobot will wait for orders.\nPress and hold  to turn off the robot and \ncomplete the cleaning cycle.\nTurning On/OffC3\nPress  to start cleaning. The robot will plan its \ncleaning route and in each room, it firstly draws \nout zone edges and then fills the room in a \nzigzag pattern. In so doing, the robot cleans all \nrooms one by one, thoroughly and efficiently.\nStarting CleaningC4\nZone 1 – Cleaned\nZone 4 – Next Zone\nZone 2 – Cleaned\nZone 3 – In Progress\nNotes:\n • To make sure the robot returns to the dock \nautomatically, start the robot from the dock and do \nnot move the dock during cleaning.\n • Cleaning cannot start if the battery level is too low. \nAllow the robot to charge before starting a cleanup.\n • If cleaning is completed in less than 10 minutes, the \nrobot will clean the area twice.\n • If the battery runs low during a cleaning cycle, the \nrobot will automatically return to the dock. After \ncharging, the robot will resume where it left off.\n • The robot will retract the mop cloth mounts to clean \nthe carpet. You can also set the carpet as a no-go \nzone in the app to avoid it.\n • Before starting each cleaning task, make sure that the \nmop cloths have been properly installed.\nNote: The robot cannot be turned off when it is being charged.\nInstructions for UseC\nAdding the Cleaning SolutionC1\nRemove the dust container cover, \npull out the entire cleaning solution \ncartridge by its bottom handle, and \nthen place it on a hard, flat surface.\nC1-1—\nOpen the lid of the cartridge and \nadd cleaning solution.\nC1-2—\nClose the lid and put the cartridge back \nto the dock. Press down the cartridge \nuntil you hear it lock with a click. \nC1-3—\nInstall the dust container cover in place \nto make sure the dust container is \nsecurely sealed.\nC1-4—\nNotes:\n • Make sure that the cleaning solution cartridge is \nNote: To prevent the dust container cover from falling \nand hitting the robot, remove the cover with both \nhands, one on each side.\nPress  to start Mop Only. The main brushes \nrise, the main brushes and fan stop operating, \nand the VibraRise module lowers.\nNote: Compared with the traditional cleaning mode, \nnoise emanating from Mop Only is much lower.\nPress  and  simultaneously to start spot \ncleaning.\nCleaning range: The robot cleans a 1.5 m \n(4.9 ft) × 1.5 m (4.9 ft) square area centered \non itself.\nNote: After spot cleaning, the robot will automatically \nreturn to the starting point and wait for orders.\nWhen the robot is running, press any button \nto pause it, press  to resume cleaning, \npress  to send it back to the dock, and \nSpot CleaningC5\nMop OnlyC6\nPauseC7\nIf you cannot connect to the robot due to your \nrouter configuration, a forgotten password, or any other \nreason, reset the WiFi and add your robot as a new device.\nNote: entirely removed before adding cleaning solution.\n • To prevent corrosion or damage, do not use \nany disinfectant and only use cleaning solution \nrecommended by Roborock in the solution cartridge.\n • Cleaning solution is not included in the package. \nPurchase one if needed.', '17\nCommon Issues\nIssue Solution\nThe robot begins \nto miss certain \nspots\n • The wall sensor, cliff sensors, or carpet sensor may be \ndirty. Clean them with a soft, dry cloth.\nPoor cleaning \nperformance \nand/or dust \nleakage\n • The dustbin is full and needs emptying.\n • The filter is blocked and needs cleaning.\n • The main brushes are tangled up. Clean the main \nbrushes.\nNo or little water \nduring mopping\n • Use the mobile app to increase the scrub intensity & \nwater flow.\nThe status \nindicator light is \nsteady red\n • The dust container cover is not in place. Check and \ninstall in place.\n • Voltage error. Check that the local voltage meets the \nrequirements listed on the dock.\n • The refill and drainage pipes are not installed or not \nproperly installed.\n • Check that the water filter has been correctly installed.\nReduced \nemptying \nperformance or \nunusual noise \nwhen emptying\n • The main brushes or main brush cover is not properly \ninstalled. Check and install in place.\n • The filter, suction inlet, air inlet, or dustbin is blocked. \nClean to remove blockage.\nVoice alert Error \n42 occurs and \nthe maintenance \nbrush module \nstops at one side \nof the cleaning \ntank\n • If the brush module stops at the left side, it may be \njammed. Remove any items jamming it.\n • If the brush module stops at the right side, the filter \nmay be blocked or is not installed in place. Clean and \ninstall in place.\nIssue Solution\nReduced \nmop washing \nperformance\n • The mop cloths are not attached properly. Reinstall \nthem.\n • The floor is dirty. Change the mop washing mode to \n""Deep"" in the app for better cleaning.\nUnable to \nauto-empty\n • Auto-emptying is disabled. Check in-app settings.\n • Dock dust container cover is not installed. Check and \ninstall.\n • Auto-emptying will not be triggered if the robot \nreturns to the dock without cleaning.\n • The robot will not auto-empty after returning to the \ndock in DND mode. Adjust cleaning or DND period, or \nstart emptying manually. \nUnable to wash \nthe mop cloths\n • The mop cloths will not be washed if not used.\n • If the robot does not start from the dock or no dock \nis found on the app map, it will not return to the dock \nfor mop washing.\n • The refill and drainage pipes are not installed or not \nproperly installed.\n • Check that the water filter has been correctly installed.\nUnable to start \nauto-drying\n • Auto-drying is disabled. Check in-app settings.\n • If you press a robot button or the robot departs the \ndock during drying, the drying will end in advance.\n • In a humid environment, it is recommended to extend \nthe drying duration in the app to improve the drying \nperformance.\nUnable to wash \nthe mop cloths \nwith hot water\n • Check that Mop Washing with Hot Water is enabled in \nthe app.', '009\nPause\nWhen the robot is running, press any button \nto pause it, press the  button to resume \ncleaning, and press the  button to send it \nback to the dock.\nPlacing a paused robot on the dock manually will \nend the current cleanup.\nNote:\nSleep\nIf the robot is paused for over 10 minutes, \nit will go to sleep, and the power indicator \nlight will flash every few seconds. Press any \nbutton to wake the robot up.\nNotes:\n • The robot will not go to sleep when it is charging.\n • The robot will automatically shut down if left in sleep \nmode for more than 12 hours.\nDND Mode\nThe default Do Not Disturb (DND) period is \nfrom 22:00 to 08:00. You can use the app to \ndisable the DND mode or modify the DND \nperiod. When DND is on, the robot will not \nautomatically resume cleanup, the power \nindicator light will dim, and the volume of \nthe voice message will lower.\nWashing the Mop Cloths\nDuring cleaning, the robot automatically \ndetermines when it should return to \nthe dock for mop washing and water \ntank refilling to maximize its mopping \nIf an error occurs, the power indicator light \non the robot will flash red or status indicator \nlight on the dock will be steady red. A pop-\nup notification will receive in the app and a \nvoice alert may sound.\nError\n • The robot will go to sleep automatically if left in a \nmalfunctioning state for over 10 minutes.\n • Placing a malfunctioning robot on the dock manually \nwill end the current cleanup.\nNotes:\n • Drying duration can be modified in the app.\n • Auto-drying can be disabled through the app.\nNotes: \nCharging\nAfter cleaning, the robot will automatically \nreturn to the dock to charge. In Pause mode, \npress the  button to send the robot back to \nthe dock. The power indicator light will breath \nas the robot charges.\nIf the robot fails to find the dock, it will automatically \nreturn to its starting location. Place the robot on the dock \nmanually to recharge.\nNote:\nResetting the System\nIf the robot does not respond when a button \nis pressed or cannot be turned off, reset the \nsystem by pressing the Reset button.\nAfter resetting the system, existing settings such \nas scheduled cleaning and WiFi will be restored to factory \nsettings. \nNote:\nAuto-emptying will automatically begin when \nthe robot returns to the dock after cleaning. \nTo manually emptying, press  button on the \ndocked robot or tap the corresponding button \nin the app. Press any button to stop emptying. \nEmptying\n • When auto-emptying has been left unused for a long \nperiod, empty the dustbin manually and make sure \nthe air inlet is clear for optimal emptying performance.\n • Auto-emptying can be disabled through the app.\n • Avoid frequent manual emptying.\nNotes:\nDrying starts automatically after mop washing \nor after cleaning is completed. To manually \nstart or stopping drying, tap the corresponding \nbutton in the app. \nDrying\n • To allow the robot to wash the mop automatically, \nstart the robot from the dock and do not move the \ndock during cleaning.\n • Watch out for hot water and do not touch the water outlet.\n • Mop wash frequency and washing mode can be modified \nin the app. \nNotes:\nperformance. During cleaning, tap Dock \nbutton in the app to send robot back for \nmop washing. When the robot is charging, \npress and hold the  button on the robot or \ntap Wash button in the app to manually start \nwashing. Press any button to stop washing.\nDeactivating WiFi\nTo disconnect the robot from WiFi, press \nthe Reset button until you hear a voice', '14\nLift the high-speed maintenance brush \nlatch and remove the brush. Remove \nany entangled objects in the high-speed \nmaintenance brush and rinse it clean. \nReinstall the brush and latch it in place.\n* Clean as required and replace every 6-12 months.\nHigh-Speed Maintenance BrushD12\n* Replace regularly or when it is full.\nReplacing the Disposable \nDust Bag\nD15\nRemove the dust container cover.D15-1—\nRemove the cleaning tank.D14-1—\nCleaning Tank of Edgewise \nMopping Module\nD14\n* Clean as required.\nPull out the filter. Press the latch on the side \nof the filter to flip it downwards open. Rinse \nit with water, use a soft, dry cloth to wipe the \ncleaning tank, and then reinstall the filter by \nlocking the latch. Press down the filter until \nyou hear it lock with a click.\n* Clean as required.\nWater FilterD13\nNote: To prevent the dust container cover from falling \nand hitting the robot, remove the cover with both \nhands, one on each side.\nUnscrew the screw in the middle of \nthe mop cloth.\nD7-1—\n* Clean as required and replace every 3-6 months.\nEdgewise Mop ClothD7\nPurchase an additional filter and alternate if \nnecessary.\nNote:\nAllow at least 24 hours for the filter \nto dry thoroughly and reinstall it.\nD6-3—\nRemove the mop cloth from the mop \ncloth mount. Clean the mop cloth \nand air-dry it.\nD8-1—\nSlide the mop cloth in from the \nopening of the attachment slot, and \nthen stick it flat in place.\nD8-2—\nA dirty mop cloth will affect the mopping \nperformance. Clean it before use.\nNote:\nUse a soft, dry cloth to wipe and clean all \nsensors, including:\n* Clean as required and replace every 3-6 months.\nVibraRise Mop ClothD8\n* Clean as required.\nRobot SensorsD9\nUse a soft, dry cloth to wipe the charging \ncontacts on the robot and the dock.\n* Clean as required.\nCharging ContactsD10\nD9-1—Reactive AI Obstacle Recognition\n             Sensor\nD9-2—Dock Locator\nD9-3—Carpet Sensor\nD9-4—Wall Sensor\nD9-5—Communication Sensor\nD9-6—Cliff Sensors\nTo move the dock, grip the cord storage slot \non the back with one hand and the inner \nside of the front board with the other hand. \nMoving the DockD11\nWash the mop cloth and air-dry it.D7-2—\nReinstall the mop cloth and tighten \nthe screw.\nD7-3—\nA dirty mop cloth will affect the mopping \nperformance. Clean it before use.\nNote:\nRemove the filter.D6-1—\nRinse the filter repeatedly and tap it \nto remove as much dirt as possible.\nD6-2—\nDo not touch the surface of the filter with hands, \nbrush, or hard objects to avoid potential damage.\nNote:\n* Clean every 2 weeks and replace every 6-12 months.\nWashable FilterD6\nReinstall the cleaning tank.D14-3—\nRinse the cleaning tank with water.D14-2—\nLeave the dustbin and the washable \nfilter to dry.\nD5-4—\nTo prevent blockage, only use clean water without \nany cleaning liquid.\nNote:\nFill the dustbin with clean water and \nreinstall the washable filter. Gently \nshake the dustbin, and then pour \nout the dirty water.\nD5-3— Do not lift the base directly to prevent the \ndock from falling off.', '006\n • Press to return to dock/start emptying\n • Press and hold to start spot cleaning/ \nmop washing\n      —Dock\n • Press and hold to turn the robot \non or off\n • Press to start cleaning\n      —Power/Clean\n • White: Battery level ≥ 15%\n • Red: Battery level < 15%\n • Breathing: Charging or starting up\n • Flashing red: Error\n      —Power Indicator Light\nPress any button to stop the robot during cleaning \nor docking.\nNote:\nA1-1—Dock Locator\nA1-2—Reactive Tech Obstacle Avoidance \nSensor\nA2-1—Wall Sensor\nA2-2—Omnidirectional Wheel\nA2-3—Carpet Sensor\nA2-4—Side Brush\nA2-5—Main Wheel\nA2-6—Main Brush\nA2-7—Main Brush Cover Latches\nA2-8—Mop Cloths\nA2-9—Cliff Sensors\nA3-4—Reset Button\nA3-5—Dustbin\nA3-6—Charging Contacts\nA3-7—Communication Sensor\nA3-8—Air Outlet\nA3-9—Positioning Button\nA3-10—Self-Filling Port\nA3-11—Automatic Lift and Rotate Mop \nModules\nA3-12—Suction Inlet\nA3-13—Bumper\nA3-1—Vertical Bumper\nA3-2—LiDAR Sensor\nA3-3—WiFi Indicator Light\n • Off: WiFi disabled/Charging\n • Flashing slowly: Waiting for connection\n • Flashing quickly: Connecting\n • Steady: WiFi connected\nA4-1—Hook and Loop Pads\nA4-2—Mop Axle\nSecure the mop cloths in place.Note:\nProduct OverviewA\nA1 Robot (Top View)\nA2 Robot (Bottom View)\nA3 Robot (Top Cover Open)\nA4 Mop Cloth Mount\nA5 Mop Cloth\nA6-1—Dustbin Latch\nA6-2—Air Inlet\nA6-3—Washable Filter \nA6-4—Suction Inlet\nA6 Dustbin\nA7 Dock Base\nA8 Power Cord\nA9 Disposable Dust Bag\nA10-1—Water Tank Handle\nA10-2—Water Tank Latch\nA10-3—Dirty Water Tank\nA10-4—Dust Container Cover\nA10-5—Charging Contacts\nA10-6—Robot Refill Port\nA10-7—Suction Inlet\nA10-8—Clean Water Tank\nA10-9—Status Indicator Light\n • Breathing: Emptying/Mop washing\n • Red: Dock error\n • Off: Powered off/Charging\nA10-10—Water Outlet\nA10-11—Air Outlets\nA10-12—Dock Base\nA10-13—Filter\nA10-14—Dust Bag Slot\nA10-15—Dock Location Beacon\nA10-16—Clean Water Dispensers\nA10 Dock', '010\nD5-1—Open the top cover of the robot and \npress the dustbin latch to take out \nthe dustbin.\n* Clean as required.\nD5-2—Open the washable filter and empty \nthe dustbin.\nD5-3—Fill the dustbin with clean water and \nreinstall the washable filter. Gently \nshake the dustbin, and then pour out \nthe dirty water.\n* Clean every 2 weeks and replace the filter every 6-12 months.\nD6-1—Remove the filter.\nD6-2—Rinse the filter repeatedly and tap it \nto remove as much dirt as possible.\nD6-3—Allow at least 24 hours for the filter \nto dry thoroughly and reinstall it.\nDo not touch the surface of the filter with your \nhands, brush, or hard objects to avoid potential damage.\nNote:\nTo prevent blockage, only use clean water without \nany cleaning liquid.\nNote:\nD5-4—Leave the dustbin and the washable \nfilter to dry.\nD1-8—Reinstall the main brush.\nD7-1—Remove the mop cloth from the mop \ncloth mount. Clean the mop cloth and \nair-dry it.\n* Clean as required and replace every 1-3 months.\nD1-9—Reinstall the main brush cover. Make \nsure that the four teeth are fully seated \nin the slot, and then press on the main \nbrush cover to lock it until you hear a click.\nNotes:\n • Main brush should be wiped down with a wet cloth. If the \nmain brush is wet, air-dry it away from direct sunlight.\n • Do not use corrosive cleaning fluids or disinfectants to \nclean the main brush.\n* Clean monthly and replace every 3-6 months.\nUnscrew the side brush screw. Remove and \nclean the side brush. Reinstall the brush and \ntighten the screw.\nD2 Side Brush\nD3-1—Use a tool, such as a small screwdriver, \nto pry out the axle and take out the wheel.\n* Clean as required.\nThe omnidirectional wheel bracket cannot be removed.Note:\nD3-2—Rinse the wheel and the axle with \nwater to remove any hair and dirt. \nDry and reattach the wheel, pressing \nit firmly in place.\nD3 Omnidirectional Wheel\nClean the main wheel with a soft, dry cloth.\n* Clean as required.\nD4 Main Wheel\nD5 Dustbin\nD6 Washable Filter\nD7 Mop Cloths\nRestoring Factory Settings\nIf the robot does not function properly after \na system reset, switch it on. Press and hold \nthe  button and at the same time, press the \nReset button until you hear the “Restoring \nfactory settings” voice message. The robot \nwill then be restored to factory settings.\n* Clean every 2 weeks and replace every 6-12 months.\nD1-1—Main Brush Cover\nD1-2—Main Brush Cover Latches\nD1-3—Main Brush\nD1-4—Main Brush Caps\nD1-5—Main Brush Bearing\nD1-6—Turn over the robot and press the \nmain brush latches to remove the \nmain brush cover.\nD1-7—Pull out the main brush and remove \nthe main brush bearing. Rotate the \nmain brush caps in the indicated \nunlock direction to remove the caps, \nRoutine MaintenanceD\nD1 Main Brush\nThe frequency of replacement may vary depending \non the situation. If abnormal wear occurs, replace the parts \nimmediately.\nNote:\nmessage. Then wait for 5 minutes and the \nWiFi will be automatically deactivated. If you \nwant to reconnect, please follow the related \nconnecting instructions.\nand remove any entangled hair or \ndirt at both ends of the main brush.', '08\nInstructions\nNotes:\n • To prevent corrosion or damage, only use the Roborock \nbranded floor cleaner in the water tank.\n • To avoid water tank deformation, do not place hot water \nin the tank.\n • If water marks remain on the water tank, wipe them clean \nbefore reinstallation.\nFilling the Clean Water Tank\nOpen the clean water tank. Fill with water \nuntil the Max line. Close the lid, lock the \nlatch, and fit the tank back in place.\nThe robot cannot be turned off when it is being \ncharged.\nNote:\nPress and hold the  button to turn on the \nrobot. The power indicator will turn on and \nthe robot will enter standby mode. Press \nand hold the  button to turn off the robot \nand complete the cleaning cycle.\nOn/Off\nPress the  button to start cleaning. The \nrobot will plan its cleaning route according \nto its scan of the room. It splits a room into \nzones, first draws out zone edges, and then \nfills the zone in a zigzag pattern. In so \ndoing, the robot cleans all zones one by \none, efficiently cleaning the house.\nStarting Cleaning\nZone 1 – Cleaned\nZone 4 – Next Zone\nZone 2 – Cleaned\nZone 3 – In Progress\nNotes:\n • To allow the robot to automatically vacuum and return to \nthe dock, start the robot from the dock. Do not move the \ndock during cleaning.\n • Cleaning cannot start if the battery level is too low. Allow the \nrobot to charge before starting cleanup.\n • If cleaning is completed in less than 10 minutes, the area \nwill be cleaned twice.\n • If the battery runs low during the cleaning cycle, the robot \nwill automatically return to the dock. After charging, the \nrobot will resume where it left off.\n • Automatic mop washing will not work if the dock \nencounters an error during cleaning. Wash the mop \nmanually to restore.\n • When the mop mount is attached, the robot will retract it \nwhen cleaning the carpet. You can also set the carpet as a \nno-go zone in the app to avoid it.\n • Before starting each mopping task, make sure that the \nVibraRise mop has been properly installed.\nAfter spot cleaning, the robot will automatically return \nto the starting point and enter Standby mode.\nNote:\nPress the  button to start spot cleaning.\nCleaning range: The robot cleans a 1.5 m \n(4.9 ft) x 1.5 m (4.9 ft) square area centered \non itself.\nSpot Cleaning Manually Activated Emptying\nAuto-Emptying\nEmptying can be triggered manually by \npressing the  button while the robot is \ncharging.\nAuto-emptying will begin when the robot \nreturns to the dock after cleaning.\nAvoid frequent manual emptying.Note:\nNotes:\n • If the dock has not emptied for an extended period, \nempty the robot dustbin manually and clear the air \ninlet of any debris to ensure optimum performance.\n • If necessary, auto-emptying can be disabled in the \napp.\nManually Activated Mop \nWashing\nDuring cleaning, press any button to pause, \nthen press and hold the  button to send \nthe robot back for mop washing.\nAuto Mop Washing\nDuring cleaning, the robot automatically \ndetermines when it should return to dock \nfor mop washing and water tank refilling to \nmaximize its mopping performance.\nTo allow the robot to wash the mop automatically, \nstart the robot from the dock once it is fully charged. Do \nnot move the dock during cleaning.\nNote:']",The Roborock S8 MaxV Ultra and the Roborock Qrevo Pro both feature automatic mop washing.,"Roborock S7 Pro Ultra, S8 MaxV Ultra and Qrevo Pro support automatic mop washing.",0.0,0.0,0.0,1000,200
