user_input,retrieved_contexts,response,reference,faithfulness,context_precision,context_recall,chunk_size,chunk_overlap
How do I reset Wi-Fi on Roborock S7 Pro Ultra?,"['008\nConnecting to the App\nSearch for “Roborock” in the App Store or \nGoogle Play or scan the QR code to download \nand install the app.\n1. Download App\na. Open the top cover and find the WiFi \nindicator light.\n2. Reset WiFi\nb. Press and hold the  and  buttons \nuntil you hear the “Resetting WiFi” voice \nmessage. The reset is complete when the \nWiFi indicator light flashes slowly. The \nrobot will then wait for a connection.\nIf you cannot connect to the robot due to your \nrouter configuration, a forgotten password, or any other \nreason, reset the WiFi and add your robot as a new device.\nNote:\nNotes:\n • The actual process may vary due to ongoing app updates. \nFollow the guide provided in the app.\n • Only 2.4 GHz WiFi is supported.\nOpen the Roborock app, tap the “Scan to \nConnect” or “Search for Device” button and \nadd your device as instructed in the app.\n3. Add Device\nC2-1—Zone 1 – Cleaned.\nC2-2—Zone 2 – Cleaned.\nC2-3—Zone 3 – In Progress.\nC2-4—Zone 4 – Next Zone.\nNotes:\n •To allow the robot to automatically vacuum and return \nto the dock, start the robot from the dock. Do not move \nthe dock during cleaning.\n • Cleaning cannot start if the battery level is too low. \nAllow the robot to charge before starting the cleanup.\n • Before cleaning, tidy cords (including the power cord \nof the dock) and valuables from the floor. Loose \nitems may be dragged by the robot, resulting in the \ndisconnection of electrical appliances or damage of \ncords and property.\n • If cleaning is completed in less than 10 minutes, the \narea will be cleaned twice.\n • If the battery runs low during a cleaning cycle, the robot \nwill automatically return to the dock. After charging, \nthe robot will resume where it left off.\n • The robot will retract mop cloth mounts when cleaning \nthe carpet. You can also set the carpet as a no-go \nzone in the app to avoid it.\n • Before starting each cleaning task, make sure that the \nmop cloths have been properly installed.\nSpot Cleaning\nPress and hold the  button to start spot \ncleaning in pause mode.\nCleaning range: The robot cleans a 1.5 m (4.9 ft) x \n1.5 m (4.9 ft) square area centered on itself.\nPress and hold  to turn on the robot. The \npower indicator light will come on, and the \nrobot will wait for orders.\nPress and hold the  button to turn off the \nrobot and complete the cleaning cycle.\nOn/Off\nThe robot cannot be turned off when it is being charged.Note:\nInstructions for UseC\nRemove and open the clean water tank and \nfill the tank with water to MAX. Close the lid, \nlock the latch, and fit the tank back in place.\nNotes:\n • To prevent corrosion or damage, do not use any disinfectant \nand only use cleaning solution recommended by Roborock \nin the water tank.\n • Do not add too much cleaning solution to prevent the \nrobot from working improperly due to slipping.\n • To avoid water tank deformation, do not place hot water \nin the tank. \n • If water marks remain on the water tank, wipe them \nclean before reinstallation.\nC1 Filling the Water Tank\nPress the  button to start cleaning. The \nrobot will plan its cleaning route according \nto its scan of the room. It splits a room \nC2 Starting Cleaning\ninto zones, first draws out zone edges, and \nthen fills the zone in a zigzag pattern. In \nso doing, the robot cleans all zones one by \none, efficiently cleaning the house.\nAfter spot cleaning, the robot will automatically \nreturn to the starting point and wait for orders.\nNote:', '13\nIf the robot does not respond when a button \nis pressed or cannot be turned off, reset the \nsystem by pressing the Reset button.\nResetting the SystemC17\nNote: After resetting the system, existing settings such \nas scheduled cleaning and WiFi will be restored to \nfactory settings.\nTo disconnect the robot from WiFi, press \nthe Reset button until you hear a voice \nmessage. Then wait for 5 minutes and the \nWiFi will be automatically deactivated. If you \nwant to reconnect, please follow the related \nconnecting instructions.\nIf the robot does not function properly after \na system reset, switch it on. Press and hold  \n and at the same time, press the Reset \nbutton until you hear the “Restoring \nfactory settings” voice message. The robot \nwill then be restored to factory settings.\nDeactivating WiFiC18\nRestoring Factory SettingsC19\nNote: The frequency of replacement may vary with the \nactual situation. If abnormal wear occurs, replace the \nparts immediately.\n* Clean every 2 weeks and replace every 6-12 months.\nMain BrushesD1\nRoutine MaintenanceD\nD1-1—Hair-Blocking Rings \nD1-2—Main Brush Caps \nD1-3—Main Brush Cover \nD1-4—Latches \nD1-5—Main Brushes \nD1-6—Main Brush Bearing\nTurn over the robot and press the \ntwo latches inwards to remove the \nmain brush cover.\nD1-7—\nPull out the main brushes and \nremove the main brush bearings, \nmain brush caps, and hair-blocking \nrings. Remove any entangled hair \nor dirt at both ends of the main \nbrushes. Then, reinstall the hair-\nblocking rings, main brush caps, and \nthen main brush bearings. \nD1-8—\nUnscrew the side brush screw. Remove and \nclean the side brush. Reinstall the brush \nand tighten the screw.\nNotes:\n • It is recommended to wipe the main brushes with a \nwet cloth. If the main brushes are wet, air-dry them \naway from direct sunlight.\n • Do not use corrosive cleaning fluid or disinfectant to \nclean the main brushes.\n* Clean monthly and replace every 3-6 months.\nFlexible Side BrushD2\nReinstall the main brushes. Firmly snap \nthe main brush bearings into place. \nOnly after the bearings are securely \ninstalled, fit the main brush cover.\nD1-9—\nReinstall the main brush cover. Make \nsure its four teeth are fully seated in \nthe slots, and press the main brush \ncover until you hear it lock with a click.\nD1-10 —\n • Placing a malfunctioning robot on the dock manually \nwill end the current cleanup.\n •To prevent injury caused by blades used to cut hair inside \nthe main brush cover, make sure to install two main \nbrushes in place before installing the main brush cover.\nUse a tool, such as a small \nscrewdriver, to pry out the axle and \ntake out the wheel.\nD3-1—\n* Clean as required.\nOmnidirectional WheelD3\nThe omnidirectional wheel bracket cannot be \nremoved.\nNote:\nRinse the wheel and the axle with \nwater to remove any hair and dirt. \nAir-dry, reinstall, and press the wheel \nand axle back in place.\nD3-2—\nClean the main wheels with a soft, dry cloth.\n* Clean as required.\nMain WheelsD4\n* Clean as required.\nDustbinD5\nRemove the magnetic top cover and \npress the dustbin latch to take out \nthe dustbin.\nD5-1—\nRemove the washable filter and \nempty the dustbin.\nD5-2—', '07\nEmpty Wash Fill Dock AutoA11\nA11-1—Charging Contacts\nA11-2—Robot Refill Port\nA11-3—Dust Container Cover\nA11-4—Drying Air Outlets\nPress any button to pause the robot during \ncleaning or docking.\nNote:\n • White: Battery level ≥ 15%\n • Red: Battery level < 15%\n • Breathing: Charging or starting up\n • Flashing red: Error\n • Flashing red and white alternately: \nRemote viewing or cruising\n • Press and hold to turn the robot \non or off\n • Press to start cleaning\n—Power/Clean\n—Power Indicator Light\n • Press to start docking/emptying\n • Press and hold to wash the mop \ncloths\n—Dock\n • Press to start Mop Only\n • Press and hold for 3 seconds to \nenable/disable Child Lock \n—Mop Only/Child Lock\n • Off: WiFi disabled\n • Flashing slowly: Waiting for \nconnection\n • Flashing quickly: Connecting\n • Steady: WiFi connected\n • Flashing slowly: Starting up\n • Flashing quickly: Waiting for voice \ncommands\nProduct OverviewA\nA1  Robot (Top View)\nA2  Robot (Bottom View)\nA3  Robot (Top Cover Removed)\nA1-1—Voice Assistant Indicator Light\nA2-1—Cliff Sensors\nA2-2—Carpet Sensor\nA2-3—Omnidirectional Wheel\nA2-4—Flexible Side Brush\nA2-5—Main Brushes\nA2-6—Main Brush Cover Latches\nA2-7—Main Wheels\nA3-1—Magnetic Top Cover\nA3-2—WiFi Indicator Light\nA3-3—Reset Button\nA3-4—Charging Contacts\nA3-5—Communication Sensor\nA3-6—Self-Filling Port\nA3-7—Positioning Button\nA3-8—Air Outlets\nA3-9—VibraRise Module\nA3-10—Bumper\nThe mop cloth mounts are non-detachable.Note:\nVibraRise ModuleA4\nA5-1—Hook and Loop Pads\nA6-1—Mop Cloth Screw\nA7-1—Dustbin Latch\nA7-2—Filter Latch\nA7-3—Air Inlet\nA7-4—Washable Filter\nA7-5—Suction Inlet\nVibraRise Mop ClothA5\nDustbin A7\nDock BaseA8\nDisposable Dust BagA9\nEdgewise Mop ClothA6\nPower CordA10\n •For use with video calls and voice \ncontrol.\nA1-2—Vertical Bumper\nA1-3—LiDAR Sensor\nA1-4—Microphones\nA1-5—Wall Sensor\nA1-6—Reactive AI Obstacle Recognition \nSensor\nA1-7—Dock Locator\nA1-8—LED Fill Light\nNote: Secure the mop cloth flat in place.\nA4-1—Mop Cloth Attachment Slot\nA4-2—Vibration Module\nA4-3—Edgewise Mopping Module', '08\nInstructions\nNotes:\n • To prevent corrosion or damage, only use the Roborock \nbranded floor cleaner in the water tank.\n • To avoid water tank deformation, do not place hot water \nin the tank.\n • If water marks remain on the water tank, wipe them clean \nbefore reinstallation.\nFilling the Clean Water Tank\nOpen the clean water tank. Fill with water \nuntil the Max line. Close the lid, lock the \nlatch, and fit the tank back in place.\nThe robot cannot be turned off when it is being \ncharged.\nNote:\nPress and hold the  button to turn on the \nrobot. The power indicator will turn on and \nthe robot will enter standby mode. Press \nand hold the  button to turn off the robot \nand complete the cleaning cycle.\nOn/Off\nPress the  button to start cleaning. The \nrobot will plan its cleaning route according \nto its scan of the room. It splits a room into \nzones, first draws out zone edges, and then \nfills the zone in a zigzag pattern. In so \ndoing, the robot cleans all zones one by \none, efficiently cleaning the house.\nStarting Cleaning\nZone 1 – Cleaned\nZone 4 – Next Zone\nZone 2 – Cleaned\nZone 3 – In Progress\nNotes:\n • To allow the robot to automatically vacuum and return to \nthe dock, start the robot from the dock. Do not move the \ndock during cleaning.\n • Cleaning cannot start if the battery level is too low. Allow the \nrobot to charge before starting cleanup.\n • If cleaning is completed in less than 10 minutes, the area \nwill be cleaned twice.\n • If the battery runs low during the cleaning cycle, the robot \nwill automatically return to the dock. After charging, the \nrobot will resume where it left off.\n • Automatic mop washing will not work if the dock \nencounters an error during cleaning. Wash the mop \nmanually to restore.\n • When the mop mount is attached, the robot will retract it \nwhen cleaning the carpet. You can also set the carpet as a \nno-go zone in the app to avoid it.\n • Before starting each mopping task, make sure that the \nVibraRise mop has been properly installed.\nAfter spot cleaning, the robot will automatically return \nto the starting point and enter Standby mode.\nNote:\nPress the  button to start spot cleaning.\nCleaning range: The robot cleans a 1.5 m \n(4.9 ft) x 1.5 m (4.9 ft) square area centered \non itself.\nSpot Cleaning Manually Activated Emptying\nAuto-Emptying\nEmptying can be triggered manually by \npressing the  button while the robot is \ncharging.\nAuto-emptying will begin when the robot \nreturns to the dock after cleaning.\nAvoid frequent manual emptying.Note:\nNotes:\n • If the dock has not emptied for an extended period, \nempty the robot dustbin manually and clear the air \ninlet of any debris to ensure optimum performance.\n • If necessary, auto-emptying can be disabled in the \napp.\nManually Activated Mop \nWashing\nDuring cleaning, press any button to pause, \nthen press and hold the  button to send \nthe robot back for mop washing.\nAuto Mop Washing\nDuring cleaning, the robot automatically \ndetermines when it should return to dock \nfor mop washing and water tank refilling to \nmaximize its mopping performance.\nTo allow the robot to wash the mop automatically, \nstart the robot from the dock once it is fully charged. Do \nnot move the dock during cleaning.\nNote:', '11\nNotes:\n • The actual process may vary due to ongoing app \nupdates. Follow the guide provided in the app.\n • Only 2.4 GHz WiFi is supported.\n3. Add Device\nOpen the Roborock app, tap the ""Scan to \nConnect"" or ""Search for Device"" button and \nadd your device following the in-app guide. During operation, the dock will automatically \nfill and drain water.\nFilling/DrainingC2\nPress and hold  to turn on the robot. The \npower indicator light will come on, and the \nrobot will wait for orders.\nPress and hold  to turn off the robot and \ncomplete the cleaning cycle.\nTurning On/OffC3\nPress  to start cleaning. The robot will plan its \ncleaning route and in each room, it firstly draws \nout zone edges and then fills the room in a \nzigzag pattern. In so doing, the robot cleans all \nrooms one by one, thoroughly and efficiently.\nStarting CleaningC4\nZone 1 – Cleaned\nZone 4 – Next Zone\nZone 2 – Cleaned\nZone 3 – In Progress\nNotes:\n • To make sure the robot returns to the dock \nautomatically, start the robot from the dock and do \nnot move the dock during cleaning.\n • Cleaning cannot start if the battery level is too low. \nAllow the robot to charge before starting a cleanup.\n • If cleaning is completed in less than 10 minutes, the \nrobot will clean the area twice.\n • If the battery runs low during a cleaning cycle, the \nrobot will automatically return to the dock. After \ncharging, the robot will resume where it left off.\n • The robot will retract the mop cloth mounts to clean \nthe carpet. You can also set the carpet as a no-go \nzone in the app to avoid it.\n • Before starting each cleaning task, make sure that the \nmop cloths have been properly installed.\nNote: The robot cannot be turned off when it is being charged.\nInstructions for UseC\nAdding the Cleaning SolutionC1\nRemove the dust container cover, \npull out the entire cleaning solution \ncartridge by its bottom handle, and \nthen place it on a hard, flat surface.\nC1-1—\nOpen the lid of the cartridge and \nadd cleaning solution.\nC1-2—\nClose the lid and put the cartridge back \nto the dock. Press down the cartridge \nuntil you hear it lock with a click. \nC1-3—\nInstall the dust container cover in place \nto make sure the dust container is \nsecurely sealed.\nC1-4—\nNotes:\n • Make sure that the cleaning solution cartridge is \nNote: To prevent the dust container cover from falling \nand hitting the robot, remove the cover with both \nhands, one on each side.\nPress  to start Mop Only. The main brushes \nrise, the main brushes and fan stop operating, \nand the VibraRise module lowers.\nNote: Compared with the traditional cleaning mode, \nnoise emanating from Mop Only is much lower.\nPress  and  simultaneously to start spot \ncleaning.\nCleaning range: The robot cleans a 1.5 m \n(4.9 ft) × 1.5 m (4.9 ft) square area centered \non itself.\nNote: After spot cleaning, the robot will automatically \nreturn to the starting point and wait for orders.\nWhen the robot is running, press any button \nto pause it, press  to resume cleaning, \npress  to send it back to the dock, and \nSpot CleaningC5\nMop OnlyC6\nPauseC7\nIf you cannot connect to the robot due to your \nrouter configuration, a forgotten password, or any other \nreason, reset the WiFi and add your robot as a new device.\nNote: entirely removed before adding cleaning solution.\n • To prevent corrosion or damage, do not use \nany disinfectant and only use cleaning solution \nrecommended by Roborock in the solution cartridge.\n • Cleaning solution is not included in the package. \nPurchase one if needed.']","To reset the Wi-Fi on your Roborock S7 Pro Ultra, open the top cover to locate the Wi-Fi indicator light. Press and hold both the  and  buttons until you hear a voice message stating ""Resetting WiFi."" The Wi-Fi indicator light will then flash slowly, indicating that the reset is complete and the robot is ready for connection. If you encounter issues connecting due to router configuration, a forgotten password, or other reasons, resetting the Wi-Fi allows you to add your robot as a new device.",Open the top cover and locate the Wi-Fi indicator. Press and hold the Power and Home buttons until you hear 'Resetting WiFi'. The reset is complete when the Wi-Fi indicator flashes slowly and the robot waits for connection.,0.9090909090909091,0.8333333332916666,1.0,1000,200
Can I use detergent in the water tank?,"['010\nD5-1—Open the top cover of the robot and \npress the dustbin latch to take out \nthe dustbin.\n* Clean as required.\nD5-2—Open the washable filter and empty \nthe dustbin.\nD5-3—Fill the dustbin with clean water and \nreinstall the washable filter. Gently \nshake the dustbin, and then pour out \nthe dirty water.\n* Clean every 2 weeks and replace the filter every 6-12 months.\nD6-1—Remove the filter.\nD6-2—Rinse the filter repeatedly and tap it \nto remove as much dirt as possible.\nD6-3—Allow at least 24 hours for the filter \nto dry thoroughly and reinstall it.\nDo not touch the surface of the filter with your \nhands, brush, or hard objects to avoid potential damage.\nNote:\nTo prevent blockage, only use clean water without \nany cleaning liquid.\nNote:\nD5-4—Leave the dustbin and the washable \nfilter to dry.\nD1-8—Reinstall the main brush.\nD7-1—Remove the mop cloth from the mop \ncloth mount. Clean the mop cloth and \nair-dry it.\n* Clean as required and replace every 1-3 months.\nD1-9—Reinstall the main brush cover. Make \nsure that the four teeth are fully seated \nin the slot, and then press on the main \nbrush cover to lock it until you hear a click.\nNotes:\n • Main brush should be wiped down with a wet cloth. If the \nmain brush is wet, air-dry it away from direct sunlight.\n • Do not use corrosive cleaning fluids or disinfectants to \nclean the main brush.\n* Clean monthly and replace every 3-6 months.\nUnscrew the side brush screw. Remove and \nclean the side brush. Reinstall the brush and \ntighten the screw.\nD2 Side Brush\nD3-1—Use a tool, such as a small screwdriver, \nto pry out the axle and take out the wheel.\n* Clean as required.\nThe omnidirectional wheel bracket cannot be removed.Note:\nD3-2—Rinse the wheel and the axle with \nwater to remove any hair and dirt. \nDry and reattach the wheel, pressing \nit firmly in place.\nD3 Omnidirectional Wheel\nClean the main wheel with a soft, dry cloth.\n* Clean as required.\nD4 Main Wheel\nD5 Dustbin\nD6 Washable Filter\nD7 Mop Cloths\nRestoring Factory Settings\nIf the robot does not function properly after \na system reset, switch it on. Press and hold \nthe  button and at the same time, press the \nReset button until you hear the “Restoring \nfactory settings” voice message. The robot \nwill then be restored to factory settings.\n* Clean every 2 weeks and replace every 6-12 months.\nD1-1—Main Brush Cover\nD1-2—Main Brush Cover Latches\nD1-3—Main Brush\nD1-4—Main Brush Caps\nD1-5—Main Brush Bearing\nD1-6—Turn over the robot and press the \nmain brush latches to remove the \nmain brush cover.\nD1-7—Pull out the main brush and remove \nthe main brush bearing. Rotate the \nmain brush caps in the indicated \nunlock direction to remove the caps, \nRoutine MaintenanceD\nD1 Main Brush\nThe frequency of replacement may vary depending \non the situation. If abnormal wear occurs, replace the parts \nimmediately.\nNote:\nmessage. Then wait for 5 minutes and the \nWiFi will be automatically deactivated. If you \nwant to reconnect, please follow the related \nconnecting instructions.\nand remove any entangled hair or \ndirt at both ends of the main brush.', '08\nInstructions\nNotes:\n • To prevent corrosion or damage, only use the Roborock \nbranded floor cleaner in the water tank.\n • To avoid water tank deformation, do not place hot water \nin the tank.\n • If water marks remain on the water tank, wipe them clean \nbefore reinstallation.\nFilling the Clean Water Tank\nOpen the clean water tank. Fill with water \nuntil the Max line. Close the lid, lock the \nlatch, and fit the tank back in place.\nThe robot cannot be turned off when it is being \ncharged.\nNote:\nPress and hold the  button to turn on the \nrobot. The power indicator will turn on and \nthe robot will enter standby mode. Press \nand hold the  button to turn off the robot \nand complete the cleaning cycle.\nOn/Off\nPress the  button to start cleaning. The \nrobot will plan its cleaning route according \nto its scan of the room. It splits a room into \nzones, first draws out zone edges, and then \nfills the zone in a zigzag pattern. In so \ndoing, the robot cleans all zones one by \none, efficiently cleaning the house.\nStarting Cleaning\nZone 1 – Cleaned\nZone 4 – Next Zone\nZone 2 – Cleaned\nZone 3 – In Progress\nNotes:\n • To allow the robot to automatically vacuum and return to \nthe dock, start the robot from the dock. Do not move the \ndock during cleaning.\n • Cleaning cannot start if the battery level is too low. Allow the \nrobot to charge before starting cleanup.\n • If cleaning is completed in less than 10 minutes, the area \nwill be cleaned twice.\n • If the battery runs low during the cleaning cycle, the robot \nwill automatically return to the dock. After charging, the \nrobot will resume where it left off.\n • Automatic mop washing will not work if the dock \nencounters an error during cleaning. Wash the mop \nmanually to restore.\n • When the mop mount is attached, the robot will retract it \nwhen cleaning the carpet. You can also set the carpet as a \nno-go zone in the app to avoid it.\n • Before starting each mopping task, make sure that the \nVibraRise mop has been properly installed.\nAfter spot cleaning, the robot will automatically return \nto the starting point and enter Standby mode.\nNote:\nPress the  button to start spot cleaning.\nCleaning range: The robot cleans a 1.5 m \n(4.9 ft) x 1.5 m (4.9 ft) square area centered \non itself.\nSpot Cleaning Manually Activated Emptying\nAuto-Emptying\nEmptying can be triggered manually by \npressing the  button while the robot is \ncharging.\nAuto-emptying will begin when the robot \nreturns to the dock after cleaning.\nAvoid frequent manual emptying.Note:\nNotes:\n • If the dock has not emptied for an extended period, \nempty the robot dustbin manually and clear the air \ninlet of any debris to ensure optimum performance.\n • If necessary, auto-emptying can be disabled in the \napp.\nManually Activated Mop \nWashing\nDuring cleaning, press any button to pause, \nthen press and hold the  button to send \nthe robot back for mop washing.\nAuto Mop Washing\nDuring cleaning, the robot automatically \ndetermines when it should return to dock \nfor mop washing and water tank refilling to \nmaximize its mopping performance.\nTo allow the robot to wash the mop automatically, \nstart the robot from the dock once it is fully charged. Do \nnot move the dock during cleaning.\nNote:', '011\nD7-2—Stick the mop cloth on the mount in \nposition and firmly.\nA dirty mop cloth will affect the washing performance. \nClean it before use.\nNote:\nMake sure the disposable dust bag is properly \nsealed to avoid waste escaping and damaging the dock.\nNote:\nUse a soft, dry cloth to wipe and clean all \nsensors, including:\n* Clean as required.\nLift up and move the dock. Do not move the \ndock by lifting the dock base, water tank handles \nor dust container cover directly to prevent \nthe dock from falling off.\nOpen the dirty water tank lid and pour out \nthe dirty water. Fill the tank with clean water, \nclose the lid, and shake. Pour out the dirty \nwater. Close the lid and then re-install.\n* Clean as required.\nUse a soft dry cloth to wipe the charging \ncontacts on the robot and the dock.\n* Clean monthly.\nNotes:\n • The dust bag handle seals the bag on removal to \nprevent leakage.\n • Always install a dust bag before closing the dust \ncontainer cover to avoid auto-emptying without the \nbag. You can also disable auto-emptying in the app.\nD12-1—Remove the dust container cover.\nD12-2—Remove the disposable dust bag in the \ndirection of the arrow and discard it.\n* Replace as required.\nD12-3—Clean around the filter with a dry \ncloth. Install a new disposable dust \nbag in place along the slot and \nunfold the dust bag to maximize \nemptying performance.\nBasic Parameters\nModel QR1PES\nBattery 14.4 V/5200 mAh (TYP) \nlithium-ion battery\nRated Input 20VDC 1.5A\nCharging Time Approx. 4 hours\nRobot\nThe serial number is on a sticker on the underside \nof the robot.\nNote:\nEmpty Wash Fill Dock\nModel EWFD16HRR\nRated Input Voltage 220-240VAC\nRated Frequency 50-60Hz\nRated Input (Dust \ncollection) 3A \nRated Input\n(Hot water washing \nmop)\n5.6A\nRated Input \n(Charging & drying) 0.6A\nRated Output 20VDC 1.5A\nCharging Battery 14.4 V/5200 mAh (TYP) \nlithium-ion battery\nD8-1—Dock Locator\nD8-2—Reactive Tech Obstacle Avoidance Sensor\nD8-3—Wall Sensor\nD8-4—Communication Sensor\nD8-5—Carpet Sensor\nD8-6—Four Cliff Sensors\nD8 Robot Sensors\nD10 Dirty Water Tank\nD11 Charging Contact Areas\nD12 Replacing Disposable Dust Bag\nD12-4—Close the dust container cover and \nmake sure it is securely sealed.\nD13-1—Remove the cleaning tank.\nD13-2—Rinse the cleaning tank and the filter \nwith water.\nD13-3—Reinstall the cleaning tank.\n* Clean as required.\nD13 Cleaning Tank\nD9 Moving Dock', '14\nLift the high-speed maintenance brush \nlatch and remove the brush. Remove \nany entangled objects in the high-speed \nmaintenance brush and rinse it clean. \nReinstall the brush and latch it in place.\n* Clean as required and replace every 6-12 months.\nHigh-Speed Maintenance BrushD12\n* Replace regularly or when it is full.\nReplacing the Disposable \nDust Bag\nD15\nRemove the dust container cover.D15-1—\nRemove the cleaning tank.D14-1—\nCleaning Tank of Edgewise \nMopping Module\nD14\n* Clean as required.\nPull out the filter. Press the latch on the side \nof the filter to flip it downwards open. Rinse \nit with water, use a soft, dry cloth to wipe the \ncleaning tank, and then reinstall the filter by \nlocking the latch. Press down the filter until \nyou hear it lock with a click.\n* Clean as required.\nWater FilterD13\nNote: To prevent the dust container cover from falling \nand hitting the robot, remove the cover with both \nhands, one on each side.\nUnscrew the screw in the middle of \nthe mop cloth.\nD7-1—\n* Clean as required and replace every 3-6 months.\nEdgewise Mop ClothD7\nPurchase an additional filter and alternate if \nnecessary.\nNote:\nAllow at least 24 hours for the filter \nto dry thoroughly and reinstall it.\nD6-3—\nRemove the mop cloth from the mop \ncloth mount. Clean the mop cloth \nand air-dry it.\nD8-1—\nSlide the mop cloth in from the \nopening of the attachment slot, and \nthen stick it flat in place.\nD8-2—\nA dirty mop cloth will affect the mopping \nperformance. Clean it before use.\nNote:\nUse a soft, dry cloth to wipe and clean all \nsensors, including:\n* Clean as required and replace every 3-6 months.\nVibraRise Mop ClothD8\n* Clean as required.\nRobot SensorsD9\nUse a soft, dry cloth to wipe the charging \ncontacts on the robot and the dock.\n* Clean as required.\nCharging ContactsD10\nD9-1—Reactive AI Obstacle Recognition\n             Sensor\nD9-2—Dock Locator\nD9-3—Carpet Sensor\nD9-4—Wall Sensor\nD9-5—Communication Sensor\nD9-6—Cliff Sensors\nTo move the dock, grip the cord storage slot \non the back with one hand and the inner \nside of the front board with the other hand. \nMoving the DockD11\nWash the mop cloth and air-dry it.D7-2—\nReinstall the mop cloth and tighten \nthe screw.\nD7-3—\nA dirty mop cloth will affect the mopping \nperformance. Clean it before use.\nNote:\nRemove the filter.D6-1—\nRinse the filter repeatedly and tap it \nto remove as much dirt as possible.\nD6-2—\nDo not touch the surface of the filter with hands, \nbrush, or hard objects to avoid potential damage.\nNote:\n* Clean every 2 weeks and replace every 6-12 months.\nWashable FilterD6\nReinstall the cleaning tank.D14-3—\nRinse the cleaning tank with water.D14-2—\nLeave the dustbin and the washable \nfilter to dry.\nD5-4—\nTo prevent blockage, only use clean water without \nany cleaning liquid.\nNote:\nFill the dustbin with clean water and \nreinstall the washable filter. Gently \nshake the dustbin, and then pour \nout the dirty water.\nD5-3— Do not lift the base directly to prevent the \ndock from falling off.', '15\nRemoving Water PipesD16\nDisconnect the power and water \nsupply. Pull out the lock plate at the \nconnection.\nD16-1—\nMake sure the disposable dust bag is properly \ninstalled to avoid waste escaping and damaging the \ndock.\nNote:\nInstall the dust container cover \nin place to make sure the dust \ncontainer is securely sealed.\nD15-4—\nHold the snap ring at the \nconnection to remove the two \npipes one by one.\nD16-2—\nNotes:\n • When disconnecting the water pipes, use a container \nto capture the flowing water and avoid wetting the \nfloor. \n • Avoid forcibly pulling out the water pipes, or the \nproduct may be damaged.\nDraining the Remaining WaterD17\nTo transport or mail the product, empty \nthe remaining fluid in the dock using the \nThe robot is equipped with a built-in high-\nperformance lithium-ion rechargeable \nbattery pack. To maintain battery \nperformance, keep the robot charged \nduring normal use.\nIf the robot will be left unused for a long period, \nturn it off and charge it at least every three months to \navoid battery damage caused by overdischarge.\nNote:\nBatteryD18\nBasic Parameters\nModel S82USV\nBattery 14.4V/5200mAh (TYP) \nlithium-ion battery\nRated Input 20VDC 1.5A\nCharging Time Approx. 4 hours\nRobot\nThe serial number is on a sticker on the underside \nof the robot.\nNote:\nEmpty Wash Fill Dock Auto\nModel EWFD14HRR\nRated Input Voltage 220-240VAC\nRated Frequency 50-60Hz\nRated Input\n(Dust collection) 3A \nRated Input\n(Hot water mop \nwashing)\n6A\nRated Input \n(Charging & drying) 0.75A\nRated Output 20VDC 1.5A\nCharging Battery 14.4V/5200mAh (TYP) \nlithium-ion battery\nMaximum Water \nInlet Pressure 0.4MPa\nMinimum Water \nInlet Pressure 0.1MPa\nRemove the dust bag and discard it.D15-2—\nNotes:\n • The dust bag handle seals the bag on removal to \nprevent leakage.\n • Always install a dust bag before putting back the dust \ncontainer cover to avoid auto-emptying without the \nbag. You can also disable auto-emptying in the app.\nClean the filter with a dry cloth, \ninsert a new disposable dust bag \ninto the slot, and spread it evenly to \nensure it is installed in place.\nD15-3—\napp. At the same time, empty and rinse the \ncleaning solution cartridge, leave it to air \ndry completely and then reinstall it.']","No, only use clean water without any cleaning liquid in the water tank to prevent blockage.",Only cleaning solutions officially recommended by Roborock may be used. Other detergents may cause corrosion or damage.,0.75,0.99999999995,1.0,1000,200
