user_input,retrieved_contexts,response,reference,faithfulness,context_precision,context_recall,chunk_size,chunk_overlap
How do I reset Wi-Fi on Roborock S7 Pro Ultra?,"['The robot will then \nwait for a connection.\nOpen the Roborock App, tap the “Search for \ndevice” button, or open Xiaomi Home app, \ntap “+” in the top right corner and add the \ndevice as instructed in the app. \nNotes:\n • The actual process may vary due to ongoing app updates. \nFollow the instructions provided in the app.\n • Only 2.4 GHz WiFi is supported.\n • If the robot waits more than 1 hour for a connection, WiFi \nwill be automatically disabled. If you want to reconnect, \nreset the WiFi before proceeding.\n❸ Add device\nIf you cannot connect to the robot due to your router \nconfiguration, a forgotten password, or any other reason, reset \nthe WiFi and add your robot as a new device.\nNote:', '008\nConnecting to the App\nSearch for “Roborock” in the App Store or \nGoogle Play or scan the QR code to download \nand install the app.\n1. Download App\na. Open the top cover and find the WiFi \nindicator light.\n2. Reset WiFi\nb. Press and hold the  and  buttons \nuntil you hear the “Resetting WiFi” voice \nmessage. The reset is complete when the \nWiFi indicator light flashes slowly. The \nrobot will then wait for a connection.\nIf you cannot connect to the robot due to your \nrouter configuration, a forgotten password, or any other \nreason, reset the WiFi and add your robot as a new device.\nNote:\nNotes:\n • The actual process may vary due to ongoing app updates. \nFollow the guide provided in the app.\n • Only 2.4 GHz WiFi is supported.\nOpen the Roborock app, tap the “Scan to \nConnect” or “Search for Device” button and \nadd your device as instructed in the app.\n3. Add Device\nC2-1—Zone 1 – Cleaned.\nC2-2—Zone 2 – Cleaned.\nC2-3—Zone 3 – In Progress.\nC2-4—Zone 4 – Next Zone.\nNotes:\n •To allow the robot to automatically vacuum and return \nto the dock, start the robot from the dock. Do not move \nthe dock during cleaning.\n • Cleaning cannot start if the battery level is too low. \nAllow the robot to charge before starting the cleanup.\n • Before cleaning, tidy cords (including the power cord \nof the dock) and valuables from the floor. Loose \nitems may be dragged by the robot, resulting in the \ndisconnection of electrical appliances or damage of \ncords and property.\n • If cleaning is completed in less than 10 minutes, the \narea will be cleaned twice.\n • If the battery runs low during a cleaning cycle, the robot \nwill automatically return to the dock. After charging, \nthe robot will resume where it left off.\n • The robot will retract mop cloth mounts when cleaning \nthe carpet.', '13\nIf the robot does not respond when a button \nis pressed or cannot be turned off, reset the \nsystem by pressing the Reset button.\nResetting the SystemC17\nNote: After resetting the system, existing settings such \nas scheduled cleaning and WiFi will be restored to \nfactory settings.\nTo disconnect the robot from WiFi, press \nthe Reset button until you hear a voice \nmessage. Then wait for 5 minutes and the \nWiFi will be automatically deactivated. If you \nwant to reconnect, please follow the related \nconnecting instructions.\nIf the robot does not function properly after \na system reset, switch it on. Press and hold  \n and at the same time, press the Reset \nbutton until you hear the “Restoring \nfactory settings” voice message. The robot \nwill then be restored to factory settings.\nDeactivating WiFiC18\nRestoring Factory SettingsC19\nNote: The frequency of replacement may vary with the \nactual situation. If abnormal wear occurs, replace the \nparts immediately.\n* Clean every 2 weeks and replace every 6-12 months.\nMain BrushesD1\nRoutine MaintenanceD\nD1-1—Hair-Blocking Rings \nD1-2—Main Brush Caps \nD1-3—Main Brush Cover \nD1-4—Latches \nD1-5—Main Brushes \nD1-6—Main Brush Bearing\nTurn over the robot and press the \ntwo latches inwards to remove the \nmain brush cover.\nD1-7—\nPull out the main brushes and \nremove the main brush bearings, \nmain brush caps, and hair-blocking \nrings. Remove any entangled hair \nor dirt at both ends of the main \nbrushes. Then, reinstall the hair-\nblocking rings, main brush caps, and \nthen main brush bearings. \nD1-8—\nUnscrew the side brush screw. Remove and \nclean the side brush. Reinstall the brush \nand tighten the screw.\nNotes:\n • It is recommended to wipe the main brushes with a \nwet cloth.']","To reset the Wi-Fi on the Roborock S7 Pro Ultra, you need to reset the device. If you cannot connect to the robot for any reason, reset the Wi-Fi and add your robot as a new device.",Open the top cover and locate the Wi-Fi indicator. Press and hold the Power and Home buttons until you hear 'Resetting WiFi'. The reset is complete when the Wi-Fi indicator flashes slowly and the robot waits for connection.,0.6666666666666666,0.49999999995,1.0,500,80
Can I use detergent in the water tank?,"['• Placing the dock on a soft surface (carpet/mat) may \ncause the dock to tilt over and cause problems docking \nand departing.\n • Keep the dock away from direct sunlight or anything \nthat may block the dock location beacon; otherwise, \nthe robot may fail to return to the dock.\n • Do not use the dock without clean water tank, dirty \nwater tank, dust container cover, disposable dust bag, \nor cleaning tank.\n • Maintain the dock according to the maintenance instructions. \nDo not clean the dock with a wet cloth or tissue.\n • All docks are subject to water-based tests before \nleaving the factory. It is normal that a small amount of \nwater remains in the waterway of the dock.\nA10-17—Water Level Float\nA10-18—Cleaning Tank Filter\nA10-19—Cleaning Tank\nAttach the base by pressing down \nboth sides of the base firmly, and \nthen pressing the connecting part in \nthe middle until you hear a click.', 'Note:\nWhen using the robot for the first time, follow it \nthroughout its whole cleaning route and watch for potential \nproblems. The robot will be able to clean by itself in future uses.\nNote:\nConnect the power cable to the back \nof the dock, and keep excess cable \ninside the storage slot.\nB1-3—\nB1  Position the charging dock\nA11 Empty Wash Fill Dock  \nA11-1—Water Tank Handle\nA11-2—Dirty Water Tank\nA11-3—Self-Filling Port\nA11-4—Dock Location Beacon\nA11-5—Charging Contacts\nA11-6—Washing Strip\nA11-7—High-Speed Maintenance Brush\nA11-8—Maintenance Brush Latch\nA11-9—Dustbin\nA11-10—Water Tank Lid\nA11-11—Clean Water Tank\nA11-12—Water Tank Latch\nA11-13—Status Indicator Light\n • Pulsing: Emptying/Washing Mop\n • Red: Dock error\n • Light off: Charging/Powered Off\nA11-14—Water Filter\nA11-15—Dock Base', '010\nD5-1—Open the top cover of the robot and \npress the dustbin latch to take out \nthe dustbin.\n* Clean as required.\nD5-2—Open the washable filter and empty \nthe dustbin.\nD5-3—Fill the dustbin with clean water and \nreinstall the washable filter. Gently \nshake the dustbin, and then pour out \nthe dirty water.\n* Clean every 2 weeks and replace the filter every 6-12 months.\nD6-1—Remove the filter.\nD6-2—Rinse the filter repeatedly and tap it \nto remove as much dirt as possible.\nD6-3—Allow at least 24 hours for the filter \nto dry thoroughly and reinstall it.\nDo not touch the surface of the filter with your \nhands, brush, or hard objects to avoid potential damage.\nNote:\nTo prevent blockage, only use clean water without \nany cleaning liquid.\nNote:\nD5-4—Leave the dustbin and the washable \nfilter to dry.\nD1-8—Reinstall the main brush.\nD7-1—Remove the mop cloth from the mop \ncloth mount. Clean the mop cloth and \nair-dry it.\n* Clean as required and replace every 1-3 months.\nD1-9—Reinstall the main brush cover. Make \nsure that the four teeth are fully seated \nin the slot, and then press on the main \nbrush cover to lock it until you hear a click.\nNotes:\n • Main brush should be wiped down with a wet cloth. If the \nmain brush is wet, air-dry it away from direct sunlight.\n • Do not use corrosive cleaning fluids or disinfectants to \nclean the main brush.\n* Clean monthly and replace every 3-6 months.\nUnscrew the side brush screw. Remove and \nclean the side brush. Reinstall the brush and \ntighten the screw.\nD2 Side Brush\nD3-1—Use a tool, such as a small screwdriver, \nto pry out the axle and take out the wheel.\n* Clean as required.']","No, only use clean water without any cleaning liquid to prevent blockage.",Only cleaning solutions officially recommended by Roborock may be used. Other detergents may cause corrosion or damage.,1.0,0.0,0.0,500,80
Which model has automatic mop washing?,"['Notes:\nperformance. During cleaning, tap Dock \nbutton in the app to send robot back for \nmop washing. When the robot is charging, \npress and hold the  button on the robot or \ntap Wash button in the app to manually start \nwashing. Press any button to stop washing.\nDeactivating WiFi\nTo disconnect the robot from WiFi, press \nthe Reset button until you hear a voice', '12\nIf the robot is paused for over 10 minutes, \nit will go to sleep, and the power indicator \nlight will flash every few seconds. Press any \nbutton to wake the robot up.\nNotes:\n • The robot will not go to sleep when it is charging.\n • The robot will automatically shut down if left sleep for \nmore than 12 hours.\nSleepC8\nNotes:\n • To make sure the robot to wash the mop cloths \nautomatically, start the robot from the dock and do \nnot move the dock during cleaning.\n • Mop wash frequency and mode can be modified in \nthe app.\n • To avoid burns from hot water, do not touch the water \noutlets.\nAfter cleaning, the robot will return to \nEmptyingC10\nNotes:\n • When emptying has been left unused for a long \nperiod, empty the dustbin manually and make sure \nthe air inlet is clear for optimal emptying performance.\n • Auto-emptying can be disabled in the app.\n • Avoid frequent manual emptying.\nDuring cleaning, the robot automatically \ndetermines when it should return to the dock \nfor mop washing and water tank refilling \nto maximize its mopping performance. To \nmanually start washing, press and hold  \nor tap the corresponding button in the app. \nPress any button to stop washing.\nWashing the Mop ClothsC9\nDrying starts automatically after mop\nwashing or after cleaning is completed. \nTo manually start or stop drying, tap the \ncorresponding button in the app.\nNotes:\n • Stay away from the drying air outlets during drying.\n • Drying duration can be modified in the app.\n • Auto-drying can be disabled in the app.\nDryingC11\nNote: Smart Cleaning Solution Filling can be disabled \nin the app.\nThe robot will automatically add cleaning \nsolution to the water for mop washing and \nrobot water tank refilling according to the \npreset ratio to ensure optimal mopping \nperformance.', '• The robot will not auto-emptying after returning to the \ndock in the Do Not Disturb (DND) mode. Adjust cleaning \nor DND duration, or start emptying manually. \nUnable to wash \nthe mop cloths. \n • The mop will not be washed if not used.\n • If the robot does not start from the dock or no dock is \nfound on the app map, it will not return to the dock for \nmop washing.\n • Check clean water tank placement or refill as required.\n • Check dirty water tank placement or empty as required.\n • Check that the cleaning tank or cleaning tank filter has \nbeen correctly installed.\nUnable to wash \nthe mop cloths \nwith hot water.\n • Check that Mop Washing with Hot Water is enabled in \nthe app.\nUnable to extend \nthe mop cloth.\n • Check whether the FlexiArm Extend Cleaning feature is \nenabled in the app.\n • The mop cloth will only extend along walls and certain \nobstacles.\n • Please check if the mop extension structure is stuck.']",The Roborock Qrevo Pro and the Roborock S8 MaxV Ultra both feature automatic mop washing.,"Roborock S7 Pro Ultra, S8 MaxV Ultra and Qrevo Pro support automatic mop washing.",0.0,0.0,0.0,500,80
Does Roborock S9 exist?,"['05\nRestrictions\n • Only use the product in accordance with the User Manual. Any loss or damage caused by improper use will be borne by the user.\n • Roborock assumes responsibility only for losses resulting from installation performed by authorized Roborock technicians, excluding losses \narising from incorrect installation by other people.\n • Before installing/removing the dock and its pipes, make sure the dock is disconnected from the power source.\n • Make sure dustbin, washable filter, dust bag, side brush, mop cloths, main brushes and main brush cover are installed in place before \ncleaning.\n • Do not sit or stand on the robot or dock.\n •To prevent corrosion or damage, do not use any disinfectant and only use cleaning solution recommended by Roborock in the solution cartridge.\n •Do not put any low objects (such as shoes, mats) near raised areas like stairs. Otherwise, the robot may fall down caused by malfunctional sensors.\n • To prevent water damage, make sure that the floor where the robot operates is free of water.\n • Do not use this product on elevated surfaces without barriers such as the floor of a loft, an open-ended terrace, a slide, or top of furniture.\n • To prevent blocking the product and to avoid damage to valuables, remove lightweight items (such as plastic bags) and fragile objects (such \nas vases) from the floor before cleaning.\n • Do not use the product to clean hard or sharp objects (such as decoration wastes, glass, and nails) to avoid scratching the robot or the floor.\nSafety Information\nWARNING \nCAUTION\n • For the purposes of recharging the battery, only use the detachable supply unit roborock EWFD13HRR or EWFD14HRR provided with this product.\n • To prevent injury caused by blades used to cut hair inside the main brush cover, make sure to install two main brushes in place before \ninstalling the main brush cover.\n • The product must be switched off and the plug must be removed from socket outlet before cleaning or maintaining the product.', '09\nPlacing a paused robot on the dock manually will end \nthe current cleanup.\nNote:\nWhen the robot is running, press any \nbutton to pause it, press the  button to \nresume cleaning, press the  button to \nsend it back to the dock.\nPause\nIf the robot is paused for over 10 minutes, it \nwill go to sleep, and the power indicator will \nflash every few seconds. Press any button \nto wake the robot up.\nSleep\nNotes:\n • The robot will not go to sleep when it is charging.\n • The robot will automatically shut down if left in sleep mode \nfor more than 12 hours.\nThe default Do Not Disturb (DND) period is \nfrom 22:00 to 08:00. You can use the app to \ndisable the DND mode or modify the DND \nperiod. When DND mode is activated, the \nrobot will not automatically resume cleanup, \nthe power indicator light will dim, and the \nvolume of the voice prompts will lower.\nDND Mode\nChild Lock\nPress and hold the  button to enable/\ndisable the child lock. You can also set it in \nthe app. Once enabled, the robot will not \nreact to button presses when it is \nstationary. When the robot is cleaning or \ndocking, press any button to stop it.\nError\nIf an error occurs, the power indicator will \nflash red and a voice alert will sound. See \n“Errors” for solutions.\nNotes:\n • The robot will go to sleep automatically if left in a \nmalfunctioning state for over 10 minutes.\n • Placing a malfunctioning robot on the dock manually will \nend the current cleanup.\nRestore Factory Settings\nIf the robot does not function properly after \na system reset, switch it on. Press and hold \nthe  button and at the same time press \nReset button until you hear the “Restoring \nfactory settings” voice prompt. The robot \nwill then be restored to factory settings.', 'Press  and  simultaneously to start spot \ncleaning.\nCleaning range: The robot cleans a 1.5 m \n(4.9 ft) × 1.5 m (4.9 ft) square area centered \non itself.\nNote: After spot cleaning, the robot will automatically \nreturn to the starting point and wait for orders.\nWhen the robot is running, press any button \nto pause it, press  to resume cleaning, \npress  to send it back to the dock, and \nSpot CleaningC5\nMop OnlyC6\nPauseC7\nIf you cannot connect to the robot due to your \nrouter configuration, a forgotten password, or any other \nreason, reset the WiFi and add your robot as a new device.\nNote: entirely removed before adding cleaning solution.\n • To prevent corrosion or damage, do not use \nany disinfectant and only use cleaning solution \nrecommended by Roborock in the solution cartridge.\n • Cleaning solution is not included in the package. \nPurchase one if needed.']",There is no information available about a Roborock S9. The provided text mentions the Roborock S8 MaxV Ultra and the Roborock S7 Pro Ultra.,I could not find that information in the provided manuals.,0.0,0.0,1.0,500,80
