user_input,retrieved_contexts,response,reference,faithfulness,context_precision,context_recall,chunk_size,chunk_overlap
How do I reset Wi-Fi on Roborock S7 Pro Ultra?,"['B1-4—\n❷ Reset WiFi\n1. Open the top cover and find the WiFi \nindicator.\n2. Press and hold the  and  buttons until \nyou hear the “Resetting WiFi” voice alert. \nThe reset is complete when the WiFi \nindicator flashes slowly. The robot will then \nwait for a connection.\nOpen the Roborock App, tap the “Search for \ndevice” button, or open Xiaomi Home app, \ntap “+” in the top right corner and add the \ndevice as instructed in the app. \nNotes:\n • The actual process may vary due to ongoing app updates. \nFollow the instructions provided in the app.\n • Only 2.4 GHz WiFi is supported.\n • If the robot waits more than 1 hour for a connection, WiFi \nwill be automatically disabled. If you want to reconnect, \nreset the WiFi before proceeding.\n❸ Add device\nIf you cannot connect to the robot due to your router \nconfiguration, a forgotten password, or any other reason, reset \nthe WiFi and add your robot as a new device.\nNote:', 'Make \nsure the charging dock power indicator \nturns off and a “charging” voice alert sounds. \nTo maintain the performance of the high-\nperformance lithium-ion rechargeable \nbattery pack, keep the robot charged.\nPlace the dock on a hard and flat floor \n(wood/tile/concrete etc.), flat against a \nwall. Keep at least 0.5 m (1.6 ft) of \nclearance on either side, 1.5 m (4.9 ft) \nin front, and 1 m (3.3 ft) above. Make \nsure the location has good WiFi for a \nbetter experience with the mobile \napp, and then plug it in.\nB1-4—\n❷ Reset WiFi\n1. Open the top cover and find the WiFi \nindicator.\n2. Press and hold the  and  buttons until \nyou hear the “Resetting WiFi” voice alert. \nThe reset is complete when the WiFi \nindicator flashes slowly. The robot will then \nwait for a connection.', '008\nConnecting to the App\nSearch for “Roborock” in the App Store or \nGoogle Play or scan the QR code to download \nand install the app.\n1. Download App\na. Open the top cover and find the WiFi \nindicator light.\n2. Reset WiFi\nb. Press and hold the  and  buttons \nuntil you hear the “Resetting WiFi” voice \nmessage. The reset is complete when the \nWiFi indicator light flashes slowly. The \nrobot will then wait for a connection.\nIf you cannot connect to the robot due to your \nrouter configuration, a forgotten password, or any other \nreason, reset the WiFi and add your robot as a new device.\nNote:\nNotes:\n • The actual process may vary due to ongoing app updates. \nFollow the guide provided in the app.\n • Only 2.4 GHz WiFi is supported.\nOpen the Roborock app, tap the “Scan to \nConnect” or “Search for Device” button and \nadd your device as instructed in the app.\n3. Add Device\nC2-1—Zone 1 – Cleaned.\nC2-2—Zone 2 – Cleaned.', '13\nIf the robot does not respond when a button \nis pressed or cannot be turned off, reset the \nsystem by pressing the Reset button.\nResetting the SystemC17\nNote: After resetting the system, existing settings such \nas scheduled cleaning and WiFi will be restored to \nfactory settings.\nTo disconnect the robot from WiFi, press \nthe Reset button until you hear a voice \nmessage. Then wait for 5 minutes and the \nWiFi will be automatically deactivated. If you \nwant to reconnect, please follow the related \nconnecting instructions.\nIf the robot does not function properly after \na system reset, switch it on. Press and hold  \n and at the same time, press the Reset \nbutton until you hear the “Restoring \nfactory settings” voice message. The robot \nwill then be restored to factory settings.\nDeactivating WiFiC18\nRestoring Factory SettingsC19\nNote: The frequency of replacement may vary with the \nactual situation. If abnormal wear occurs, replace the \nparts immediately.\n* Clean every 2 weeks and replace every 6-12 months.', 'Ensure there \nare no leaks throughout the pipeline. Then, \nconnect the power supply, and make sure \nthe status indicator light comes on.\nSearch for ""Roborock"" in the App Store \nor Google Play or scan the QR code to \ndownload and install the app.\nConnecting to the App\n1. Download the App\na. Remove the magnetic top cover and find \nthe WiFi indicator light.\nb. Press and hold  and  simultaneously \nuntil you hear the ""Resetting WiFi"" voice \nmessage. The reset is complete when \nthe WiFi indicator light flashes slowly. The \nrobot will then wait for a connection.\n2. Reset WiFi\nConnect to Drainage PipelineB7\nNotes:\n • Ensure the floor drain or drainpipe outlet is \nunobstructed. Avoid inserting the drainpipe into a \nsealed chamber to prevent poor drainage.\n • Ensure the connection between the drainpipe and the \nfloor drain or sewer pipe is securely fastened.\n • If other water-using equipment is connected to the \nsame drainpipe, make sure that their drainage doesn\'t \ndisrupt the dock\'s drainage to prevent leaks.', 'Press and hold \nthe  button and at the same time, press the \nReset button until you hear the “Restoring \nfactory settings” voice message. The robot \nwill then be restored to factory settings.\n* Clean every 2 weeks and replace every 6-12 months.\nD1-1—Main Brush Cover\nD1-2—Main Brush Cover Latches\nD1-3—Main Brush\nD1-4—Main Brush Caps\nD1-5—Main Brush Bearing\nD1-6—Turn over the robot and press the \nmain brush latches to remove the \nmain brush cover.\nD1-7—Pull out the main brush and remove \nthe main brush bearing. Rotate the \nmain brush caps in the indicated \nunlock direction to remove the caps, \nRoutine MaintenanceD\nD1 Main Brush\nThe frequency of replacement may vary depending \non the situation. If abnormal wear occurs, replace the parts \nimmediately.\nNote:\nmessage. Then wait for 5 minutes and the \nWiFi will be automatically deactivated. If you \nwant to reconnect, please follow the related \nconnecting instructions.\nand remove any entangled hair or \ndirt at both ends of the main brush.', 'Place it closer and retry.\nAbnormal behavior  • Restart the robot.\nNoise during cleaning    • The main brush, side brush, main wheels, or omni-directional wheel may be jammed. Turn off the robot and clean them. \n • VibraRise system abnormal. Check for jammed objects.\nUnable to connect to WiFi   \n • WiFi is disabled. Reset the WiFi and try again.\n • The WiFi signal is poor. Move the robot to an area with good WiFi reception.\n • Abnormal WiFi connection. Reset the WiFi, download the latest mobile app, and retry.\n • The current Roborock robot is not supported. You can find supported models in the app. \n • Unable to connect to WiFi abruptly. There may be an error with your router settings. Contact Roborock customer \nservice for additional support.\nPoor cleaning ability or dust falling out \n • The dustbin is full and needs emptying.\n • The filter is blocked and needs cleaning.\n • The main brush is jammed and needs cleaning.\nScheduled cleaning is not working  • Keep the robot charged. Scheduled cleaning can only begin when the battery level is above 20%.', 'Charging\nAfter cleaning,  the robot will automatically \nreturn to the dock to charge.\nIn Pause mode, press the  button to send \nthe robot back to the dock. The power \nindicator will pulse as the robot charges.\nIf the robot fails to find the dock, it will automatically \nreturn to its starting location. Place the robot on the dock \nmanually to recharge.\nNote:\nSystem Reset\nIf the robot does not respond when a \nbutton is pressed or cannot be turned off, \nreset the system. Press the Reset button, \nand the robot will reset automatically.\nAfter resetting the system, scheduled cleaning, WiFi, \netc. will be restored to factory settings.\nNote:', 'Restore Factory Settings\nIf the robot does not function properly after \na system reset, switch it on. Press and hold \nthe  button and at the same time press \nReset button until you hear the “Restoring \nfactory settings” voice prompt. The robot \nwill then be restored to factory settings.\nApp Features\nCleaning Map\n • Multi-Map Management\n • Real-Time Vacuum and Mop Route\n • Carpet Display\n • Map Zoning\n • Map Editing\nCustom Cleaning Modes\n • Scheduled\n • Selective Room\n • Zone\n • No-Go Zones and Invisible Wall\n • Custom\n • Carpet Boost\n • Mop Wash Interval Settings\nCleaning Mode Switch\n • Suction Power Levels\n • Washing Intensity Levels \n • Mop Washing Modes\n • Custom Modes\nRobot Information\n • Cleaning History\n • Battery Level\n • Care & Maintenance\nStopping Emptying\nPress any button to stop emptying.\nCharging\nAfter cleaning,  the robot will automatically \nreturn to the dock to charge.\nIn Pause mode, press the  button to send \nthe robot back to the dock. The power \nindicator will pulse as the robot charges.', 'Lift the dustbin and remove the \nbag vertically as shown.\nDiscard the dust bag and clean \naround the filter with a dry cloth.\nSlot in a new disposable dust bag \nas shown. Slide until it reaches the \nbottom of the slot and reinstall the \ndustbin securely.\nAlways install a dust bag before putting back the \ndustbin top lid to avoid auto-emptying without the bag. You \ncan also disable auto-emptying in the app.\nNote:\nNote:\n* Replace the disposable dust bag when it is full. \nC15-1—\nC15-2—\nC15-3—\nC15 Replacing the Disposable \nDust Bag\n* Clean as required.\nRemove the clean water tank, dirty \nwater tank, and dustbin.\nFollow the following steps to clean the air \nduct and avoid blockages.\nC16-1—\nC16 Cleaning the Air Duct\n* Clean as required.\nLift the high-speed maintenance brush latch \nand remove the brush, as shown below. \nRemove any entangled objects in the \nhigh-speed maintenance brush and rinse it \nclean. Reinstall the brush and latch it in place.', 'Move it to an open \narea.\n • Robot too far from the dock. Place it closer and retry.\nNoise during \ncleaning\n • The main brushes, flexible side brush, or main wheels \nmay be jammed. Turn off the robot and clean them.\n • The omnidirectional wheel may be jammed. Use a \nscrewdriver to remove it for cleaning.\nUnable to \nconnect to WiFi\n • WiFi disabled. Reset the WiFi and try again.\n • Poor WiFi signal. Move the robot to an area with good \nWiFi reception.\n • Abnormal WiFi connection. Reset the WiFi, download \nthe latest app version and retry.\n • Unable to connect to WiFi abruptly. There may be an \nerror with your router settings. Contact Roborock \nCustomer Service for help with troubleshooting.\nCommon Issues\nIssue Solution\nIs power always \nbeing drawn \nwhen the robot \nis on the dock?\n • The robot will draw power while it is docked to \nmaintain battery performance, but the power \nconsumption is extremely low.', 'C3-1—\n* Clean as required.\nRinse the wheel and the axle with \nwater to remove any hair and dirt. \nDry and reattach the wheel, pressing \nit firmly in place.\nC3-2—\nThe omni-directional wheel bracket cannot be removed.Note:\nC5  Dustbin\nOpen the dustbin cover and remove \nthe filter, then empty the dustbin.\nC5-2—\nOpen the top cover of the robot and \ntake out the dustbin.\nC5-1—\n* Clean as required.\nFill the dustbin with clean water \nand close the cover. Gently shake \nthe dustbin, and then pour out the \ndirty water.\nC5-3—\nTo prevent blockage, only use clean water without any \ncleaning liquid.\nNote:\nLeave the dustbin and the washable \nfilter to dry.\nC5-4—\nPurchase an additional filter and alternate if necessary.\nRinse the filter repeatedly and tap it \nto remove as much dirt as possible.\nAllow 24 hours for the filter to dry \nthoroughly and reinstall it.']","To reset the Wi-Fi on your Roborock S7 Pro Ultra, open the top cover to locate the Wi-Fi indicator. Press and hold both the button and the button simultaneously until you hear a ""Resetting WiFi"" voice alert. The Wi-Fi indicator will then flash slowly, signifying that the reset is complete and the robot is ready for a connection.",Open the top cover and locate the Wi-Fi indicator. Press and hold the Power and Home buttons until you hear 'Resetting WiFi'. The reset is complete when the Wi-Fi indicator flashes slowly and the robot waits for connection.,1.0,0.94999999997625,1.0,300,75
Can I use detergent in the water tank?,"['Press and hold  to turn on the robot. The \npower indicator light will come on, and the \nrobot will wait for orders.\nPress and hold the  button to turn off the \nrobot and complete the cleaning cycle.\nOn/Off\nThe robot cannot be turned off when it is being charged.Note:\nInstructions for UseC\nRemove and open the clean water tank and \nfill the tank with water to MAX. Close the lid, \nlock the latch, and fit the tank back in place.\nNotes:\n • To prevent corrosion or damage, do not use any disinfectant \nand only use cleaning solution recommended by Roborock \nin the water tank.\n • Do not add too much cleaning solution to prevent the \nrobot from working improperly due to slipping.\n • To avoid water tank deformation, do not place hot water \nin the tank. \n • If water marks remain on the water tank, wipe them \nclean before reinstallation.\nC1 Filling the Water Tank\nPress the  button to start cleaning. The \nrobot will plan its cleaning route according \nto its scan of the room.', 'Note:\nLeave the dustbin and the washable \nfilter to dry.\nC5-4—\nPurchase an additional filter and alternate if necessary.\nRinse the filter repeatedly and tap it \nto remove as much dirt as possible.\nAllow 24 hours for the filter to dry \nthoroughly and reinstall it.\nDo not touch the surface of the filter with your hands, \nbrush, or hard objects to avoid potential damage.\nNote:\nNote:\nC6-3—\nC6-2—\nOpen the water tank and fill it with  \nclean water.\nClose the water tank and shake it \ngently.\nPour out the remaining water as \nshown.\nC7-1—\n* Clean as required.\nC7-2— \nC7-3—\nOpen the filter cover and remove the \nfilter.\nC6  Washable Filter\nC7  Water Tank\n* Clean every 2 weeks and replace every 6-12 months.\nC6-1—', '• Placing the dock on a soft surface (carpet/mat) may \ncause the dock to tilt over and cause problems docking \nand departing.\n • Keep the dock away from direct sunlight or anything \nthat may block the dock location beacon; otherwise, \nthe robot may fail to return to the dock.\n • Do not use the dock without clean water tank, dirty \nwater tank, dust container cover, disposable dust bag, \nor cleaning tank.\n • Maintain the dock according to the maintenance instructions. \nDo not clean the dock with a wet cloth or tissue.\n • All docks are subject to water-based tests before \nleaving the factory. It is normal that a small amount of \nwater remains in the waterway of the dock.\nA10-17—Water Level Float\nA10-18—Cleaning Tank Filter\nA10-19—Cleaning Tank\nAttach the base by pressing down \nboth sides of the base firmly, and \nthen pressing the connecting part in \nthe middle until you hear a click.', 'C16-1—\nC16 Cleaning the Air Duct\n* Clean as required.\nLift the high-speed maintenance brush latch \nand remove the brush, as shown below. \nRemove any entangled objects in the \nhigh-speed maintenance brush and rinse it \nclean. Reinstall the brush and latch it in place.\n* Clean as required and replace every 6-12 months.\nClean the dirty water tank as needed. Open \nthe dirty water tank lid and pour out the \ndirty water. Fill the tank with clean water, \nclose the lid, lock it, and shake. Pour out the \ndirty water. Close the lid and then re-install.\nC12 Dirty Water Tank\nC13 High-Speed Maintenance \nBrush\nRemove the VibraRise mop cloth from \nthe VibraRise mop mount. Clean the \nVibraRise mop cloth and air-dry it.\nC8-1—\n* Clean after each use and replace every 3-6 months.\nA dirty VibraRise mop will affect the mopping \nperformance. Clean it before use.\nNote:\nC8  VibraRise Mop Cloth', 'D13-1—Remove the cleaning tank.\nD13-2—Rinse the cleaning tank and the filter \nwith water.\nD13-3—Reinstall the cleaning tank.\n* Clean as required.\nD13 Cleaning Tank\nD9 Moving Dock', '• Watch out for hot water and do not touch the water outlet.\n • Mop wash frequency and washing mode can be modified \nin the app. \nNotes:\nperformance. During cleaning, tap Dock \nbutton in the app to send robot back for \nmop washing. When the robot is charging, \npress and hold the  button on the robot or \ntap Wash button in the app to manually start \nwashing. Press any button to stop washing.\nDeactivating WiFi\nTo disconnect the robot from WiFi, press \nthe Reset button until you hear a voice', 'Note:\nWhen using the robot for the first time, follow it \nthroughout its whole cleaning route and watch for potential \nproblems. The robot will be able to clean by itself in future uses.\nNote:\nConnect the power cable to the back \nof the dock, and keep excess cable \ninside the storage slot.\nB1-3—\nB1  Position the charging dock\nA11 Empty Wash Fill Dock  \nA11-1—Water Tank Handle\nA11-2—Dirty Water Tank\nA11-3—Self-Filling Port\nA11-4—Dock Location Beacon\nA11-5—Charging Contacts\nA11-6—Washing Strip\nA11-7—High-Speed Maintenance Brush\nA11-8—Maintenance Brush Latch\nA11-9—Dustbin\nA11-10—Water Tank Lid\nA11-11—Clean Water Tank\nA11-12—Water Tank Latch\nA11-13—Status Indicator Light\n • Pulsing: Emptying/Washing Mop\n • Red: Dock error\n • Light off: Charging/Powered Off\nA11-14—Water Filter\nA11-15—Dock Base', 'Moving the DockD11\nWash the mop cloth and air-dry it.D7-2—\nReinstall the mop cloth and tighten \nthe screw.\nD7-3—\nA dirty mop cloth will affect the mopping \nperformance. Clean it before use.\nNote:\nRemove the filter.D6-1—\nRinse the filter repeatedly and tap it \nto remove as much dirt as possible.\nD6-2—\nDo not touch the surface of the filter with hands, \nbrush, or hard objects to avoid potential damage.\nNote:\n* Clean every 2 weeks and replace every 6-12 months.\nWashable FilterD6\nReinstall the cleaning tank.D14-3—\nRinse the cleaning tank with water.D14-2—\nLeave the dustbin and the washable \nfilter to dry.\nD5-4—\nTo prevent blockage, only use clean water without \nany cleaning liquid.\nNote:\nFill the dustbin with clean water and \nreinstall the washable filter. Gently \nshake the dustbin, and then pour \nout the dirty water.', 'Spot Cleaning Manually Activated Emptying\nAuto-Emptying\nEmptying can be triggered manually by \npressing the  button while the robot is \ncharging.\nAuto-emptying will begin when the robot \nreturns to the dock after cleaning.\nAvoid frequent manual emptying.Note:\nNotes:\n • If the dock has not emptied for an extended period, \nempty the robot dustbin manually and clear the air \ninlet of any debris to ensure optimum performance.\n • If necessary, auto-emptying can be disabled in the \napp.\nManually Activated Mop \nWashing\nDuring cleaning, press any button to pause, \nthen press and hold the  button to send \nthe robot back for mop washing.\nAuto Mop Washing\nDuring cleaning, the robot automatically \ndetermines when it should return to dock \nfor mop washing and water tank refilling to \nmaximize its mopping performance.\nTo allow the robot to wash the mop automatically, \nstart the robot from the dock once it is fully charged. Do \nnot move the dock during cleaning.\nNote:', '• Unplug the power cord before placing the dock into storage.\n • Do not discard waste batteries. Leave them with a professional recycling organization.\n • To transport the product, make sure it is powered off and shut down, and empty the remaining fluid in the water tanks. Original packaging \nis advised.\nBattery and Charging \nWARNING \nInternational Symbols Explanation\n  – PROTECTIVE EARTH (Protective Ground) symbol [symbol IEC 60417-5019 (2009-02)]          \n •To prevent corrosion or damage, do not use any disinfectant and only use cleaning solution recommended by Roborock in the water tank.\n •Do not put any low objects (such as shoes, mats) near raised areas like stairs. Otherwise, the robot may fall down caused by malfunctional sensors.\n • To prevent water damage, make sure that the floor where the robot operates is free of water.', '010\nD5-1—Open the top cover of the robot and \npress the dustbin latch to take out \nthe dustbin.\n* Clean as required.\nD5-2—Open the washable filter and empty \nthe dustbin.\nD5-3—Fill the dustbin with clean water and \nreinstall the washable filter. Gently \nshake the dustbin, and then pour out \nthe dirty water.\n* Clean every 2 weeks and replace the filter every 6-12 months.\nD6-1—Remove the filter.\nD6-2—Rinse the filter repeatedly and tap it \nto remove as much dirt as possible.\nD6-3—Allow at least 24 hours for the filter \nto dry thoroughly and reinstall it.\nDo not touch the surface of the filter with your \nhands, brush, or hard objects to avoid potential damage.\nNote:\nTo prevent blockage, only use clean water without \nany cleaning liquid.\nNote:\nD5-4—Leave the dustbin and the washable \nfilter to dry.\nD1-8—Reinstall the main brush.\nD7-1—Remove the mop cloth from the mop \ncloth mount.', 'Note:\nAuto-emptying will automatically begin when \nthe robot returns to the dock after cleaning. \nTo manually emptying, press  button on the \ndocked robot or tap the corresponding button \nin the app. Press any button to stop emptying. \nEmptying\n • When auto-emptying has been left unused for a long \nperiod, empty the dustbin manually and make sure \nthe air inlet is clear for optimal emptying performance.\n • Auto-emptying can be disabled through the app.\n • Avoid frequent manual emptying.\nNotes:\nDrying starts automatically after mop washing \nor after cleaning is completed. To manually \nstart or stopping drying, tap the corresponding \nbutton in the app. \nDrying\n • To allow the robot to wash the mop automatically, \nstart the robot from the dock and do not move the \ndock during cleaning.\n • Watch out for hot water and do not touch the water outlet.\n • Mop wash frequency and washing mode can be modified \nin the app. \nNotes:\nperformance. During cleaning, tap Dock \nbutton in the app to send robot back for \nmop washing.']","To prevent corrosion or damage, do not use any disinfectant and only use cleaning solution recommended by Roborock in the water tank.",Only cleaning solutions officially recommended by Roborock may be used. Other detergents may cause corrosion or damage.,1.0,0.5166666666494445,1.0,300,75
Which model has automatic mop washing?,"['• Watch out for hot water and do not touch the water outlet.\n • Mop wash frequency and washing mode can be modified \nin the app. \nNotes:\nperformance. During cleaning, tap Dock \nbutton in the app to send robot back for \nmop washing. When the robot is charging, \npress and hold the  button on the robot or \ntap Wash button in the app to manually start \nwashing. Press any button to stop washing.\nDeactivating WiFi\nTo disconnect the robot from WiFi, press \nthe Reset button until you hear a voice', 'After cleaning, the robot will return to \nEmptyingC10\nNotes:\n • When emptying has been left unused for a long \nperiod, empty the dustbin manually and make sure \nthe air inlet is clear for optimal emptying performance.\n • Auto-emptying can be disabled in the app.\n • Avoid frequent manual emptying.\nDuring cleaning, the robot automatically \ndetermines when it should return to the dock \nfor mop washing and water tank refilling \nto maximize its mopping performance. To \nmanually start washing, press and hold  \nor tap the corresponding button in the app. \nPress any button to stop washing.\nWashing the Mop ClothsC9\nDrying starts automatically after mop\nwashing or after cleaning is completed. \nTo manually start or stop drying, tap the \ncorresponding button in the app.\nNotes:\n • Stay away from the drying air outlets during drying.\n • Drying duration can be modified in the app.\n • Auto-drying can be disabled in the app.\nDryingC11\nNote: Smart Cleaning Solution Filling can be disabled \nin the app.', 'Note:\nAuto-emptying will automatically begin when \nthe robot returns to the dock after cleaning. \nTo manually emptying, press  button on the \ndocked robot or tap the corresponding button \nin the app. Press any button to stop emptying. \nEmptying\n • When auto-emptying has been left unused for a long \nperiod, empty the dustbin manually and make sure \nthe air inlet is clear for optimal emptying performance.\n • Auto-emptying can be disabled through the app.\n • Avoid frequent manual emptying.\nNotes:\nDrying starts automatically after mop washing \nor after cleaning is completed. To manually \nstart or stopping drying, tap the corresponding \nbutton in the app. \nDrying\n • To allow the robot to wash the mop automatically, \nstart the robot from the dock and do not move the \ndock during cleaning.\n • Watch out for hot water and do not touch the water outlet.\n • Mop wash frequency and washing mode can be modified \nin the app. \nNotes:\nperformance. During cleaning, tap Dock \nbutton in the app to send robot back for \nmop washing.', '12\nIf the robot is paused for over 10 minutes, \nit will go to sleep, and the power indicator \nlight will flash every few seconds. Press any \nbutton to wake the robot up.\nNotes:\n • The robot will not go to sleep when it is charging.\n • The robot will automatically shut down if left sleep for \nmore than 12 hours.\nSleepC8\nNotes:\n • To make sure the robot to wash the mop cloths \nautomatically, start the robot from the dock and do \nnot move the dock during cleaning.\n • Mop wash frequency and mode can be modified in \nthe app.\n • To avoid burns from hot water, do not touch the water \noutlets.\nAfter cleaning, the robot will return to \nEmptyingC10\nNotes:\n • When emptying has been left unused for a long \nperiod, empty the dustbin manually and make sure \nthe air inlet is clear for optimal emptying performance.\n • Auto-emptying can be disabled in the app.\n • Avoid frequent manual emptying.', 'Note: Compared with the traditional cleaning mode, \nnoise emanating from Mop Only is much lower.\nPress  and  simultaneously to start spot \ncleaning.\nCleaning range: The robot cleans a 1.5 m \n(4.9 ft) × 1.5 m (4.9 ft) square area centered \non itself.\nNote: After spot cleaning, the robot will automatically \nreturn to the starting point and wait for orders.\nWhen the robot is running, press any button \nto pause it, press  to resume cleaning, \npress  to send it back to the dock, and \nSpot CleaningC5\nMop OnlyC6\nPauseC7\nIf you cannot connect to the robot due to your \nrouter configuration, a forgotten password, or any other \nreason, reset the WiFi and add your robot as a new device.\nNote: entirely removed before adding cleaning solution.\n • To prevent corrosion or damage, do not use \nany disinfectant and only use cleaning solution \nrecommended by Roborock in the solution cartridge.\n • Cleaning solution is not included in the package. \nPurchase one if needed.', '• The robot will not auto-emptying after returning to the \ndock in the Do Not Disturb (DND) mode. Adjust cleaning \nor DND duration, or start emptying manually. \nUnable to wash \nthe mop cloths. \n • The mop will not be washed if not used.\n • If the robot does not start from the dock or no dock is \nfound on the app map, it will not return to the dock for \nmop washing.\n • Check clean water tank placement or refill as required.\n • Check dirty water tank placement or empty as required.\n • Check that the cleaning tank or cleaning tank filter has \nbeen correctly installed.\nUnable to wash \nthe mop cloths \nwith hot water.\n • Check that Mop Washing with Hot Water is enabled in \nthe app.\nUnable to extend \nthe mop cloth.\n • Check whether the FlexiArm Extend Cleaning feature is \nenabled in the app.\n • The mop cloth will only extend along walls and certain \nobstacles.\n • Please check if the mop extension structure is stuck.', 'To manually start or stop drying, tap the \ncorresponding button in the app.\nNotes:\n • Stay away from the drying air outlets during drying.\n • Drying duration can be modified in the app.\n • Auto-drying can be disabled in the app.\nDryingC11\nNote: Smart Cleaning Solution Filling can be disabled \nin the app.\nThe robot will automatically add cleaning \nsolution to the water for mop washing and \nrobot water tank refilling according to the \npreset ratio to ensure optimal mopping \nperformance.\nAuto Cleaning Solution AdditionC12\nNote: If the robot fails to find the dock, it will automatically \nreturn to its starting position. Place the robot on the \ndock manually to recharge.\nAfter cleaning, the robot will automatically \nreturn to the dock to charge.\nChargingC13\nThe default Do Not Disturb (DND) period is \nfrom 22:00 to 08:00.', '• If the robot does not start from the dock or no dock \nis found on the app map, it will not return to the dock \nfor mop washing.\n • The refill and drainage pipes are not installed or not \nproperly installed.\n • Check that the water filter has been correctly installed.\nUnable to start \nauto-drying\n • Auto-drying is disabled. Check in-app settings.\n • If you press a robot button or the robot departs the \ndock during drying, the drying will end in advance.\n • In a humid environment, it is recommended to extend \nthe drying duration in the app to improve the drying \nperformance.\nUnable to wash \nthe mop cloths \nwith hot water\n • Check that Mop Washing with Hot Water is enabled in \nthe app.', 'Check and install in place.\n • The filter, air duct, suction inlet, air inlet, dustbin or dust \nbag is blocked. Clean to remove blockages.\nReduced \nmop washing \nperformance.\n • The mop cloths are not attached properly. Reinstall.\n • The floor is dirty. Change the mop washing mode in the \napp for better cleaning.\nUnable to start \nauto-drying.\n • Auto-drying is disabled. Check in-app settings.\n • Auto-drying starts only after mopping or mop washing.\nIssue Solution\nUnable to \nauto-empty.\n • Auto-emptying is disabled. Check in-app settings.\n • Dock dust container cover is not installed. Check and install.\n • Auto-emptying will not be triggered if the robot returns \nto the dock without cleaning.\n • The robot will not auto-emptying after returning to the \ndock in the Do Not Disturb (DND) mode. Adjust cleaning \nor DND duration, or start emptying manually. \nUnable to wash \nthe mop cloths. \n • The mop will not be washed if not used.', 'Moving the DockD11\nWash the mop cloth and air-dry it.D7-2—\nReinstall the mop cloth and tighten \nthe screw.\nD7-3—\nA dirty mop cloth will affect the mopping \nperformance. Clean it before use.\nNote:\nRemove the filter.D6-1—\nRinse the filter repeatedly and tap it \nto remove as much dirt as possible.\nD6-2—\nDo not touch the surface of the filter with hands, \nbrush, or hard objects to avoid potential damage.\nNote:\n* Clean every 2 weeks and replace every 6-12 months.\nWashable FilterD6\nReinstall the cleaning tank.D14-3—\nRinse the cleaning tank with water.D14-2—\nLeave the dustbin and the washable \nfilter to dry.\nD5-4—\nTo prevent blockage, only use clean water without \nany cleaning liquid.\nNote:\nFill the dustbin with clean water and \nreinstall the washable filter. Gently \nshake the dustbin, and then pour \nout the dirty water.', 'Clean and \ninstall in place.\nIssue Solution\nReduced \nmop washing \nperformance\n • The mop cloths are not attached properly. Reinstall \nthem.\n • The floor is dirty. Change the mop washing mode to \n""Deep"" in the app for better cleaning.\nUnable to \nauto-empty\n • Auto-emptying is disabled. Check in-app settings.\n • Dock dust container cover is not installed. Check and \ninstall.\n • Auto-emptying will not be triggered if the robot \nreturns to the dock without cleaning.\n • The robot will not auto-empty after returning to the \ndock in DND mode. Adjust cleaning or DND period, or \nstart emptying manually. \nUnable to wash \nthe mop cloths\n • The mop cloths will not be washed if not used.\n • If the robot does not start from the dock or no dock \nis found on the app map, it will not return to the dock \nfor mop washing.\n • The refill and drainage pipes are not installed or not \nproperly installed.\n • Check that the water filter has been correctly installed.', 'Spot Cleaning Manually Activated Emptying\nAuto-Emptying\nEmptying can be triggered manually by \npressing the  button while the robot is \ncharging.\nAuto-emptying will begin when the robot \nreturns to the dock after cleaning.\nAvoid frequent manual emptying.Note:\nNotes:\n • If the dock has not emptied for an extended period, \nempty the robot dustbin manually and clear the air \ninlet of any debris to ensure optimum performance.\n • If necessary, auto-emptying can be disabled in the \napp.\nManually Activated Mop \nWashing\nDuring cleaning, press any button to pause, \nthen press and hold the  button to send \nthe robot back for mop washing.\nAuto Mop Washing\nDuring cleaning, the robot automatically \ndetermines when it should return to dock \nfor mop washing and water tank refilling to \nmaximize its mopping performance.\nTo allow the robot to wash the mop automatically, \nstart the robot from the dock once it is fully charged. Do \nnot move the dock during cleaning.\nNote:']",The Roborock Qrevo Pro and Roborock S8 MaxV Ultra have automatic mop washing.,"Roborock S7 Pro Ultra, S8 MaxV Ultra and Qrevo Pro support automatic mop washing.",0.5,0.0,0.0,300,75
Does Roborock S9 exist?,"['Place it closer and retry.\nAbnormal behavior  • Restart the robot.\nNoise during cleaning    • The main brush, side brush, main wheels, or omni-directional wheel may be jammed. Turn off the robot and clean them. \n • VibraRise system abnormal. Check for jammed objects.\nUnable to connect to WiFi   \n • WiFi is disabled. Reset the WiFi and try again.\n • The WiFi signal is poor. Move the robot to an area with good WiFi reception.\n • Abnormal WiFi connection. Reset the WiFi, download the latest mobile app, and retry.\n • The current Roborock robot is not supported. You can find supported models in the app. \n • Unable to connect to WiFi abruptly. There may be an error with your router settings. Contact Roborock customer \nservice for additional support.\nPoor cleaning ability or dust falling out \n • The dustbin is full and needs emptying.\n • The filter is blocked and needs cleaning.\n • The main brush is jammed and needs cleaning.\nScheduled cleaning is not working  • Keep the robot charged. Scheduled cleaning can only begin when the battery level is above 20%.', '05\nRestrictions\n • Only use the product in accordance with the User Manual. Any loss or damage caused by improper use will be borne by the user.\n • Roborock assumes responsibility only for losses resulting from installation performed by authorized Roborock technicians, excluding losses \narising from incorrect installation by other people.\n • Before installing/removing the dock and its pipes, make sure the dock is disconnected from the power source.\n • Make sure dustbin, washable filter, dust bag, side brush, mop cloths, main brushes and main brush cover are installed in place before \ncleaning.\n • Do not sit or stand on the robot or dock.\n •To prevent corrosion or damage, do not use any disinfectant and only use cleaning solution recommended by Roborock in the solution cartridge.\n •Do not put any low objects (such as shoes, mats) near raised areas like stairs. Otherwise, the robot may fall down caused by malfunctional sensors.\n • To prevent water damage, make sure that the floor where the robot operates is free of water.', '09\nPlacing a paused robot on the dock manually will end \nthe current cleanup.\nNote:\nWhen the robot is running, press any \nbutton to pause it, press the  button to \nresume cleaning, press the  button to \nsend it back to the dock.\nPause\nIf the robot is paused for over 10 minutes, it \nwill go to sleep, and the power indicator will \nflash every few seconds. Press any button \nto wake the robot up.\nSleep\nNotes:\n • The robot will not go to sleep when it is charging.\n • The robot will automatically shut down if left in sleep mode \nfor more than 12 hours.\nThe default Do Not Disturb (DND) period is \nfrom 22:00 to 08:00. You can use the app to \ndisable the DND mode or modify the DND \nperiod. When DND mode is activated, the \nrobot will not automatically resume cleanup, \nthe power indicator light will dim, and the \nvolume of the voice prompts will lower.\nDND Mode\nChild Lock\nPress and hold the  button to enable/\ndisable the child lock. You can also set it in \nthe app.', '• Do not place any object (including children and pets) on the product or dock, or cover it with any item (including dust-proof cover) whether \nit is in operation or not.\n • Do not pick up anything that is burning or smoking, such as cigarettes, matches, or hot ashes. \n • Do not use the dock to pick up flammable or explosive objects such as fire lighter, gasoline, and toner used in printers or copiers.\nSafety Information\nWARNING', 'There may be an \nerror with your router settings. Contact Roborock \nCustomer Service for help with troubleshooting.\nCommon Issues\nIssue Solution\nIs power always \nbeing drawn \nwhen the robot \nis on the dock?\n • The robot will draw power while it is docked to \nmaintain battery performance, but the power \nconsumption is extremely low.\nDoes the robot \nneed to be \ncharged for at \nleast 16 hours \nfor the first three \nuses?\n • No. Lithium-ion batteries have no memory effect. The \nrobot can be used once fully charged.\nThe robot does \nnot resume \ncleaning after \nrecharging\n • Make sure that the robot is not in DND mode. DND \nmode will prevent auto top-up.\n • If the robot is placed manually on the dock or sent to \ndock by pressing buttons, it will not be able to resume \ncleaning.\nScheduled \ncleaning is not \nworking\n • Keep the robot charged. Scheduled cleaning can only \nbegin when the battery level is above 15%.', 'Brush Cover Latches\nA2-7—Main Wheels\nA3-1—Magnetic Top Cover\nA3-2—WiFi Indicator Light\nA3-3—Reset Button\nA3-4—Charging Contacts\nA3-5—Communication Sensor\nA3-6—Self-Filling Port\nA3-7—Positioning Button\nA3-8—Air Outlets\nA3-9—VibraRise Module\nA3-10—Bumper\nThe mop cloth mounts are non-detachable.', '07\nOption 2: Search for “Xiaomi Home” in the \nApp Store or Google Play or scan the QR \ncode to download and install the app.\nConnecting to the App\nOption 1: Search for “Roborock” in the App \nStore or Google Play or scan the QR code to \ndownload and install the app.\n❶ Download App\nThis robot supports both Roborock and \nXiaomi Home apps. Choose the one that \nbest meets your needs.\nThe robot may not be turned on when the battery \nis low. In this case, connect the robot to the dock.\nNote:Notes:\n • If the power cable hangs vertically to the ground, it may \nbe caught by the robot, causing the dock to be moved or \ndisconnected.\n • The dock indicator is on when the dock is powered on, and \noff when the robot is charging.\n • The dock indicator turns red if an error occurs.\n • Place the dock on a flat floor away from fire, heat, and \nwater. Avoid narrow spaces or locations where the robot \nmay be suspended in the air.', '08\nInstructions\nNotes:\n • To prevent corrosion or damage, only use the Roborock \nbranded floor cleaner in the water tank.\n • To avoid water tank deformation, do not place hot water \nin the tank.\n • If water marks remain on the water tank, wipe them clean \nbefore reinstallation.\nFilling the Clean Water Tank\nOpen the clean water tank. Fill with water \nuntil the Max line. Close the lid, lock the \nlatch, and fit the tank back in place.\nThe robot cannot be turned off when it is being \ncharged.\nNote:\nPress and hold the  button to turn on the \nrobot. The power indicator will turn on and \nthe robot will enter standby mode. Press \nand hold the  button to turn off the robot \nand complete the cleaning cycle.\nOn/Off\nPress the  button to start cleaning. The \nrobot will plan its cleaning route according \nto its scan of the room. It splits a room into \nzones, first draws out zone edges, and then \nfills the zone in a zigzag pattern. In so \ndoing, the robot cleans all zones one by \none, efficiently cleaning the house.', 'C3-1—\n* Clean as required.\nRinse the wheel and the axle with \nwater to remove any hair and dirt. \nDry and reattach the wheel, pressing \nit firmly in place.\nC3-2—\nThe omni-directional wheel bracket cannot be removed.Note:\nC5  Dustbin\nOpen the dustbin cover and remove \nthe filter, then empty the dustbin.\nC5-2—\nOpen the top cover of the robot and \ntake out the dustbin.\nC5-1—\n* Clean as required.\nFill the dustbin with clean water \nand close the cover. Gently shake \nthe dustbin, and then pour out the \ndirty water.\nC5-3—\nTo prevent blockage, only use clean water without any \ncleaning liquid.\nNote:\nLeave the dustbin and the washable \nfilter to dry.\nC5-4—\nPurchase an additional filter and alternate if necessary.\nRinse the filter repeatedly and tap it \nto remove as much dirt as possible.\nAllow 24 hours for the filter to dry \nthoroughly and reinstall it.', 'Make \nsure the charging dock power indicator \nturns off and a “charging” voice alert sounds. \nTo maintain the performance of the high-\nperformance lithium-ion rechargeable \nbattery pack, keep the robot charged.\nPlace the dock on a hard and flat floor \n(wood/tile/concrete etc.), flat against a \nwall. Keep at least 0.5 m (1.6 ft) of \nclearance on either side, 1.5 m (4.9 ft) \nin front, and 1 m (3.3 ft) above. Make \nsure the location has good WiFi for a \nbetter experience with the mobile \napp, and then plug it in.\nB1-4—\n❷ Reset WiFi\n1. Open the top cover and find the WiFi \nindicator.\n2. Press and hold the  and  buttons until \nyou hear the “Resetting WiFi” voice alert. \nThe reset is complete when the WiFi \nindicator flashes slowly. The robot will then \nwait for a connection.', 'Note: Compared with the traditional cleaning mode, \nnoise emanating from Mop Only is much lower.\nPress  and  simultaneously to start spot \ncleaning.\nCleaning range: The robot cleans a 1.5 m \n(4.9 ft) × 1.5 m (4.9 ft) square area centered \non itself.\nNote: After spot cleaning, the robot will automatically \nreturn to the starting point and wait for orders.\nWhen the robot is running, press any button \nto pause it, press  to resume cleaning, \npress  to send it back to the dock, and \nSpot CleaningC5\nMop OnlyC6\nPauseC7\nIf you cannot connect to the robot due to your \nrouter configuration, a forgotten password, or any other \nreason, reset the WiFi and add your robot as a new device.\nNote: entirely removed before adding cleaning solution.\n • To prevent corrosion or damage, do not use \nany disinfectant and only use cleaning solution \nrecommended by Roborock in the solution cartridge.\n • Cleaning solution is not included in the package. \nPurchase one if needed.', 'The robot is \nequipped with a built-in high-performance \nlithium-ion rechargeable battery pack. To \nmaintain battery performance, keep the \nrobot charged.\nThe robot may not be turned on when the battery is \nlow. In this case, place the robot to the dock for charging.\nNote:\nPowering On & ChargingB9\nDock status indicator light dim, robot \npower indicator light breathing: \nCharging\nB9-1—\nConnect the Power SupplyB8\nNotes:\n • If the power cord hangs vertically to the ground, it \nmay be caught by the robot, causing the dock to be \nmoved or disconnected.\nAfter placing the dock at the location \nreserved, open the tap water valve and the \nclean water three-way valve. Ensure there \nare no leaks throughout the pipeline. Then, \nconnect the power supply, and make sure \nthe status indicator light comes on.\nSearch for ""Roborock"" in the App Store \nor Google Play or scan the QR code to \ndownload and install the app.\nConnecting to the App\n1.']",The provided context does not contain information about a Roborock S9 model. It mentions the Roborock S7 Pro Ultra and the Roborock S8 MaxV Ultra.,I could not find that information in the provided manuals.,0.0,0.0,1.0,300,75
