user_input,retrieved_contexts,response,reference,faithfulness,context_precision,context_recall,retriever_k,reranker_n,chunk_size,chunk_overlap
How do I reset Wi-Fi on Roborock S7 Pro Ultra?,"['13\nIf the robot does not respond when a button \nis pressed or cannot be turned off, reset the \nsystem by pressing the Reset button.\nResetting the SystemC17\nNote: After resetting the system, existing settings such \nas scheduled cleaning and WiFi will be restored to \nfactory settings.\nTo disconnect the robot from WiFi, press \nthe Reset button until you hear a voice \nmessage. Then wait for 5 minutes and the \nWiFi will be automatically deactivated. If you \nwant to reconnect, please follow the related \nconnecting instructions.\nIf the robot does not function properly after \na system reset, switch it on. Press and hold  \n and at the same time, press the Reset \nbutton until you hear the “Restoring \nfactory settings” voice message. The robot \nwill then be restored to factory settings.\nDeactivating WiFiC18\nRestoring Factory SettingsC19\nNote: The frequency of replacement may vary with the \nactual situation. If abnormal wear occurs, replace the \nparts immediately.\n* Clean every 2 weeks and replace every 6-12 months.\nMain BrushesD1\nRoutine MaintenanceD\nD1-1—Hair-Blocking Rings \nD1-2—Main Brush Caps \nD1-3—Main Brush Cover \nD1-4—Latches \nD1-5—Main Brushes \nD1-6—Main Brush Bearing\nTurn over the robot and press the \ntwo latches inwards to remove the \nmain brush cover.\nD1-7—\nPull out the main brushes and \nremove the main brush bearings, \nmain brush caps, and hair-blocking \nrings. Remove any entangled hair \nor dirt at both ends of the main \nbrushes. Then, reinstall the hair-\nblocking rings, main brush caps, and \nthen main brush bearings. \nD1-8—\nUnscrew the side brush screw. Remove and \nclean the side brush. Reinstall the brush \nand tighten the screw.\nNotes:\n • It is recommended to wipe the main brushes with a \nwet cloth. If the main brushes are wet, air-dry them \naway from direct sunlight.\n • Do not use corrosive cleaning fluid or disinfectant to \nclean the main brushes.\n* Clean monthly and replace every 3-6 months.\nFlexible Side BrushD2\nReinstall the main brushes. Firmly snap \nthe main brush bearings into place. \nOnly after the bearings are securely \ninstalled, fit the main brush cover.\nD1-9—\nReinstall the main brush cover. Make \nsure its four teeth are fully seated in \nthe slots, and press the main brush \ncover until you hear it lock with a click.\nD1-10 —\n • Placing a malfunctioning robot on the dock manually \nwill end the current cleanup.\n •To prevent injury caused by blades used to cut hair inside \nthe main brush cover, make sure to install two main \nbrushes in place before installing the main brush cover.\nUse a tool, such as a small \nscrewdriver, to pry out the axle and \ntake out the wheel.\nD3-1—\n* Clean as required.\nOmnidirectional WheelD3\nThe omnidirectional wheel bracket cannot be \nremoved.\nNote:\nRinse the wheel and the axle with \nwater to remove any hair and dirt. \nAir-dry, reinstall, and press the wheel \nand axle back in place.\nD3-2—\nClean the main wheels with a soft, dry cloth.\n* Clean as required.\nMain WheelsD4\n* Clean as required.\nDustbinD5\nRemove the magnetic top cover and \npress the dustbin latch to take out \nthe dustbin.\nD5-1—\nRemove the washable filter and \nempty the dustbin.\nD5-2—', '008\nConnecting to the App\nSearch for “Roborock” in the App Store or \nGoogle Play or scan the QR code to download \nand install the app.\n1. Download App\na. Open the top cover and find the WiFi \nindicator light.\n2. Reset WiFi\nb. Press and hold the  and  buttons \nuntil you hear the “Resetting WiFi” voice \nmessage. The reset is complete when the \nWiFi indicator light flashes slowly. The \nrobot will then wait for a connection.\nIf you cannot connect to the robot due to your \nrouter configuration, a forgotten password, or any other \nreason, reset the WiFi and add your robot as a new device.\nNote:\nNotes:\n • The actual process may vary due to ongoing app updates. \nFollow the guide provided in the app.\n • Only 2.4 GHz WiFi is supported.\nOpen the Roborock app, tap the “Scan to \nConnect” or “Search for Device” button and \nadd your device as instructed in the app.\n3. Add Device\nC2-1—Zone 1 – Cleaned.\nC2-2—Zone 2 – Cleaned.\nC2-3—Zone 3 – In Progress.\nC2-4—Zone 4 – Next Zone.\nNotes:\n •To allow the robot to automatically vacuum and return \nto the dock, start the robot from the dock. Do not move \nthe dock during cleaning.\n • Cleaning cannot start if the battery level is too low. \nAllow the robot to charge before starting the cleanup.\n • Before cleaning, tidy cords (including the power cord \nof the dock) and valuables from the floor. Loose \nitems may be dragged by the robot, resulting in the \ndisconnection of electrical appliances or damage of \ncords and property.\n • If cleaning is completed in less than 10 minutes, the \narea will be cleaned twice.\n • If the battery runs low during a cleaning cycle, the robot \nwill automatically return to the dock. After charging, \nthe robot will resume where it left off.\n • The robot will retract mop cloth mounts when cleaning \nthe carpet. You can also set the carpet as a no-go \nzone in the app to avoid it.\n • Before starting each cleaning task, make sure that the \nmop cloths have been properly installed.\nSpot Cleaning\nPress and hold the  button to start spot \ncleaning in pause mode.\nCleaning range: The robot cleans a 1.5 m (4.9 ft) x \n1.5 m (4.9 ft) square area centered on itself.\nPress and hold  to turn on the robot. The \npower indicator light will come on, and the \nrobot will wait for orders.\nPress and hold the  button to turn off the \nrobot and complete the cleaning cycle.\nOn/Off\nThe robot cannot be turned off when it is being charged.Note:\nInstructions for UseC\nRemove and open the clean water tank and \nfill the tank with water to MAX. Close the lid, \nlock the latch, and fit the tank back in place.\nNotes:\n • To prevent corrosion or damage, do not use any disinfectant \nand only use cleaning solution recommended by Roborock \nin the water tank.\n • Do not add too much cleaning solution to prevent the \nrobot from working improperly due to slipping.\n • To avoid water tank deformation, do not place hot water \nin the tank. \n • If water marks remain on the water tank, wipe them \nclean before reinstallation.\nC1 Filling the Water Tank\nPress the  button to start cleaning. The \nrobot will plan its cleaning route according \nto its scan of the room. It splits a room \nC2 Starting Cleaning\ninto zones, first draws out zone edges, and \nthen fills the zone in a zigzag pattern. In \nso doing, the robot cleans all zones one by \none, efficiently cleaning the house.\nAfter spot cleaning, the robot will automatically \nreturn to the starting point and wait for orders.\nNote:']","To reset the Wi-Fi on your Roborock S7 Pro Ultra, press and hold the ""Reset"" button until you hear a voice message indicating the reset is complete. The Wi-Fi will then be automatically deactivated after 5 minutes. If you wish to reconnect, follow the relevant connection instructions.",Open the top cover and locate the Wi-Fi indicator. Press and hold the Power and Home buttons until you hear 'Resetting WiFi'. The reset is complete when the Wi-Fi indicator flashes slowly and the robot waits for connection.,0.6,0.49999999995,1.0,10,2,1000,200
Can I use detergent in the water tank?,"['08\nInstructions\nNotes:\n • To prevent corrosion or damage, only use the Roborock \nbranded floor cleaner in the water tank.\n • To avoid water tank deformation, do not place hot water \nin the tank.\n • If water marks remain on the water tank, wipe them clean \nbefore reinstallation.\nFilling the Clean Water Tank\nOpen the clean water tank. Fill with water \nuntil the Max line. Close the lid, lock the \nlatch, and fit the tank back in place.\nThe robot cannot be turned off when it is being \ncharged.\nNote:\nPress and hold the  button to turn on the \nrobot. The power indicator will turn on and \nthe robot will enter standby mode. Press \nand hold the  button to turn off the robot \nand complete the cleaning cycle.\nOn/Off\nPress the  button to start cleaning. The \nrobot will plan its cleaning route according \nto its scan of the room. It splits a room into \nzones, first draws out zone edges, and then \nfills the zone in a zigzag pattern. In so \ndoing, the robot cleans all zones one by \none, efficiently cleaning the house.\nStarting Cleaning\nZone 1 – Cleaned\nZone 4 – Next Zone\nZone 2 – Cleaned\nZone 3 – In Progress\nNotes:\n • To allow the robot to automatically vacuum and return to \nthe dock, start the robot from the dock. Do not move the \ndock during cleaning.\n • Cleaning cannot start if the battery level is too low. Allow the \nrobot to charge before starting cleanup.\n • If cleaning is completed in less than 10 minutes, the area \nwill be cleaned twice.\n • If the battery runs low during the cleaning cycle, the robot \nwill automatically return to the dock. After charging, the \nrobot will resume where it left off.\n • Automatic mop washing will not work if the dock \nencounters an error during cleaning. Wash the mop \nmanually to restore.\n • When the mop mount is attached, the robot will retract it \nwhen cleaning the carpet. You can also set the carpet as a \nno-go zone in the app to avoid it.\n • Before starting each mopping task, make sure that the \nVibraRise mop has been properly installed.\nAfter spot cleaning, the robot will automatically return \nto the starting point and enter Standby mode.\nNote:\nPress the  button to start spot cleaning.\nCleaning range: The robot cleans a 1.5 m \n(4.9 ft) x 1.5 m (4.9 ft) square area centered \non itself.\nSpot Cleaning Manually Activated Emptying\nAuto-Emptying\nEmptying can be triggered manually by \npressing the  button while the robot is \ncharging.\nAuto-emptying will begin when the robot \nreturns to the dock after cleaning.\nAvoid frequent manual emptying.Note:\nNotes:\n • If the dock has not emptied for an extended period, \nempty the robot dustbin manually and clear the air \ninlet of any debris to ensure optimum performance.\n • If necessary, auto-emptying can be disabled in the \napp.\nManually Activated Mop \nWashing\nDuring cleaning, press any button to pause, \nthen press and hold the  button to send \nthe robot back for mop washing.\nAuto Mop Washing\nDuring cleaning, the robot automatically \ndetermines when it should return to dock \nfor mop washing and water tank refilling to \nmaximize its mopping performance.\nTo allow the robot to wash the mop automatically, \nstart the robot from the dock once it is fully charged. Do \nnot move the dock during cleaning.\nNote:', '011\nD7-2—Stick the mop cloth on the mount in \nposition and firmly.\nA dirty mop cloth will affect the washing performance. \nClean it before use.\nNote:\nMake sure the disposable dust bag is properly \nsealed to avoid waste escaping and damaging the dock.\nNote:\nUse a soft, dry cloth to wipe and clean all \nsensors, including:\n* Clean as required.\nLift up and move the dock. Do not move the \ndock by lifting the dock base, water tank handles \nor dust container cover directly to prevent \nthe dock from falling off.\nOpen the dirty water tank lid and pour out \nthe dirty water. Fill the tank with clean water, \nclose the lid, and shake. Pour out the dirty \nwater. Close the lid and then re-install.\n* Clean as required.\nUse a soft dry cloth to wipe the charging \ncontacts on the robot and the dock.\n* Clean monthly.\nNotes:\n • The dust bag handle seals the bag on removal to \nprevent leakage.\n • Always install a dust bag before closing the dust \ncontainer cover to avoid auto-emptying without the \nbag. You can also disable auto-emptying in the app.\nD12-1—Remove the dust container cover.\nD12-2—Remove the disposable dust bag in the \ndirection of the arrow and discard it.\n* Replace as required.\nD12-3—Clean around the filter with a dry \ncloth. Install a new disposable dust \nbag in place along the slot and \nunfold the dust bag to maximize \nemptying performance.\nBasic Parameters\nModel QR1PES\nBattery 14.4 V/5200 mAh (TYP) \nlithium-ion battery\nRated Input 20VDC 1.5A\nCharging Time Approx. 4 hours\nRobot\nThe serial number is on a sticker on the underside \nof the robot.\nNote:\nEmpty Wash Fill Dock\nModel EWFD16HRR\nRated Input Voltage 220-240VAC\nRated Frequency 50-60Hz\nRated Input (Dust \ncollection) 3A \nRated Input\n(Hot water washing \nmop)\n5.6A\nRated Input \n(Charging & drying) 0.6A\nRated Output 20VDC 1.5A\nCharging Battery 14.4 V/5200 mAh (TYP) \nlithium-ion battery\nD8-1—Dock Locator\nD8-2—Reactive Tech Obstacle Avoidance Sensor\nD8-3—Wall Sensor\nD8-4—Communication Sensor\nD8-5—Carpet Sensor\nD8-6—Four Cliff Sensors\nD8 Robot Sensors\nD10 Dirty Water Tank\nD11 Charging Contact Areas\nD12 Replacing Disposable Dust Bag\nD12-4—Close the dust container cover and \nmake sure it is securely sealed.\nD13-1—Remove the cleaning tank.\nD13-2—Rinse the cleaning tank and the filter \nwith water.\nD13-3—Reinstall the cleaning tank.\n* Clean as required.\nD13 Cleaning Tank\nD9 Moving Dock']","No, you should only use Roborock branded floor cleaner in the water tank.",Only cleaning solutions officially recommended by Roborock may be used. Other detergents may cause corrosion or damage.,1.0,0.9999999999,1.0,10,2,1000,200
Which model has automatic mop washing?,"['12\nIf the robot is paused for over 10 minutes, \nit will go to sleep, and the power indicator \nlight will flash every few seconds. Press any \nbutton to wake the robot up.\nNotes:\n • The robot will not go to sleep when it is charging.\n • The robot will automatically shut down if left sleep for \nmore than 12 hours.\nSleepC8\nNotes:\n • To make sure the robot to wash the mop cloths \nautomatically, start the robot from the dock and do \nnot move the dock during cleaning.\n • Mop wash frequency and mode can be modified in \nthe app.\n • To avoid burns from hot water, do not touch the water \noutlets.\nAfter cleaning, the robot will return to \nEmptyingC10\nNotes:\n • When emptying has been left unused for a long \nperiod, empty the dustbin manually and make sure \nthe air inlet is clear for optimal emptying performance.\n • Auto-emptying can be disabled in the app.\n • Avoid frequent manual emptying.\nDuring cleaning, the robot automatically \ndetermines when it should return to the dock \nfor mop washing and water tank refilling \nto maximize its mopping performance. To \nmanually start washing, press and hold  \nor tap the corresponding button in the app. \nPress any button to stop washing.\nWashing the Mop ClothsC9\nDrying starts automatically after mop\nwashing or after cleaning is completed. \nTo manually start or stop drying, tap the \ncorresponding button in the app.\nNotes:\n • Stay away from the drying air outlets during drying.\n • Drying duration can be modified in the app.\n • Auto-drying can be disabled in the app.\nDryingC11\nNote: Smart Cleaning Solution Filling can be disabled \nin the app.\nThe robot will automatically add cleaning \nsolution to the water for mop washing and \nrobot water tank refilling according to the \npreset ratio to ensure optimal mopping \nperformance.\nAuto Cleaning Solution AdditionC12\nNote: If the robot fails to find the dock, it will automatically \nreturn to its starting position. Place the robot on the \ndock manually to recharge.\nAfter cleaning, the robot will automatically \nreturn to the dock to charge.\nChargingC13\nThe default Do Not Disturb (DND) period is \nfrom 22:00 to 08:00. You can use the app to \ndisable the DND mode or modify the DND \nperiod, or set whether to enable auto top-\nup, emptying and drying, to dim the button \nlight, or lower the volume of the voice \nmessage during the DND period.\nDND ModeC14\nPress and hold  to enable/disable Child \nLock. You can also set it in the app. Once \nenabled, the robot will not react to button \npresses when it is stationary. When the \nrobot is cleaning or docking, press any \nbutton to pause it.\nIf an error occurs, the power indicator light \non the robot will flash red or status indicator \nlight on the dock will be steady red. A pop-\nup notification will appear in the app and a \nvoice alert may sound.\nChild LockC15\nErrorC16\nNotes:\n • The robot will go to sleep automatically if left in a \nmalfunctioning state for over 10 minutes.\nNote: Placing a paused robot on the dock manually will \nend the current cleanup.\npress and hold  to wash the mop cloths \nand then resume cleaning.\nthe dock and auto-emptying will begin \nas needed. To manually start emptying, \npress  on the docked robot or tap the \ncorresponding button in the app. Press any \nbutton to stop emptying.\nPress  to send the paused robot back \nto the dock. The power indicator light will \nbreathe during robot charging.', '006\n • Press to return to dock/start emptying\n • Press and hold to start spot cleaning/ \nmop washing\n      —Dock\n • Press and hold to turn the robot \non or off\n • Press to start cleaning\n      —Power/Clean\n • White: Battery level ≥ 15%\n • Red: Battery level < 15%\n • Breathing: Charging or starting up\n • Flashing red: Error\n      —Power Indicator Light\nPress any button to stop the robot during cleaning \nor docking.\nNote:\nA1-1—Dock Locator\nA1-2—Reactive Tech Obstacle Avoidance \nSensor\nA2-1—Wall Sensor\nA2-2—Omnidirectional Wheel\nA2-3—Carpet Sensor\nA2-4—Side Brush\nA2-5—Main Wheel\nA2-6—Main Brush\nA2-7—Main Brush Cover Latches\nA2-8—Mop Cloths\nA2-9—Cliff Sensors\nA3-4—Reset Button\nA3-5—Dustbin\nA3-6—Charging Contacts\nA3-7—Communication Sensor\nA3-8—Air Outlet\nA3-9—Positioning Button\nA3-10—Self-Filling Port\nA3-11—Automatic Lift and Rotate Mop \nModules\nA3-12—Suction Inlet\nA3-13—Bumper\nA3-1—Vertical Bumper\nA3-2—LiDAR Sensor\nA3-3—WiFi Indicator Light\n • Off: WiFi disabled/Charging\n • Flashing slowly: Waiting for connection\n • Flashing quickly: Connecting\n • Steady: WiFi connected\nA4-1—Hook and Loop Pads\nA4-2—Mop Axle\nSecure the mop cloths in place.Note:\nProduct OverviewA\nA1 Robot (Top View)\nA2 Robot (Bottom View)\nA3 Robot (Top Cover Open)\nA4 Mop Cloth Mount\nA5 Mop Cloth\nA6-1—Dustbin Latch\nA6-2—Air Inlet\nA6-3—Washable Filter \nA6-4—Suction Inlet\nA6 Dustbin\nA7 Dock Base\nA8 Power Cord\nA9 Disposable Dust Bag\nA10-1—Water Tank Handle\nA10-2—Water Tank Latch\nA10-3—Dirty Water Tank\nA10-4—Dust Container Cover\nA10-5—Charging Contacts\nA10-6—Robot Refill Port\nA10-7—Suction Inlet\nA10-8—Clean Water Tank\nA10-9—Status Indicator Light\n • Breathing: Emptying/Mop washing\n • Red: Dock error\n • Off: Powered off/Charging\nA10-10—Water Outlet\nA10-11—Air Outlets\nA10-12—Dock Base\nA10-13—Filter\nA10-14—Dust Bag Slot\nA10-15—Dock Location Beacon\nA10-16—Clean Water Dispensers\nA10 Dock']",The Roborock S8 MaxV Ultra has automatic mop washing.,"Roborock S7 Pro Ultra, S8 MaxV Ultra and Qrevo Pro support automatic mop washing.",1.0,0.0,0.0,10,2,1000,200
How do I reset Wi-Fi on Roborock S7 Pro Ultra?,"['13\nIf the robot does not respond when a button \nis pressed or cannot be turned off, reset the \nsystem by pressing the Reset button.\nResetting the SystemC17\nNote: After resetting the system, existing settings such \nas scheduled cleaning and WiFi will be restored to \nfactory settings.\nTo disconnect the robot from WiFi, press \nthe Reset button until you hear a voice \nmessage. Then wait for 5 minutes and the \nWiFi will be automatically deactivated. If you \nwant to reconnect, please follow the related \nconnecting instructions.\nIf the robot does not function properly after \na system reset, switch it on. Press and hold  \n and at the same time, press the Reset \nbutton until you hear the “Restoring \nfactory settings” voice message. The robot \nwill then be restored to factory settings.\nDeactivating WiFiC18\nRestoring Factory SettingsC19\nNote: The frequency of replacement may vary with the \nactual situation. If abnormal wear occurs, replace the \nparts immediately.\n* Clean every 2 weeks and replace every 6-12 months.\nMain BrushesD1\nRoutine MaintenanceD\nD1-1—Hair-Blocking Rings \nD1-2—Main Brush Caps \nD1-3—Main Brush Cover \nD1-4—Latches \nD1-5—Main Brushes \nD1-6—Main Brush Bearing\nTurn over the robot and press the \ntwo latches inwards to remove the \nmain brush cover.\nD1-7—\nPull out the main brushes and \nremove the main brush bearings, \nmain brush caps, and hair-blocking \nrings. Remove any entangled hair \nor dirt at both ends of the main \nbrushes. Then, reinstall the hair-\nblocking rings, main brush caps, and \nthen main brush bearings. \nD1-8—\nUnscrew the side brush screw. Remove and \nclean the side brush. Reinstall the brush \nand tighten the screw.\nNotes:\n • It is recommended to wipe the main brushes with a \nwet cloth. If the main brushes are wet, air-dry them \naway from direct sunlight.\n • Do not use corrosive cleaning fluid or disinfectant to \nclean the main brushes.\n* Clean monthly and replace every 3-6 months.\nFlexible Side BrushD2\nReinstall the main brushes. Firmly snap \nthe main brush bearings into place. \nOnly after the bearings are securely \ninstalled, fit the main brush cover.\nD1-9—\nReinstall the main brush cover. Make \nsure its four teeth are fully seated in \nthe slots, and press the main brush \ncover until you hear it lock with a click.\nD1-10 —\n • Placing a malfunctioning robot on the dock manually \nwill end the current cleanup.\n •To prevent injury caused by blades used to cut hair inside \nthe main brush cover, make sure to install two main \nbrushes in place before installing the main brush cover.\nUse a tool, such as a small \nscrewdriver, to pry out the axle and \ntake out the wheel.\nD3-1—\n* Clean as required.\nOmnidirectional WheelD3\nThe omnidirectional wheel bracket cannot be \nremoved.\nNote:\nRinse the wheel and the axle with \nwater to remove any hair and dirt. \nAir-dry, reinstall, and press the wheel \nand axle back in place.\nD3-2—\nClean the main wheels with a soft, dry cloth.\n* Clean as required.\nMain WheelsD4\n* Clean as required.\nDustbinD5\nRemove the magnetic top cover and \npress the dustbin latch to take out \nthe dustbin.\nD5-1—\nRemove the washable filter and \nempty the dustbin.\nD5-2—', '008\nConnecting to the App\nSearch for “Roborock” in the App Store or \nGoogle Play or scan the QR code to download \nand install the app.\n1. Download App\na. Open the top cover and find the WiFi \nindicator light.\n2. Reset WiFi\nb. Press and hold the  and  buttons \nuntil you hear the “Resetting WiFi” voice \nmessage. The reset is complete when the \nWiFi indicator light flashes slowly. The \nrobot will then wait for a connection.\nIf you cannot connect to the robot due to your \nrouter configuration, a forgotten password, or any other \nreason, reset the WiFi and add your robot as a new device.\nNote:\nNotes:\n • The actual process may vary due to ongoing app updates. \nFollow the guide provided in the app.\n • Only 2.4 GHz WiFi is supported.\nOpen the Roborock app, tap the “Scan to \nConnect” or “Search for Device” button and \nadd your device as instructed in the app.\n3. Add Device\nC2-1—Zone 1 – Cleaned.\nC2-2—Zone 2 – Cleaned.\nC2-3—Zone 3 – In Progress.\nC2-4—Zone 4 – Next Zone.\nNotes:\n •To allow the robot to automatically vacuum and return \nto the dock, start the robot from the dock. Do not move \nthe dock during cleaning.\n • Cleaning cannot start if the battery level is too low. \nAllow the robot to charge before starting the cleanup.\n • Before cleaning, tidy cords (including the power cord \nof the dock) and valuables from the floor. Loose \nitems may be dragged by the robot, resulting in the \ndisconnection of electrical appliances or damage of \ncords and property.\n • If cleaning is completed in less than 10 minutes, the \narea will be cleaned twice.\n • If the battery runs low during a cleaning cycle, the robot \nwill automatically return to the dock. After charging, \nthe robot will resume where it left off.\n • The robot will retract mop cloth mounts when cleaning \nthe carpet. You can also set the carpet as a no-go \nzone in the app to avoid it.\n • Before starting each cleaning task, make sure that the \nmop cloths have been properly installed.\nSpot Cleaning\nPress and hold the  button to start spot \ncleaning in pause mode.\nCleaning range: The robot cleans a 1.5 m (4.9 ft) x \n1.5 m (4.9 ft) square area centered on itself.\nPress and hold  to turn on the robot. The \npower indicator light will come on, and the \nrobot will wait for orders.\nPress and hold the  button to turn off the \nrobot and complete the cleaning cycle.\nOn/Off\nThe robot cannot be turned off when it is being charged.Note:\nInstructions for UseC\nRemove and open the clean water tank and \nfill the tank with water to MAX. Close the lid, \nlock the latch, and fit the tank back in place.\nNotes:\n • To prevent corrosion or damage, do not use any disinfectant \nand only use cleaning solution recommended by Roborock \nin the water tank.\n • Do not add too much cleaning solution to prevent the \nrobot from working improperly due to slipping.\n • To avoid water tank deformation, do not place hot water \nin the tank. \n • If water marks remain on the water tank, wipe them \nclean before reinstallation.\nC1 Filling the Water Tank\nPress the  button to start cleaning. The \nrobot will plan its cleaning route according \nto its scan of the room. It splits a room \nC2 Starting Cleaning\ninto zones, first draws out zone edges, and \nthen fills the zone in a zigzag pattern. In \nso doing, the robot cleans all zones one by \none, efficiently cleaning the house.\nAfter spot cleaning, the robot will automatically \nreturn to the starting point and wait for orders.\nNote:', '05\nA5  Electric Water Tank\nA5-1—Stopper\nA5-2—Water Filter\nA5-3—Water Tank Latch\nA5-4—Self-Filling Port\nA4  Dustbin\nA4-1—Filter Cover\nA4-2—Dustbin Latch\nA4-3—Cover Latch\nA4-4—Air Inlet\nA4-5—Washable Filter\nA3  Robot (Upper Cover Open)\nA3-1—Vertical Bumper\nA3-2—LiDAR Sensor\nA3-3—WiFi Indicator Light\n • Off: WiFi disabled\n • Flashing slowly: Waiting for \nconnection\n • Flashing quickly: Connecting\n • Steady: WiFi connected\nA3-4—Reset Button\nA3-5—Water Tank\nA3-6—Dustbin\nA3-7—Mop Wash Sensor\nA3-8—Water Tank Latch\nA3-9—Positioning Button\nA3-10—VibraRise Module\nA3-11—Air Outlet\nA3-12—Bumper\nA1  Robot (Top View)\nPress any button to stop the robot during cleaning \nor docking.\nNote:\nA1-1—Dock Locator\n • Press to return to dock/start \nemptying\n • Press and hold to wash mop\nDock\n • Press to Spot clean\n • Press and hold for 3 seconds to \nturn on/off the child lock\nSpot Clean/Child Lock\n • White: Battery level ≥ 20%\n • Red: Battery level < 20%\n • Pulsing: Charging or starting up\n • Flashing red: Error\nPower Indicator\nPower/Clean\n • Press and hold to turn the robot \non or off\n • Press to start cleaning\nProduct OverviewA\nA2  Robot (Bottom View)\nA2-1—Wall Sensor\nA2-2—Charging Contacts\nA2-3—Carpet Sensor\nA2-4—Omni-Directional Wheel\nA2-5—Side Brush \nA2-6—Main Wheel\nA2-7—Main Brush\nA2-8—Main Brush Cover Latches\nA2-9—Cliff Sensors\nA6  VibraRise Mop Mount\nA6-1—Mop Cloth Attachment Slot\nA6-2—Vibration Module\nA8  Power Cable\nA9  Dock Base\nA10 Disposable Dust Bag\nA7  VibraRise Mop Cloth\nA7-1—Hook and Loop Pads\nThe VibraRise mop mount is non-detachable.Note:', '09\nPlacing a paused robot on the dock manually will end \nthe current cleanup.\nNote:\nWhen the robot is running, press any \nbutton to pause it, press the  button to \nresume cleaning, press the  button to \nsend it back to the dock.\nPause\nIf the robot is paused for over 10 minutes, it \nwill go to sleep, and the power indicator will \nflash every few seconds. Press any button \nto wake the robot up.\nSleep\nNotes:\n • The robot will not go to sleep when it is charging.\n • The robot will automatically shut down if left in sleep mode \nfor more than 12 hours.\nThe default Do Not Disturb (DND) period is \nfrom 22:00 to 08:00. You can use the app to \ndisable the DND mode or modify the DND \nperiod. When DND mode is activated, the \nrobot will not automatically resume cleanup, \nthe power indicator light will dim, and the \nvolume of the voice prompts will lower.\nDND Mode\nChild Lock\nPress and hold the  button to enable/\ndisable the child lock. You can also set it in \nthe app. Once enabled, the robot will not \nreact to button presses when it is \nstationary. When the robot is cleaning or \ndocking, press any button to stop it.\nError\nIf an error occurs, the power indicator will \nflash red and a voice alert will sound. See \n“Errors” for solutions.\nNotes:\n • The robot will go to sleep automatically if left in a \nmalfunctioning state for over 10 minutes.\n • Placing a malfunctioning robot on the dock manually will \nend the current cleanup.\nRestore Factory Settings\nIf the robot does not function properly after \na system reset, switch it on. Press and hold \nthe  button and at the same time press \nReset button until you hear the “Restoring \nfactory settings” voice prompt. The robot \nwill then be restored to factory settings.\nApp Features\nCleaning Map\n • Multi-Map Management\n • Real-Time Vacuum and Mop Route\n • Carpet Display\n • Map Zoning\n • Map Editing\nCustom Cleaning Modes\n • Scheduled\n • Selective Room\n • Zone\n • No-Go Zones and Invisible Wall\n • Custom\n • Carpet Boost\n • Mop Wash Interval Settings\nCleaning Mode Switch\n • Suction Power Levels\n • Washing Intensity Levels \n • Mop Washing Modes\n • Custom Modes\nRobot Information\n • Cleaning History\n • Battery Level\n • Care & Maintenance\nStopping Emptying\nPress any button to stop emptying.\nCharging\nAfter cleaning,  the robot will automatically \nreturn to the dock to charge.\nIn Pause mode, press the  button to send \nthe robot back to the dock. The power \nindicator will pulse as the robot charges.\nIf the robot fails to find the dock, it will automatically \nreturn to its starting location. Place the robot on the dock \nmanually to recharge.\nNote:\nSystem Reset\nIf the robot does not respond when a \nbutton is pressed or cannot be turned off, \nreset the system. Press the Reset button, \nand the robot will reset automatically.\nAfter resetting the system, scheduled cleaning, WiFi, \netc. will be restored to factory settings.\nNote:', '08\nInstructions\nNotes:\n • To prevent corrosion or damage, only use the Roborock \nbranded floor cleaner in the water tank.\n • To avoid water tank deformation, do not place hot water \nin the tank.\n • If water marks remain on the water tank, wipe them clean \nbefore reinstallation.\nFilling the Clean Water Tank\nOpen the clean water tank. Fill with water \nuntil the Max line. Close the lid, lock the \nlatch, and fit the tank back in place.\nThe robot cannot be turned off when it is being \ncharged.\nNote:\nPress and hold the  button to turn on the \nrobot. The power indicator will turn on and \nthe robot will enter standby mode. Press \nand hold the  button to turn off the robot \nand complete the cleaning cycle.\nOn/Off\nPress the  button to start cleaning. The \nrobot will plan its cleaning route according \nto its scan of the room. It splits a room into \nzones, first draws out zone edges, and then \nfills the zone in a zigzag pattern. In so \ndoing, the robot cleans all zones one by \none, efficiently cleaning the house.\nStarting Cleaning\nZone 1 – Cleaned\nZone 4 – Next Zone\nZone 2 – Cleaned\nZone 3 – In Progress\nNotes:\n • To allow the robot to automatically vacuum and return to \nthe dock, start the robot from the dock. Do not move the \ndock during cleaning.\n • Cleaning cannot start if the battery level is too low. Allow the \nrobot to charge before starting cleanup.\n • If cleaning is completed in less than 10 minutes, the area \nwill be cleaned twice.\n • If the battery runs low during the cleaning cycle, the robot \nwill automatically return to the dock. After charging, the \nrobot will resume where it left off.\n • Automatic mop washing will not work if the dock \nencounters an error during cleaning. Wash the mop \nmanually to restore.\n • When the mop mount is attached, the robot will retract it \nwhen cleaning the carpet. You can also set the carpet as a \nno-go zone in the app to avoid it.\n • Before starting each mopping task, make sure that the \nVibraRise mop has been properly installed.\nAfter spot cleaning, the robot will automatically return \nto the starting point and enter Standby mode.\nNote:\nPress the  button to start spot cleaning.\nCleaning range: The robot cleans a 1.5 m \n(4.9 ft) x 1.5 m (4.9 ft) square area centered \non itself.\nSpot Cleaning Manually Activated Emptying\nAuto-Emptying\nEmptying can be triggered manually by \npressing the  button while the robot is \ncharging.\nAuto-emptying will begin when the robot \nreturns to the dock after cleaning.\nAvoid frequent manual emptying.Note:\nNotes:\n • If the dock has not emptied for an extended period, \nempty the robot dustbin manually and clear the air \ninlet of any debris to ensure optimum performance.\n • If necessary, auto-emptying can be disabled in the \napp.\nManually Activated Mop \nWashing\nDuring cleaning, press any button to pause, \nthen press and hold the  button to send \nthe robot back for mop washing.\nAuto Mop Washing\nDuring cleaning, the robot automatically \ndetermines when it should return to dock \nfor mop washing and water tank refilling to \nmaximize its mopping performance.\nTo allow the robot to wash the mop automatically, \nstart the robot from the dock once it is fully charged. Do \nnot move the dock during cleaning.\nNote:']","To reset the Wi-Fi on the Roborock S7 Pro Ultra, open the top cover to locate the Wi-Fi indicator light. Press and hold both the and buttons simultaneously until you hear a voice message indicating ""Resetting WiFi."" The Wi-Fi reset is complete when the indicator light begins to flash slowly, and the robot will then be ready for a new connection.",Open the top cover and locate the Wi-Fi indicator. Press and hold the Power and Home buttons until you hear 'Resetting WiFi'. The reset is complete when the Wi-Fi indicator flashes slowly and the robot waits for connection.,1.0,0.5833333333041666,1.0,10,5,1000,200
Can I use detergent in the water tank?,"['08\nInstructions\nNotes:\n • To prevent corrosion or damage, only use the Roborock \nbranded floor cleaner in the water tank.\n • To avoid water tank deformation, do not place hot water \nin the tank.\n • If water marks remain on the water tank, wipe them clean \nbefore reinstallation.\nFilling the Clean Water Tank\nOpen the clean water tank. Fill with water \nuntil the Max line. Close the lid, lock the \nlatch, and fit the tank back in place.\nThe robot cannot be turned off when it is being \ncharged.\nNote:\nPress and hold the  button to turn on the \nrobot. The power indicator will turn on and \nthe robot will enter standby mode. Press \nand hold the  button to turn off the robot \nand complete the cleaning cycle.\nOn/Off\nPress the  button to start cleaning. The \nrobot will plan its cleaning route according \nto its scan of the room. It splits a room into \nzones, first draws out zone edges, and then \nfills the zone in a zigzag pattern. In so \ndoing, the robot cleans all zones one by \none, efficiently cleaning the house.\nStarting Cleaning\nZone 1 – Cleaned\nZone 4 – Next Zone\nZone 2 – Cleaned\nZone 3 – In Progress\nNotes:\n • To allow the robot to automatically vacuum and return to \nthe dock, start the robot from the dock. Do not move the \ndock during cleaning.\n • Cleaning cannot start if the battery level is too low. Allow the \nrobot to charge before starting cleanup.\n • If cleaning is completed in less than 10 minutes, the area \nwill be cleaned twice.\n • If the battery runs low during the cleaning cycle, the robot \nwill automatically return to the dock. After charging, the \nrobot will resume where it left off.\n • Automatic mop washing will not work if the dock \nencounters an error during cleaning. Wash the mop \nmanually to restore.\n • When the mop mount is attached, the robot will retract it \nwhen cleaning the carpet. You can also set the carpet as a \nno-go zone in the app to avoid it.\n • Before starting each mopping task, make sure that the \nVibraRise mop has been properly installed.\nAfter spot cleaning, the robot will automatically return \nto the starting point and enter Standby mode.\nNote:\nPress the  button to start spot cleaning.\nCleaning range: The robot cleans a 1.5 m \n(4.9 ft) x 1.5 m (4.9 ft) square area centered \non itself.\nSpot Cleaning Manually Activated Emptying\nAuto-Emptying\nEmptying can be triggered manually by \npressing the  button while the robot is \ncharging.\nAuto-emptying will begin when the robot \nreturns to the dock after cleaning.\nAvoid frequent manual emptying.Note:\nNotes:\n • If the dock has not emptied for an extended period, \nempty the robot dustbin manually and clear the air \ninlet of any debris to ensure optimum performance.\n • If necessary, auto-emptying can be disabled in the \napp.\nManually Activated Mop \nWashing\nDuring cleaning, press any button to pause, \nthen press and hold the  button to send \nthe robot back for mop washing.\nAuto Mop Washing\nDuring cleaning, the robot automatically \ndetermines when it should return to dock \nfor mop washing and water tank refilling to \nmaximize its mopping performance.\nTo allow the robot to wash the mop automatically, \nstart the robot from the dock once it is fully charged. Do \nnot move the dock during cleaning.\nNote:', '011\nD7-2—Stick the mop cloth on the mount in \nposition and firmly.\nA dirty mop cloth will affect the washing performance. \nClean it before use.\nNote:\nMake sure the disposable dust bag is properly \nsealed to avoid waste escaping and damaging the dock.\nNote:\nUse a soft, dry cloth to wipe and clean all \nsensors, including:\n* Clean as required.\nLift up and move the dock. Do not move the \ndock by lifting the dock base, water tank handles \nor dust container cover directly to prevent \nthe dock from falling off.\nOpen the dirty water tank lid and pour out \nthe dirty water. Fill the tank with clean water, \nclose the lid, and shake. Pour out the dirty \nwater. Close the lid and then re-install.\n* Clean as required.\nUse a soft dry cloth to wipe the charging \ncontacts on the robot and the dock.\n* Clean monthly.\nNotes:\n • The dust bag handle seals the bag on removal to \nprevent leakage.\n • Always install a dust bag before closing the dust \ncontainer cover to avoid auto-emptying without the \nbag. You can also disable auto-emptying in the app.\nD12-1—Remove the dust container cover.\nD12-2—Remove the disposable dust bag in the \ndirection of the arrow and discard it.\n* Replace as required.\nD12-3—Clean around the filter with a dry \ncloth. Install a new disposable dust \nbag in place along the slot and \nunfold the dust bag to maximize \nemptying performance.\nBasic Parameters\nModel QR1PES\nBattery 14.4 V/5200 mAh (TYP) \nlithium-ion battery\nRated Input 20VDC 1.5A\nCharging Time Approx. 4 hours\nRobot\nThe serial number is on a sticker on the underside \nof the robot.\nNote:\nEmpty Wash Fill Dock\nModel EWFD16HRR\nRated Input Voltage 220-240VAC\nRated Frequency 50-60Hz\nRated Input (Dust \ncollection) 3A \nRated Input\n(Hot water washing \nmop)\n5.6A\nRated Input \n(Charging & drying) 0.6A\nRated Output 20VDC 1.5A\nCharging Battery 14.4 V/5200 mAh (TYP) \nlithium-ion battery\nD8-1—Dock Locator\nD8-2—Reactive Tech Obstacle Avoidance Sensor\nD8-3—Wall Sensor\nD8-4—Communication Sensor\nD8-5—Carpet Sensor\nD8-6—Four Cliff Sensors\nD8 Robot Sensors\nD10 Dirty Water Tank\nD11 Charging Contact Areas\nD12 Replacing Disposable Dust Bag\nD12-4—Close the dust container cover and \nmake sure it is securely sealed.\nD13-1—Remove the cleaning tank.\nD13-2—Rinse the cleaning tank and the filter \nwith water.\nD13-3—Reinstall the cleaning tank.\n* Clean as required.\nD13 Cleaning Tank\nD9 Moving Dock', '14\nThe robot cannot return to the charging \ndock after Spot cleaning or when it has \nbeen moved manually\n • After spot cleaning or a significant position change, the robot will re-generate the map. If the charging dock is too far \naway, it may not be able to return to recharge and must be placed on the charging dock manually.\nThe robot has begun to miss certain \nspots  • The wall sensor or cliff sensors may be dirty. Wipe them with a soft dry cloth.\nIt takes a long time to fill the water tank  • The filter may be blocked and need cleaning. \nThe LED status indicator light on the \ndock is steady red.\n • The dustbin is not in place. Check and correct installation.\n • Voltage error. Check that local voltage meets the requirements listed on the dock. \n • Check clean water tank placement or refill as required.\n • Check dirty water tank placement or empty as required.\n • Check that the water filter has been correctly installed.\nReduced emptying performance or \nunusual noise when emptying.\n • The main brush or main brush cover is not properly installed. Check and correct installation.\n • The filter, air duct, suction inlet, air inlet, or dustbin is blocked. Clean to remove blockages.\nRobot voice alert: Error 42. Maintenance \nbrush jammed. Clean it  and remove \nblockages.\n • If the brush stops at the left side, it may be jammed. Remove any items jamming it.\n • If the brush stops at the right side, the filter may be blocked or is not installed in place. Clean and correct installation.\nReduced mop washing performance.  • The mop is not attached properly. Reinstall.\n • The floor is dirty. Change the mop washing mode to “Deep” in the app for better cleaning.\nAuto-emptying is not working.\n • Auto-emptying is disabled. Check in-app settings.\n • Dock dustbin is not installed. Check and install.\n • Auto-emptying will not be triggered if the robot returns to the dock without cleaning.\n • The robot will not auto-empty after returning to the dock in Do Not Disturb (DND) mode. Adjust cleaning or DND \nduration, or start emptying manually. \nThe mop is not washed.\n • The mop will not be washed if not used.\n • The robot will not return to the dock for mop washing if it does not start from the dock or no dock is found on the app \nmap.\n • Check tank placement and refill or empty as required.\n • Check that the water filter has been correctly installed.\nCommon Issues', '007\nPower cord can exit at either side.Note:\nB2-3—Connect the power cord to the back \nof the dock, and keep the excess cord \ninside the storage slot.\nWhen moving the dock, secure the water tanks to \nprevent it from falling off.\nNote:\nB2-2—Click\nB2-4—Align and install the mop axles into \nthe robot in place until you hear a click.\nWhen using the robot for the first time, follow \nit throughout its whole cleaning route and watch for \npotential problems. The robot will be able to clean by \nitself in future uses.\nNote:\nB1-1—Tidy cords, hard or sharp objects \n(such as nails and glass), and loose \nitems from the ground and move \nany unstable, fragile, precious, or \ndangerous items to prevent personal \ninjury or property damage due to \nitems becoming tangled in, struck by, \nor knocked over by the robot.\nB1-2—When using the robot in a raised \narea, always use a secure physical \nbarrier to prevent accidental falls \nthat may result in personal injury or \nproperty damage.\nA11-1—Cord Outlets\nA11-2—Power Port\nA11-3—Cord Storage Slot\nInstallationB\nA11 Power Cord Storage\nB1 Important Information\nB2-1—Place the dock on a hard and flat floor. \nB2 Assembly\nB2-5—Click\nKeep a space of clearance about 0.9 m (2.9 ft) \nin height, 0.4 m (1.3 ft) in length and 1.2 m \n(3.9 ft) in width. Place the dock on a hard \nand flat floor (wood/tile/concrete etc.), flat \nagainst a wall. Make sure the location has \ngood WiFi for a better experience with the \nmobile app, and then plug it in and make \nsure the dock status indicator light is on.\nNotes:\n • If the power cord hangs vertically to the ground, it \nmay be caught by the robot, causing the dock to be \nmoved or disconnected.\n • The dock status indicator light is on when the dock is \npowered on, and off when the robot is charging.\nB3-1—About 0.9 m (2.9 ft)\nB3-2—About 0.4 m (1.3 ft)\nB3-3—About 1.2 m (3.9 ft)\nB3 Place the Dock\nPress and hold the  button to power on the \nrobot. Wait until the power light is steady, and \nthen place the robot on the dock to charge. \nMake sure the dock is powered on. Press \nthe  button on the robot to make the robot \nautomatically return to the dock for charging. \nThe robot is equipped with a built-in high-\nperformance lithium-ion rechargeable battery \npack. To maintain battery performance, keep \nthe robot charged.\nB4-1—Dock Status Indicator Light turns \noff, Robot Power Indicator Light \nbreathing: Charging\nThe robot may not be turned on when the battery \nis low. In this case, place the robot to the dock for charging.\nNote:\nB4 Powering On & Charging\n • The dock status indicator light turns red if an error occurs.\n • Place the dock on a flat floor away from fire, heat, and \nwater. Avoid narrow spaces or locations where the robot \nmay be suspended in the air.\n • Placing the dock on a soft surface (carpet/mat) may \ncause the dock to tilt over and cause problems docking \nand departing.\n • Keep the dock away from direct sunlight or anything \nthat may block the dock location beacon; otherwise, \nthe robot may fail to return to the dock.\n • Do not use the dock without clean water tank, dirty \nwater tank, dust container cover, disposable dust bag, \nor cleaning tank.\n • Maintain the dock according to the maintenance instructions. \nDo not clean the dock with a wet cloth or tissue.\n • All docks are subject to water-based tests before \nleaving the factory. It is normal that a small amount of \nwater remains in the waterway of the dock.\nA10-17—Water Level Float\nA10-18—Cleaning Tank Filter\nA10-19—Cleaning Tank\nAttach the base by pressing down \nboth sides of the base firmly, and \nthen pressing the connecting part in \nthe middle until you hear a click.', '12\nIf the robot is paused for over 10 minutes, \nit will go to sleep, and the power indicator \nlight will flash every few seconds. Press any \nbutton to wake the robot up.\nNotes:\n • The robot will not go to sleep when it is charging.\n • The robot will automatically shut down if left sleep for \nmore than 12 hours.\nSleepC8\nNotes:\n • To make sure the robot to wash the mop cloths \nautomatically, start the robot from the dock and do \nnot move the dock during cleaning.\n • Mop wash frequency and mode can be modified in \nthe app.\n • To avoid burns from hot water, do not touch the water \noutlets.\nAfter cleaning, the robot will return to \nEmptyingC10\nNotes:\n • When emptying has been left unused for a long \nperiod, empty the dustbin manually and make sure \nthe air inlet is clear for optimal emptying performance.\n • Auto-emptying can be disabled in the app.\n • Avoid frequent manual emptying.\nDuring cleaning, the robot automatically \ndetermines when it should return to the dock \nfor mop washing and water tank refilling \nto maximize its mopping performance. To \nmanually start washing, press and hold  \nor tap the corresponding button in the app. \nPress any button to stop washing.\nWashing the Mop ClothsC9\nDrying starts automatically after mop\nwashing or after cleaning is completed. \nTo manually start or stop drying, tap the \ncorresponding button in the app.\nNotes:\n • Stay away from the drying air outlets during drying.\n • Drying duration can be modified in the app.\n • Auto-drying can be disabled in the app.\nDryingC11\nNote: Smart Cleaning Solution Filling can be disabled \nin the app.\nThe robot will automatically add cleaning \nsolution to the water for mop washing and \nrobot water tank refilling according to the \npreset ratio to ensure optimal mopping \nperformance.\nAuto Cleaning Solution AdditionC12\nNote: If the robot fails to find the dock, it will automatically \nreturn to its starting position. Place the robot on the \ndock manually to recharge.\nAfter cleaning, the robot will automatically \nreturn to the dock to charge.\nChargingC13\nThe default Do Not Disturb (DND) period is \nfrom 22:00 to 08:00. You can use the app to \ndisable the DND mode or modify the DND \nperiod, or set whether to enable auto top-\nup, emptying and drying, to dim the button \nlight, or lower the volume of the voice \nmessage during the DND period.\nDND ModeC14\nPress and hold  to enable/disable Child \nLock. You can also set it in the app. Once \nenabled, the robot will not react to button \npresses when it is stationary. When the \nrobot is cleaning or docking, press any \nbutton to pause it.\nIf an error occurs, the power indicator light \non the robot will flash red or status indicator \nlight on the dock will be steady red. A pop-\nup notification will appear in the app and a \nvoice alert may sound.\nChild LockC15\nErrorC16\nNotes:\n • The robot will go to sleep automatically if left in a \nmalfunctioning state for over 10 minutes.\nNote: Placing a paused robot on the dock manually will \nend the current cleanup.\npress and hold  to wash the mop cloths \nand then resume cleaning.\nthe dock and auto-emptying will begin \nas needed. To manually start emptying, \npress  on the docked robot or tap the \ncorresponding button in the app. Press any \nbutton to stop emptying.\nPress  to send the paused robot back \nto the dock. The power indicator light will \nbreathe during robot charging.']",You can use Roborock branded floor cleaner in the water tank. Do not use hot water to avoid deforming the tank.,Only cleaning solutions officially recommended by Roborock may be used. Other detergents may cause corrosion or damage.,1.0,0.699999999965,1.0,10,5,1000,200
Which model has automatic mop washing?,"['12\nIf the robot is paused for over 10 minutes, \nit will go to sleep, and the power indicator \nlight will flash every few seconds. Press any \nbutton to wake the robot up.\nNotes:\n • The robot will not go to sleep when it is charging.\n • The robot will automatically shut down if left sleep for \nmore than 12 hours.\nSleepC8\nNotes:\n • To make sure the robot to wash the mop cloths \nautomatically, start the robot from the dock and do \nnot move the dock during cleaning.\n • Mop wash frequency and mode can be modified in \nthe app.\n • To avoid burns from hot water, do not touch the water \noutlets.\nAfter cleaning, the robot will return to \nEmptyingC10\nNotes:\n • When emptying has been left unused for a long \nperiod, empty the dustbin manually and make sure \nthe air inlet is clear for optimal emptying performance.\n • Auto-emptying can be disabled in the app.\n • Avoid frequent manual emptying.\nDuring cleaning, the robot automatically \ndetermines when it should return to the dock \nfor mop washing and water tank refilling \nto maximize its mopping performance. To \nmanually start washing, press and hold  \nor tap the corresponding button in the app. \nPress any button to stop washing.\nWashing the Mop ClothsC9\nDrying starts automatically after mop\nwashing or after cleaning is completed. \nTo manually start or stop drying, tap the \ncorresponding button in the app.\nNotes:\n • Stay away from the drying air outlets during drying.\n • Drying duration can be modified in the app.\n • Auto-drying can be disabled in the app.\nDryingC11\nNote: Smart Cleaning Solution Filling can be disabled \nin the app.\nThe robot will automatically add cleaning \nsolution to the water for mop washing and \nrobot water tank refilling according to the \npreset ratio to ensure optimal mopping \nperformance.\nAuto Cleaning Solution AdditionC12\nNote: If the robot fails to find the dock, it will automatically \nreturn to its starting position. Place the robot on the \ndock manually to recharge.\nAfter cleaning, the robot will automatically \nreturn to the dock to charge.\nChargingC13\nThe default Do Not Disturb (DND) period is \nfrom 22:00 to 08:00. You can use the app to \ndisable the DND mode or modify the DND \nperiod, or set whether to enable auto top-\nup, emptying and drying, to dim the button \nlight, or lower the volume of the voice \nmessage during the DND period.\nDND ModeC14\nPress and hold  to enable/disable Child \nLock. You can also set it in the app. Once \nenabled, the robot will not react to button \npresses when it is stationary. When the \nrobot is cleaning or docking, press any \nbutton to pause it.\nIf an error occurs, the power indicator light \non the robot will flash red or status indicator \nlight on the dock will be steady red. A pop-\nup notification will appear in the app and a \nvoice alert may sound.\nChild LockC15\nErrorC16\nNotes:\n • The robot will go to sleep automatically if left in a \nmalfunctioning state for over 10 minutes.\nNote: Placing a paused robot on the dock manually will \nend the current cleanup.\npress and hold  to wash the mop cloths \nand then resume cleaning.\nthe dock and auto-emptying will begin \nas needed. To manually start emptying, \npress  on the docked robot or tap the \ncorresponding button in the app. Press any \nbutton to stop emptying.\nPress  to send the paused robot back \nto the dock. The power indicator light will \nbreathe during robot charging.', '006\n • Press to return to dock/start emptying\n • Press and hold to start spot cleaning/ \nmop washing\n      —Dock\n • Press and hold to turn the robot \non or off\n • Press to start cleaning\n      —Power/Clean\n • White: Battery level ≥ 15%\n • Red: Battery level < 15%\n • Breathing: Charging or starting up\n • Flashing red: Error\n      —Power Indicator Light\nPress any button to stop the robot during cleaning \nor docking.\nNote:\nA1-1—Dock Locator\nA1-2—Reactive Tech Obstacle Avoidance \nSensor\nA2-1—Wall Sensor\nA2-2—Omnidirectional Wheel\nA2-3—Carpet Sensor\nA2-4—Side Brush\nA2-5—Main Wheel\nA2-6—Main Brush\nA2-7—Main Brush Cover Latches\nA2-8—Mop Cloths\nA2-9—Cliff Sensors\nA3-4—Reset Button\nA3-5—Dustbin\nA3-6—Charging Contacts\nA3-7—Communication Sensor\nA3-8—Air Outlet\nA3-9—Positioning Button\nA3-10—Self-Filling Port\nA3-11—Automatic Lift and Rotate Mop \nModules\nA3-12—Suction Inlet\nA3-13—Bumper\nA3-1—Vertical Bumper\nA3-2—LiDAR Sensor\nA3-3—WiFi Indicator Light\n • Off: WiFi disabled/Charging\n • Flashing slowly: Waiting for connection\n • Flashing quickly: Connecting\n • Steady: WiFi connected\nA4-1—Hook and Loop Pads\nA4-2—Mop Axle\nSecure the mop cloths in place.Note:\nProduct OverviewA\nA1 Robot (Top View)\nA2 Robot (Bottom View)\nA3 Robot (Top Cover Open)\nA4 Mop Cloth Mount\nA5 Mop Cloth\nA6-1—Dustbin Latch\nA6-2—Air Inlet\nA6-3—Washable Filter \nA6-4—Suction Inlet\nA6 Dustbin\nA7 Dock Base\nA8 Power Cord\nA9 Disposable Dust Bag\nA10-1—Water Tank Handle\nA10-2—Water Tank Latch\nA10-3—Dirty Water Tank\nA10-4—Dust Container Cover\nA10-5—Charging Contacts\nA10-6—Robot Refill Port\nA10-7—Suction Inlet\nA10-8—Clean Water Tank\nA10-9—Status Indicator Light\n • Breathing: Emptying/Mop washing\n • Red: Dock error\n • Off: Powered off/Charging\nA10-10—Water Outlet\nA10-11—Air Outlets\nA10-12—Dock Base\nA10-13—Filter\nA10-14—Dust Bag Slot\nA10-15—Dock Location Beacon\nA10-16—Clean Water Dispensers\nA10 Dock', '08\nInstructions\nNotes:\n • To prevent corrosion or damage, only use the Roborock \nbranded floor cleaner in the water tank.\n • To avoid water tank deformation, do not place hot water \nin the tank.\n • If water marks remain on the water tank, wipe them clean \nbefore reinstallation.\nFilling the Clean Water Tank\nOpen the clean water tank. Fill with water \nuntil the Max line. Close the lid, lock the \nlatch, and fit the tank back in place.\nThe robot cannot be turned off when it is being \ncharged.\nNote:\nPress and hold the  button to turn on the \nrobot. The power indicator will turn on and \nthe robot will enter standby mode. Press \nand hold the  button to turn off the robot \nand complete the cleaning cycle.\nOn/Off\nPress the  button to start cleaning. The \nrobot will plan its cleaning route according \nto its scan of the room. It splits a room into \nzones, first draws out zone edges, and then \nfills the zone in a zigzag pattern. In so \ndoing, the robot cleans all zones one by \none, efficiently cleaning the house.\nStarting Cleaning\nZone 1 – Cleaned\nZone 4 – Next Zone\nZone 2 – Cleaned\nZone 3 – In Progress\nNotes:\n • To allow the robot to automatically vacuum and return to \nthe dock, start the robot from the dock. Do not move the \ndock during cleaning.\n • Cleaning cannot start if the battery level is too low. Allow the \nrobot to charge before starting cleanup.\n • If cleaning is completed in less than 10 minutes, the area \nwill be cleaned twice.\n • If the battery runs low during the cleaning cycle, the robot \nwill automatically return to the dock. After charging, the \nrobot will resume where it left off.\n • Automatic mop washing will not work if the dock \nencounters an error during cleaning. Wash the mop \nmanually to restore.\n • When the mop mount is attached, the robot will retract it \nwhen cleaning the carpet. You can also set the carpet as a \nno-go zone in the app to avoid it.\n • Before starting each mopping task, make sure that the \nVibraRise mop has been properly installed.\nAfter spot cleaning, the robot will automatically return \nto the starting point and enter Standby mode.\nNote:\nPress the  button to start spot cleaning.\nCleaning range: The robot cleans a 1.5 m \n(4.9 ft) x 1.5 m (4.9 ft) square area centered \non itself.\nSpot Cleaning Manually Activated Emptying\nAuto-Emptying\nEmptying can be triggered manually by \npressing the  button while the robot is \ncharging.\nAuto-emptying will begin when the robot \nreturns to the dock after cleaning.\nAvoid frequent manual emptying.Note:\nNotes:\n • If the dock has not emptied for an extended period, \nempty the robot dustbin manually and clear the air \ninlet of any debris to ensure optimum performance.\n • If necessary, auto-emptying can be disabled in the \napp.\nManually Activated Mop \nWashing\nDuring cleaning, press any button to pause, \nthen press and hold the  button to send \nthe robot back for mop washing.\nAuto Mop Washing\nDuring cleaning, the robot automatically \ndetermines when it should return to dock \nfor mop washing and water tank refilling to \nmaximize its mopping performance.\nTo allow the robot to wash the mop automatically, \nstart the robot from the dock once it is fully charged. Do \nnot move the dock during cleaning.\nNote:', '17\nCommon Issues\nIssue Solution\nThe robot begins \nto miss certain \nspots\n • The wall sensor, cliff sensors, or carpet sensor may be \ndirty. Clean them with a soft, dry cloth.\nPoor cleaning \nperformance \nand/or dust \nleakage\n • The dustbin is full and needs emptying.\n • The filter is blocked and needs cleaning.\n • The main brushes are tangled up. Clean the main \nbrushes.\nNo or little water \nduring mopping\n • Use the mobile app to increase the scrub intensity & \nwater flow.\nThe status \nindicator light is \nsteady red\n • The dust container cover is not in place. Check and \ninstall in place.\n • Voltage error. Check that the local voltage meets the \nrequirements listed on the dock.\n • The refill and drainage pipes are not installed or not \nproperly installed.\n • Check that the water filter has been correctly installed.\nReduced \nemptying \nperformance or \nunusual noise \nwhen emptying\n • The main brushes or main brush cover is not properly \ninstalled. Check and install in place.\n • The filter, suction inlet, air inlet, or dustbin is blocked. \nClean to remove blockage.\nVoice alert Error \n42 occurs and \nthe maintenance \nbrush module \nstops at one side \nof the cleaning \ntank\n • If the brush module stops at the left side, it may be \njammed. Remove any items jamming it.\n • If the brush module stops at the right side, the filter \nmay be blocked or is not installed in place. Clean and \ninstall in place.\nIssue Solution\nReduced \nmop washing \nperformance\n • The mop cloths are not attached properly. Reinstall \nthem.\n • The floor is dirty. Change the mop washing mode to \n""Deep"" in the app for better cleaning.\nUnable to \nauto-empty\n • Auto-emptying is disabled. Check in-app settings.\n • Dock dust container cover is not installed. Check and \ninstall.\n • Auto-emptying will not be triggered if the robot \nreturns to the dock without cleaning.\n • The robot will not auto-empty after returning to the \ndock in DND mode. Adjust cleaning or DND period, or \nstart emptying manually. \nUnable to wash \nthe mop cloths\n • The mop cloths will not be washed if not used.\n • If the robot does not start from the dock or no dock \nis found on the app map, it will not return to the dock \nfor mop washing.\n • The refill and drainage pipes are not installed or not \nproperly installed.\n • Check that the water filter has been correctly installed.\nUnable to start \nauto-drying\n • Auto-drying is disabled. Check in-app settings.\n • If you press a robot button or the robot departs the \ndock during drying, the drying will end in advance.\n • In a humid environment, it is recommended to extend \nthe drying duration in the app to improve the drying \nperformance.\nUnable to wash \nthe mop cloths \nwith hot water\n • Check that Mop Washing with Hot Water is enabled in \nthe app.', '009\nPause\nWhen the robot is running, press any button \nto pause it, press the  button to resume \ncleaning, and press the  button to send it \nback to the dock.\nPlacing a paused robot on the dock manually will \nend the current cleanup.\nNote:\nSleep\nIf the robot is paused for over 10 minutes, \nit will go to sleep, and the power indicator \nlight will flash every few seconds. Press any \nbutton to wake the robot up.\nNotes:\n • The robot will not go to sleep when it is charging.\n • The robot will automatically shut down if left in sleep \nmode for more than 12 hours.\nDND Mode\nThe default Do Not Disturb (DND) period is \nfrom 22:00 to 08:00. You can use the app to \ndisable the DND mode or modify the DND \nperiod. When DND is on, the robot will not \nautomatically resume cleanup, the power \nindicator light will dim, and the volume of \nthe voice message will lower.\nWashing the Mop Cloths\nDuring cleaning, the robot automatically \ndetermines when it should return to \nthe dock for mop washing and water \ntank refilling to maximize its mopping \nIf an error occurs, the power indicator light \non the robot will flash red or status indicator \nlight on the dock will be steady red. A pop-\nup notification will receive in the app and a \nvoice alert may sound.\nError\n • The robot will go to sleep automatically if left in a \nmalfunctioning state for over 10 minutes.\n • Placing a malfunctioning robot on the dock manually \nwill end the current cleanup.\nNotes:\n • Drying duration can be modified in the app.\n • Auto-drying can be disabled through the app.\nNotes: \nCharging\nAfter cleaning, the robot will automatically \nreturn to the dock to charge. In Pause mode, \npress the  button to send the robot back to \nthe dock. The power indicator light will breath \nas the robot charges.\nIf the robot fails to find the dock, it will automatically \nreturn to its starting location. Place the robot on the dock \nmanually to recharge.\nNote:\nResetting the System\nIf the robot does not respond when a button \nis pressed or cannot be turned off, reset the \nsystem by pressing the Reset button.\nAfter resetting the system, existing settings such \nas scheduled cleaning and WiFi will be restored to factory \nsettings. \nNote:\nAuto-emptying will automatically begin when \nthe robot returns to the dock after cleaning. \nTo manually emptying, press  button on the \ndocked robot or tap the corresponding button \nin the app. Press any button to stop emptying. \nEmptying\n • When auto-emptying has been left unused for a long \nperiod, empty the dustbin manually and make sure \nthe air inlet is clear for optimal emptying performance.\n • Auto-emptying can be disabled through the app.\n • Avoid frequent manual emptying.\nNotes:\nDrying starts automatically after mop washing \nor after cleaning is completed. To manually \nstart or stopping drying, tap the corresponding \nbutton in the app. \nDrying\n • To allow the robot to wash the mop automatically, \nstart the robot from the dock and do not move the \ndock during cleaning.\n • Watch out for hot water and do not touch the water outlet.\n • Mop wash frequency and washing mode can be modified \nin the app. \nNotes:\nperformance. During cleaning, tap Dock \nbutton in the app to send robot back for \nmop washing. When the robot is charging, \npress and hold the  button on the robot or \ntap Wash button in the app to manually start \nwashing. Press any button to stop washing.\nDeactivating WiFi\nTo disconnect the robot from WiFi, press \nthe Reset button until you hear a voice']",The Roborock S8 MaxV Ultra and the Roborock Qrevo Pro both feature automatic mop washing.,"Roborock S7 Pro Ultra, S8 MaxV Ultra and Qrevo Pro support automatic mop washing.",0.0,0.0,0.0,10,5,1000,200
How do I reset Wi-Fi on Roborock S7 Pro Ultra?,"['13\nCommon Issues\nProblem Solution\nUnable to power on  • The battery level is low. Put the robot on the charging dock and charge it before use.\n • The battery temperature is too low or too high. Only use the robot within the range of 4-40°C (39-104°F).\nUnable to charge      • Check the power indicator light turns on and both ends of the power cabel are properly connected.\n • If contact is poor, clean the contact areas on the charging dock and the robot.  \nSlow charging    • When used at high or low temperatures, the robot will automatically reduce its charging speed to extend battery life.\n • The charging contacts may be dirty. Wipe them with a dry cloth.\nUnable to dock    • There are too many obstacles near the charging dock. Move it to an open area.\n • The robot is too far from the charging dock. Place it closer and retry.\nAbnormal behavior  • Restart the robot.\nNoise during cleaning    • The main brush, side brush, main wheels, or omni-directional wheel may be jammed. Turn off the robot and clean them. \n • VibraRise system abnormal. Check for jammed objects.\nUnable to connect to WiFi   \n • WiFi is disabled. Reset the WiFi and try again.\n • The WiFi signal is poor. Move the robot to an area with good WiFi reception.\n • Abnormal WiFi connection. Reset the WiFi, download the latest mobile app, and retry.\n • The current Roborock robot is not supported. You can find supported models in the app. \n • Unable to connect to WiFi abruptly. There may be an error with your router settings. Contact Roborock customer \nservice for additional support.\nPoor cleaning ability or dust falling out \n • The dustbin is full and needs emptying.\n • The filter is blocked and needs cleaning.\n • The main brush is jammed and needs cleaning.\nScheduled cleaning is not working  • Keep the robot charged. Scheduled cleaning can only begin when the battery level is above 20%.\nIs power always being drawn when the \nrobot is on the charging dock?  • The robot will draw power while it is docked to maintain battery performance, but power consumption is minimal.\nDoes the robot need to be charged for \nat least 16 hours the first three times it \nis used?\n • No. The robot can be used any time after it has been fully charged.\nNo or little water during mopping  • Check whether there is water in the water tank and use the mobile app to set the scrub intensity or check the manual \nfor full instructions on how to correctly install the mop cloth and mop mount.\nCleaning does not resume after \nrecharging\n • Make sure that the robot is not in DND mode. DND mode will prevent cleanup. When cleaning a space requiring a \ntop-up charge, if the robot was placed manually on the charging dock before it returned to the dock automatically, it \nwill not be able to continue cleanup.', '13\nIf the robot does not respond when a button \nis pressed or cannot be turned off, reset the \nsystem by pressing the Reset button.\nResetting the SystemC17\nNote: After resetting the system, existing settings such \nas scheduled cleaning and WiFi will be restored to \nfactory settings.\nTo disconnect the robot from WiFi, press \nthe Reset button until you hear a voice \nmessage. Then wait for 5 minutes and the \nWiFi will be automatically deactivated. If you \nwant to reconnect, please follow the related \nconnecting instructions.\nIf the robot does not function properly after \na system reset, switch it on. Press and hold  \n and at the same time, press the Reset \nbutton until you hear the “Restoring \nfactory settings” voice message. The robot \nwill then be restored to factory settings.\nDeactivating WiFiC18\nRestoring Factory SettingsC19\nNote: The frequency of replacement may vary with the \nactual situation. If abnormal wear occurs, replace the \nparts immediately.\n* Clean every 2 weeks and replace every 6-12 months.\nMain BrushesD1\nRoutine MaintenanceD\nD1-1—Hair-Blocking Rings \nD1-2—Main Brush Caps \nD1-3—Main Brush Cover \nD1-4—Latches \nD1-5—Main Brushes \nD1-6—Main Brush Bearing\nTurn over the robot and press the \ntwo latches inwards to remove the \nmain brush cover.\nD1-7—\nPull out the main brushes and \nremove the main brush bearings, \nmain brush caps, and hair-blocking \nrings. Remove any entangled hair \nor dirt at both ends of the main \nbrushes. Then, reinstall the hair-\nblocking rings, main brush caps, and \nthen main brush bearings. \nD1-8—\nUnscrew the side brush screw. Remove and \nclean the side brush. Reinstall the brush \nand tighten the screw.\nNotes:\n • It is recommended to wipe the main brushes with a \nwet cloth. If the main brushes are wet, air-dry them \naway from direct sunlight.\n • Do not use corrosive cleaning fluid or disinfectant to \nclean the main brushes.\n* Clean monthly and replace every 3-6 months.\nFlexible Side BrushD2\nReinstall the main brushes. Firmly snap \nthe main brush bearings into place. \nOnly after the bearings are securely \ninstalled, fit the main brush cover.\nD1-9—\nReinstall the main brush cover. Make \nsure its four teeth are fully seated in \nthe slots, and press the main brush \ncover until you hear it lock with a click.\nD1-10 —\n • Placing a malfunctioning robot on the dock manually \nwill end the current cleanup.\n •To prevent injury caused by blades used to cut hair inside \nthe main brush cover, make sure to install two main \nbrushes in place before installing the main brush cover.\nUse a tool, such as a small \nscrewdriver, to pry out the axle and \ntake out the wheel.\nD3-1—\n* Clean as required.\nOmnidirectional WheelD3\nThe omnidirectional wheel bracket cannot be \nremoved.\nNote:\nRinse the wheel and the axle with \nwater to remove any hair and dirt. \nAir-dry, reinstall, and press the wheel \nand axle back in place.\nD3-2—\nClean the main wheels with a soft, dry cloth.\n* Clean as required.\nMain WheelsD4\n* Clean as required.\nDustbinD5\nRemove the magnetic top cover and \npress the dustbin latch to take out \nthe dustbin.\nD5-1—\nRemove the washable filter and \nempty the dustbin.\nD5-2—', '008\nConnecting to the App\nSearch for “Roborock” in the App Store or \nGoogle Play or scan the QR code to download \nand install the app.\n1. Download App\na. Open the top cover and find the WiFi \nindicator light.\n2. Reset WiFi\nb. Press and hold the  and  buttons \nuntil you hear the “Resetting WiFi” voice \nmessage. The reset is complete when the \nWiFi indicator light flashes slowly. The \nrobot will then wait for a connection.\nIf you cannot connect to the robot due to your \nrouter configuration, a forgotten password, or any other \nreason, reset the WiFi and add your robot as a new device.\nNote:\nNotes:\n • The actual process may vary due to ongoing app updates. \nFollow the guide provided in the app.\n • Only 2.4 GHz WiFi is supported.\nOpen the Roborock app, tap the “Scan to \nConnect” or “Search for Device” button and \nadd your device as instructed in the app.\n3. Add Device\nC2-1—Zone 1 – Cleaned.\nC2-2—Zone 2 – Cleaned.\nC2-3—Zone 3 – In Progress.\nC2-4—Zone 4 – Next Zone.\nNotes:\n •To allow the robot to automatically vacuum and return \nto the dock, start the robot from the dock. Do not move \nthe dock during cleaning.\n • Cleaning cannot start if the battery level is too low. \nAllow the robot to charge before starting the cleanup.\n • Before cleaning, tidy cords (including the power cord \nof the dock) and valuables from the floor. Loose \nitems may be dragged by the robot, resulting in the \ndisconnection of electrical appliances or damage of \ncords and property.\n • If cleaning is completed in less than 10 minutes, the \narea will be cleaned twice.\n • If the battery runs low during a cleaning cycle, the robot \nwill automatically return to the dock. After charging, \nthe robot will resume where it left off.\n • The robot will retract mop cloth mounts when cleaning \nthe carpet. You can also set the carpet as a no-go \nzone in the app to avoid it.\n • Before starting each cleaning task, make sure that the \nmop cloths have been properly installed.\nSpot Cleaning\nPress and hold the  button to start spot \ncleaning in pause mode.\nCleaning range: The robot cleans a 1.5 m (4.9 ft) x \n1.5 m (4.9 ft) square area centered on itself.\nPress and hold  to turn on the robot. The \npower indicator light will come on, and the \nrobot will wait for orders.\nPress and hold the  button to turn off the \nrobot and complete the cleaning cycle.\nOn/Off\nThe robot cannot be turned off when it is being charged.Note:\nInstructions for UseC\nRemove and open the clean water tank and \nfill the tank with water to MAX. Close the lid, \nlock the latch, and fit the tank back in place.\nNotes:\n • To prevent corrosion or damage, do not use any disinfectant \nand only use cleaning solution recommended by Roborock \nin the water tank.\n • Do not add too much cleaning solution to prevent the \nrobot from working improperly due to slipping.\n • To avoid water tank deformation, do not place hot water \nin the tank. \n • If water marks remain on the water tank, wipe them \nclean before reinstallation.\nC1 Filling the Water Tank\nPress the  button to start cleaning. The \nrobot will plan its cleaning route according \nto its scan of the room. It splits a room \nC2 Starting Cleaning\ninto zones, first draws out zone edges, and \nthen fills the zone in a zigzag pattern. In \nso doing, the robot cleans all zones one by \none, efficiently cleaning the house.\nAfter spot cleaning, the robot will automatically \nreturn to the starting point and wait for orders.\nNote:', '10\nCheck the Refill and Drainage \nSystem\nB10\nTo check whether the refill and drainage \nsystem is installed successfully, press and \nhold  and  simultaneously for 3 seconds \non the docked robot to start a self-check. \nDuring the self-check process, observe \nwhether the dock can normally fill and drain \nwater, and check the self-check results.\nThe self-check of the refill and drainage system \ncan be started in the app.\nNote:\nPress and hold  to power on the robot. \nWait until the power indicator light is steady, \nand then place the robot in front of the \ndock. Make sure that the dock is plugged in. \nThen, press  and the robot will automatically \nreturn to the dock for charging. The robot is \nequipped with a built-in high-performance \nlithium-ion rechargeable battery pack. To \nmaintain battery performance, keep the \nrobot charged.\nThe robot may not be turned on when the battery is \nlow. In this case, place the robot to the dock for charging.\nNote:\nPowering On & ChargingB9\nDock status indicator light dim, robot \npower indicator light breathing: \nCharging\nB9-1—\nConnect the Power SupplyB8\nNotes:\n • If the power cord hangs vertically to the ground, it \nmay be caught by the robot, causing the dock to be \nmoved or disconnected.\nAfter placing the dock at the location \nreserved, open the tap water valve and the \nclean water three-way valve. Ensure there \nare no leaks throughout the pipeline. Then, \nconnect the power supply, and make sure \nthe status indicator light comes on.\nSearch for ""Roborock"" in the App Store \nor Google Play or scan the QR code to \ndownload and install the app.\nConnecting to the App\n1. Download the App\na. Remove the magnetic top cover and find \nthe WiFi indicator light.\nb. Press and hold  and  simultaneously \nuntil you hear the ""Resetting WiFi"" voice \nmessage. The reset is complete when \nthe WiFi indicator light flashes slowly. The \nrobot will then wait for a connection.\n2. Reset WiFi\nConnect to Drainage PipelineB7\nNotes:\n • Ensure the floor drain or drainpipe outlet is \nunobstructed. Avoid inserting the drainpipe into a \nsealed chamber to prevent poor drainage.\n • Ensure the connection between the drainpipe and the \nfloor drain or sewer pipe is securely fastened.\n • If other water-using equipment is connected to the \nsame drainpipe, make sure that their drainage doesn\'t \ndisrupt the dock\'s drainage to prevent leaks.\n • If necessary, encircle the cut-to-fit harness tube \naround both the 1/4"" and 3/8"" pipes.\nConnect the cut-to-fit 3/8"" pipe to a floor  \ndrain or sewer pipe.\n • To prevent blockage due to impurities in tap water, \nkeep the water running until it becomes clear before \ninstalling the clean water three-way valve.\n • Only connect to room temperature tap water, rather \nthan reclaimed water or hot water.\n • The tap water filter must be installed strictly following \nthe instructions. If installed in the reverse direction, it \ncould be damaged.\n • If the 1/2"" water outlet does not need to be connected \nto a water pipe, use a suitable valve cap instead.\n • After cutting the pipe, start by trimming the end to \nensure it forms a straight line rather than a curve, and \nthen reround it.\n • The status indicator light is bright when the dock is \npowered on, and dim during robot charging or mop \ncloth drying. \n • The status indicator light turns red if an error occurs. \n • Place the dock on a hard, flat floor away from fire, \nheat, and water. Avoid narrow spaces or locations \nwhere the robot may be suspended in the air. \n •Placing the dock on a soft surface (carpet/mat) may cause \nthe dock to tilt and cause docking and departing problems.\n • Keep the dock away from direct sunlight or anything \nthat may block the dock location beacon, otherwise \nthe robot may fail to return to the dock.', '05\nA5  Electric Water Tank\nA5-1—Stopper\nA5-2—Water Filter\nA5-3—Water Tank Latch\nA5-4—Self-Filling Port\nA4  Dustbin\nA4-1—Filter Cover\nA4-2—Dustbin Latch\nA4-3—Cover Latch\nA4-4—Air Inlet\nA4-5—Washable Filter\nA3  Robot (Upper Cover Open)\nA3-1—Vertical Bumper\nA3-2—LiDAR Sensor\nA3-3—WiFi Indicator Light\n • Off: WiFi disabled\n • Flashing slowly: Waiting for \nconnection\n • Flashing quickly: Connecting\n • Steady: WiFi connected\nA3-4—Reset Button\nA3-5—Water Tank\nA3-6—Dustbin\nA3-7—Mop Wash Sensor\nA3-8—Water Tank Latch\nA3-9—Positioning Button\nA3-10—VibraRise Module\nA3-11—Air Outlet\nA3-12—Bumper\nA1  Robot (Top View)\nPress any button to stop the robot during cleaning \nor docking.\nNote:\nA1-1—Dock Locator\n • Press to return to dock/start \nemptying\n • Press and hold to wash mop\nDock\n • Press to Spot clean\n • Press and hold for 3 seconds to \nturn on/off the child lock\nSpot Clean/Child Lock\n • White: Battery level ≥ 20%\n • Red: Battery level < 20%\n • Pulsing: Charging or starting up\n • Flashing red: Error\nPower Indicator\nPower/Clean\n • Press and hold to turn the robot \non or off\n • Press to start cleaning\nProduct OverviewA\nA2  Robot (Bottom View)\nA2-1—Wall Sensor\nA2-2—Charging Contacts\nA2-3—Carpet Sensor\nA2-4—Omni-Directional Wheel\nA2-5—Side Brush \nA2-6—Main Wheel\nA2-7—Main Brush\nA2-8—Main Brush Cover Latches\nA2-9—Cliff Sensors\nA6  VibraRise Mop Mount\nA6-1—Mop Cloth Attachment Slot\nA6-2—Vibration Module\nA8  Power Cable\nA9  Dock Base\nA10 Disposable Dust Bag\nA7  VibraRise Mop Cloth\nA7-1—Hook and Loop Pads\nThe VibraRise mop mount is non-detachable.Note:']","To reset the Wi-Fi on your Roborock S7 Pro Ultra, locate the Wi-Fi indicator light on the robot. Press and hold both the power and dock buttons simultaneously until you hear a voice message indicating that the Wi-Fi is resetting. The reset process is complete when the Wi-Fi indicator light begins to flash slowly, and the robot will then be ready for a new connection.",Open the top cover and locate the Wi-Fi indicator. Press and hold the Power and Home buttons until you hear 'Resetting WiFi'. The reset is complete when the Wi-Fi indicator flashes slowly and the robot waits for connection.,0.8,0.4166666666458333,1.0,20,5,1000,200
Can I use detergent in the water tank?,"['08\nInstructions\nNotes:\n • To prevent corrosion or damage, only use the Roborock \nbranded floor cleaner in the water tank.\n • To avoid water tank deformation, do not place hot water \nin the tank.\n • If water marks remain on the water tank, wipe them clean \nbefore reinstallation.\nFilling the Clean Water Tank\nOpen the clean water tank. Fill with water \nuntil the Max line. Close the lid, lock the \nlatch, and fit the tank back in place.\nThe robot cannot be turned off when it is being \ncharged.\nNote:\nPress and hold the  button to turn on the \nrobot. The power indicator will turn on and \nthe robot will enter standby mode. Press \nand hold the  button to turn off the robot \nand complete the cleaning cycle.\nOn/Off\nPress the  button to start cleaning. The \nrobot will plan its cleaning route according \nto its scan of the room. It splits a room into \nzones, first draws out zone edges, and then \nfills the zone in a zigzag pattern. In so \ndoing, the robot cleans all zones one by \none, efficiently cleaning the house.\nStarting Cleaning\nZone 1 – Cleaned\nZone 4 – Next Zone\nZone 2 – Cleaned\nZone 3 – In Progress\nNotes:\n • To allow the robot to automatically vacuum and return to \nthe dock, start the robot from the dock. Do not move the \ndock during cleaning.\n • Cleaning cannot start if the battery level is too low. Allow the \nrobot to charge before starting cleanup.\n • If cleaning is completed in less than 10 minutes, the area \nwill be cleaned twice.\n • If the battery runs low during the cleaning cycle, the robot \nwill automatically return to the dock. After charging, the \nrobot will resume where it left off.\n • Automatic mop washing will not work if the dock \nencounters an error during cleaning. Wash the mop \nmanually to restore.\n • When the mop mount is attached, the robot will retract it \nwhen cleaning the carpet. You can also set the carpet as a \nno-go zone in the app to avoid it.\n • Before starting each mopping task, make sure that the \nVibraRise mop has been properly installed.\nAfter spot cleaning, the robot will automatically return \nto the starting point and enter Standby mode.\nNote:\nPress the  button to start spot cleaning.\nCleaning range: The robot cleans a 1.5 m \n(4.9 ft) x 1.5 m (4.9 ft) square area centered \non itself.\nSpot Cleaning Manually Activated Emptying\nAuto-Emptying\nEmptying can be triggered manually by \npressing the  button while the robot is \ncharging.\nAuto-emptying will begin when the robot \nreturns to the dock after cleaning.\nAvoid frequent manual emptying.Note:\nNotes:\n • If the dock has not emptied for an extended period, \nempty the robot dustbin manually and clear the air \ninlet of any debris to ensure optimum performance.\n • If necessary, auto-emptying can be disabled in the \napp.\nManually Activated Mop \nWashing\nDuring cleaning, press any button to pause, \nthen press and hold the  button to send \nthe robot back for mop washing.\nAuto Mop Washing\nDuring cleaning, the robot automatically \ndetermines when it should return to dock \nfor mop washing and water tank refilling to \nmaximize its mopping performance.\nTo allow the robot to wash the mop automatically, \nstart the robot from the dock once it is fully charged. Do \nnot move the dock during cleaning.\nNote:', '013\nCommon Issues\nIssue Solution\nThe robot \nsuddenly misses \na certain spot.\n • The wall sensor, cliff sensors, or carpet sensor may be \ndirty. Wipe them with a soft dry cloth.\nSchedules are \nnot effective.\n • Schedules will only take effect when the battery is higher \nthan 15%.\nThe LED status \nindicator light \non the dock is \nsteady red.\n • Voltage error. Check that the local voltage meets the \nrequirements listed on the dock.  \n • Check clean water tank placement or refill as required.\n • Check dirty water tank placement or empty as required.\n • Check that the cleaning tank or cleaning tank filter has \nbeen correctly installed.\nReduced \nemptying \nperformance \nor unusual \nnoise when \nemptying.\n • The main brush or main brush cover is not properly \ninstalled. Check and install in place.\n • The filter, air duct, suction inlet, air inlet, dustbin or dust \nbag is blocked. Clean to remove blockages.\nReduced \nmop washing \nperformance.\n • The mop cloths are not attached properly. Reinstall.\n • The floor is dirty. Change the mop washing mode in the \napp for better cleaning.\nUnable to start \nauto-drying.\n • Auto-drying is disabled. Check in-app settings.\n • Auto-drying starts only after mopping or mop washing.\nIssue Solution\nUnable to \nauto-empty.\n • Auto-emptying is disabled. Check in-app settings.\n • Dock dust container cover is not installed. Check and install.\n • Auto-emptying will not be triggered if the robot returns \nto the dock without cleaning.\n • The robot will not auto-emptying after returning to the \ndock in the Do Not Disturb (DND) mode. Adjust cleaning \nor DND duration, or start emptying manually. \nUnable to wash \nthe mop cloths. \n • The mop will not be washed if not used.\n • If the robot does not start from the dock or no dock is \nfound on the app map, it will not return to the dock for \nmop washing.\n • Check clean water tank placement or refill as required.\n • Check dirty water tank placement or empty as required.\n • Check that the cleaning tank or cleaning tank filter has \nbeen correctly installed.\nUnable to wash \nthe mop cloths \nwith hot water.\n • Check that Mop Washing with Hot Water is enabled in \nthe app.\nUnable to extend \nthe mop cloth.\n • Check whether the FlexiArm Extend Cleaning feature is \nenabled in the app.\n • The mop cloth will only extend along walls and certain \nobstacles.\n • Please check if the mop extension structure is stuck.', '005\nSafety Information\n • Always use a properly grounded power outlet to minimize the risk of electric shock. If such a socket is not available, consult an electrician to \nmake one available.\n • Be sure that the supply voltage meets the requirements listed on the dock. \n • Only use the power cord provided with the product to prevent potential smoke, heat, or fire. \n • Do not use the product with any type of power adapter, as this may cause danger and void the warranty. \n • If the dock is placed in an area susceptible to thunderstorms or with unstable voltage, take protection measures. \n • Unplug the power cord before placing the dock into storage.\n • Do not discard waste batteries. Leave them with a professional recycling organization.\n • To transport the product, make sure it is powered off and shut down, and empty the remaining fluid in the water tanks. Original packaging \nis advised.\nBattery and Charging \nWARNING \nInternational Symbols Explanation\n  – PROTECTIVE EARTH (Protective Ground) symbol [symbol IEC 60417-5019 (2009-02)]          \n •To prevent corrosion or damage, do not use any disinfectant and only use cleaning solution recommended by Roborock in the water tank.\n •Do not put any low objects (such as shoes, mats) near raised areas like stairs. Otherwise, the robot may fall down caused by malfunctional sensors.\n • To prevent water damage, make sure that the floor where the robot operates is free of water.', '11\nSlide the mop cloth in from the \nopening of the attachment slot then \nstick it flat in place.\nC8-2—\nIf the robot will be left unused for a long period, turn it \noff and charge it at least every three months to avoid battery \ndamage caused by over-discharge.\nNote:\nBattery\nThe robot is equipped with a built-in \nhigh-performance lithium-ion rechargeable \nbattery pack. To maintain battery \nperformance, keep the robot charged \nduring normal use.\nRemove the water tanks and the dustbin \nbefore moving the dock. Grip the handle on \nthe back with one hand and the inner side \nof the front, as shown. Do not grip the base \nbecause as it is not designed for lifting.\nC11 Moving the Dock\nUse a soft, dry cloth to wipe and clean all \nsensors, including:\nUse a soft dry cloth to wipe the charging \ncontacts on the robot and the dock.\nC9  Robot Sensors\nC10 Charging Contact Areas\n* Clean monthly.\n* Clean monthly.\nDock Locator\nWall Sensor\nMop Wash Sensor\nCarpet Sensor\nCliff Sensors\nC9-1—\nC9-2—\nC9-3—\nC9-4—\nC9-5—\n* Clean as required.\nUnlock the water filter and remove it for \nwashing. Use a soft, dry cloth to wipe the \ncleaning tank, and then reinstall the filter. \nPress down the filter until you hear it lock \nwith a click.\nC14 Water Filter\nPulling the dust bag handle to remove the bag will seal \nthe bag to prevent leakage.\nLift the dustbin and remove the \nbag vertically as shown.\nDiscard the dust bag and clean \naround the filter with a dry cloth.\nSlot in a new disposable dust bag \nas shown. Slide until it reaches the \nbottom of the slot and reinstall the \ndustbin securely.\nAlways install a dust bag before putting back the \ndustbin top lid to avoid auto-emptying without the bag. You \ncan also disable auto-emptying in the app.\nNote:\nNote:\n* Replace the disposable dust bag when it is full. \nC15-1—\nC15-2—\nC15-3—\nC15 Replacing the Disposable \nDust Bag\n* Clean as required.\nRemove the clean water tank, dirty \nwater tank, and dustbin.\nFollow the following steps to clean the air \nduct and avoid blockages.\nC16-1—\nC16 Cleaning the Air Duct\n* Clean as required.\nLift the high-speed maintenance brush latch \nand remove the brush, as shown below. \nRemove any entangled objects in the \nhigh-speed maintenance brush and rinse it \nclean. Reinstall the brush and latch it in place.\n* Clean as required and replace every 6-12 months.\nClean the dirty water tank as needed. Open \nthe dirty water tank lid and pour out the \ndirty water. Fill the tank with clean water, \nclose the lid, lock it, and shake. Pour out the \ndirty water. Close the lid and then re-install.\nC12 Dirty Water Tank\nC13 High-Speed Maintenance \nBrush\nRemove the VibraRise mop cloth from \nthe VibraRise mop mount. Clean the \nVibraRise mop cloth and air-dry it.\nC8-1—\n* Clean after each use and replace every 3-6 months.\nA dirty VibraRise mop will affect the mopping \nperformance. Clean it before use.\nNote:\nC8  VibraRise Mop Cloth', '011\nD7-2—Stick the mop cloth on the mount in \nposition and firmly.\nA dirty mop cloth will affect the washing performance. \nClean it before use.\nNote:\nMake sure the disposable dust bag is properly \nsealed to avoid waste escaping and damaging the dock.\nNote:\nUse a soft, dry cloth to wipe and clean all \nsensors, including:\n* Clean as required.\nLift up and move the dock. Do not move the \ndock by lifting the dock base, water tank handles \nor dust container cover directly to prevent \nthe dock from falling off.\nOpen the dirty water tank lid and pour out \nthe dirty water. Fill the tank with clean water, \nclose the lid, and shake. Pour out the dirty \nwater. Close the lid and then re-install.\n* Clean as required.\nUse a soft dry cloth to wipe the charging \ncontacts on the robot and the dock.\n* Clean monthly.\nNotes:\n • The dust bag handle seals the bag on removal to \nprevent leakage.\n • Always install a dust bag before closing the dust \ncontainer cover to avoid auto-emptying without the \nbag. You can also disable auto-emptying in the app.\nD12-1—Remove the dust container cover.\nD12-2—Remove the disposable dust bag in the \ndirection of the arrow and discard it.\n* Replace as required.\nD12-3—Clean around the filter with a dry \ncloth. Install a new disposable dust \nbag in place along the slot and \nunfold the dust bag to maximize \nemptying performance.\nBasic Parameters\nModel QR1PES\nBattery 14.4 V/5200 mAh (TYP) \nlithium-ion battery\nRated Input 20VDC 1.5A\nCharging Time Approx. 4 hours\nRobot\nThe serial number is on a sticker on the underside \nof the robot.\nNote:\nEmpty Wash Fill Dock\nModel EWFD16HRR\nRated Input Voltage 220-240VAC\nRated Frequency 50-60Hz\nRated Input (Dust \ncollection) 3A \nRated Input\n(Hot water washing \nmop)\n5.6A\nRated Input \n(Charging & drying) 0.6A\nRated Output 20VDC 1.5A\nCharging Battery 14.4 V/5200 mAh (TYP) \nlithium-ion battery\nD8-1—Dock Locator\nD8-2—Reactive Tech Obstacle Avoidance Sensor\nD8-3—Wall Sensor\nD8-4—Communication Sensor\nD8-5—Carpet Sensor\nD8-6—Four Cliff Sensors\nD8 Robot Sensors\nD10 Dirty Water Tank\nD11 Charging Contact Areas\nD12 Replacing Disposable Dust Bag\nD12-4—Close the dust container cover and \nmake sure it is securely sealed.\nD13-1—Remove the cleaning tank.\nD13-2—Rinse the cleaning tank and the filter \nwith water.\nD13-3—Reinstall the cleaning tank.\n* Clean as required.\nD13 Cleaning Tank\nD9 Moving Dock']","No, you should only use Roborock branded floor cleaner in the water tank to prevent corrosion or damage.",Only cleaning solutions officially recommended by Roborock may be used. Other detergents may cause corrosion or damage.,1.0,0.8333333332916666,1.0,20,5,1000,200
Which model has automatic mop washing?,"['12\nIf the robot is paused for over 10 minutes, \nit will go to sleep, and the power indicator \nlight will flash every few seconds. Press any \nbutton to wake the robot up.\nNotes:\n • The robot will not go to sleep when it is charging.\n • The robot will automatically shut down if left sleep for \nmore than 12 hours.\nSleepC8\nNotes:\n • To make sure the robot to wash the mop cloths \nautomatically, start the robot from the dock and do \nnot move the dock during cleaning.\n • Mop wash frequency and mode can be modified in \nthe app.\n • To avoid burns from hot water, do not touch the water \noutlets.\nAfter cleaning, the robot will return to \nEmptyingC10\nNotes:\n • When emptying has been left unused for a long \nperiod, empty the dustbin manually and make sure \nthe air inlet is clear for optimal emptying performance.\n • Auto-emptying can be disabled in the app.\n • Avoid frequent manual emptying.\nDuring cleaning, the robot automatically \ndetermines when it should return to the dock \nfor mop washing and water tank refilling \nto maximize its mopping performance. To \nmanually start washing, press and hold  \nor tap the corresponding button in the app. \nPress any button to stop washing.\nWashing the Mop ClothsC9\nDrying starts automatically after mop\nwashing or after cleaning is completed. \nTo manually start or stop drying, tap the \ncorresponding button in the app.\nNotes:\n • Stay away from the drying air outlets during drying.\n • Drying duration can be modified in the app.\n • Auto-drying can be disabled in the app.\nDryingC11\nNote: Smart Cleaning Solution Filling can be disabled \nin the app.\nThe robot will automatically add cleaning \nsolution to the water for mop washing and \nrobot water tank refilling according to the \npreset ratio to ensure optimal mopping \nperformance.\nAuto Cleaning Solution AdditionC12\nNote: If the robot fails to find the dock, it will automatically \nreturn to its starting position. Place the robot on the \ndock manually to recharge.\nAfter cleaning, the robot will automatically \nreturn to the dock to charge.\nChargingC13\nThe default Do Not Disturb (DND) period is \nfrom 22:00 to 08:00. You can use the app to \ndisable the DND mode or modify the DND \nperiod, or set whether to enable auto top-\nup, emptying and drying, to dim the button \nlight, or lower the volume of the voice \nmessage during the DND period.\nDND ModeC14\nPress and hold  to enable/disable Child \nLock. You can also set it in the app. Once \nenabled, the robot will not react to button \npresses when it is stationary. When the \nrobot is cleaning or docking, press any \nbutton to pause it.\nIf an error occurs, the power indicator light \non the robot will flash red or status indicator \nlight on the dock will be steady red. A pop-\nup notification will appear in the app and a \nvoice alert may sound.\nChild LockC15\nErrorC16\nNotes:\n • The robot will go to sleep automatically if left in a \nmalfunctioning state for over 10 minutes.\nNote: Placing a paused robot on the dock manually will \nend the current cleanup.\npress and hold  to wash the mop cloths \nand then resume cleaning.\nthe dock and auto-emptying will begin \nas needed. To manually start emptying, \npress  on the docked robot or tap the \ncorresponding button in the app. Press any \nbutton to stop emptying.\nPress  to send the paused robot back \nto the dock. The power indicator light will \nbreathe during robot charging.', '011\nD7-2—Stick the mop cloth on the mount in \nposition and firmly.\nA dirty mop cloth will affect the washing performance. \nClean it before use.\nNote:\nMake sure the disposable dust bag is properly \nsealed to avoid waste escaping and damaging the dock.\nNote:\nUse a soft, dry cloth to wipe and clean all \nsensors, including:\n* Clean as required.\nLift up and move the dock. Do not move the \ndock by lifting the dock base, water tank handles \nor dust container cover directly to prevent \nthe dock from falling off.\nOpen the dirty water tank lid and pour out \nthe dirty water. Fill the tank with clean water, \nclose the lid, and shake. Pour out the dirty \nwater. Close the lid and then re-install.\n* Clean as required.\nUse a soft dry cloth to wipe the charging \ncontacts on the robot and the dock.\n* Clean monthly.\nNotes:\n • The dust bag handle seals the bag on removal to \nprevent leakage.\n • Always install a dust bag before closing the dust \ncontainer cover to avoid auto-emptying without the \nbag. You can also disable auto-emptying in the app.\nD12-1—Remove the dust container cover.\nD12-2—Remove the disposable dust bag in the \ndirection of the arrow and discard it.\n* Replace as required.\nD12-3—Clean around the filter with a dry \ncloth. Install a new disposable dust \nbag in place along the slot and \nunfold the dust bag to maximize \nemptying performance.\nBasic Parameters\nModel QR1PES\nBattery 14.4 V/5200 mAh (TYP) \nlithium-ion battery\nRated Input 20VDC 1.5A\nCharging Time Approx. 4 hours\nRobot\nThe serial number is on a sticker on the underside \nof the robot.\nNote:\nEmpty Wash Fill Dock\nModel EWFD16HRR\nRated Input Voltage 220-240VAC\nRated Frequency 50-60Hz\nRated Input (Dust \ncollection) 3A \nRated Input\n(Hot water washing \nmop)\n5.6A\nRated Input \n(Charging & drying) 0.6A\nRated Output 20VDC 1.5A\nCharging Battery 14.4 V/5200 mAh (TYP) \nlithium-ion battery\nD8-1—Dock Locator\nD8-2—Reactive Tech Obstacle Avoidance Sensor\nD8-3—Wall Sensor\nD8-4—Communication Sensor\nD8-5—Carpet Sensor\nD8-6—Four Cliff Sensors\nD8 Robot Sensors\nD10 Dirty Water Tank\nD11 Charging Contact Areas\nD12 Replacing Disposable Dust Bag\nD12-4—Close the dust container cover and \nmake sure it is securely sealed.\nD13-1—Remove the cleaning tank.\nD13-2—Rinse the cleaning tank and the filter \nwith water.\nD13-3—Reinstall the cleaning tank.\n* Clean as required.\nD13 Cleaning Tank\nD9 Moving Dock', '006\n • Press to return to dock/start emptying\n • Press and hold to start spot cleaning/ \nmop washing\n      —Dock\n • Press and hold to turn the robot \non or off\n • Press to start cleaning\n      —Power/Clean\n • White: Battery level ≥ 15%\n • Red: Battery level < 15%\n • Breathing: Charging or starting up\n • Flashing red: Error\n      —Power Indicator Light\nPress any button to stop the robot during cleaning \nor docking.\nNote:\nA1-1—Dock Locator\nA1-2—Reactive Tech Obstacle Avoidance \nSensor\nA2-1—Wall Sensor\nA2-2—Omnidirectional Wheel\nA2-3—Carpet Sensor\nA2-4—Side Brush\nA2-5—Main Wheel\nA2-6—Main Brush\nA2-7—Main Brush Cover Latches\nA2-8—Mop Cloths\nA2-9—Cliff Sensors\nA3-4—Reset Button\nA3-5—Dustbin\nA3-6—Charging Contacts\nA3-7—Communication Sensor\nA3-8—Air Outlet\nA3-9—Positioning Button\nA3-10—Self-Filling Port\nA3-11—Automatic Lift and Rotate Mop \nModules\nA3-12—Suction Inlet\nA3-13—Bumper\nA3-1—Vertical Bumper\nA3-2—LiDAR Sensor\nA3-3—WiFi Indicator Light\n • Off: WiFi disabled/Charging\n • Flashing slowly: Waiting for connection\n • Flashing quickly: Connecting\n • Steady: WiFi connected\nA4-1—Hook and Loop Pads\nA4-2—Mop Axle\nSecure the mop cloths in place.Note:\nProduct OverviewA\nA1 Robot (Top View)\nA2 Robot (Bottom View)\nA3 Robot (Top Cover Open)\nA4 Mop Cloth Mount\nA5 Mop Cloth\nA6-1—Dustbin Latch\nA6-2—Air Inlet\nA6-3—Washable Filter \nA6-4—Suction Inlet\nA6 Dustbin\nA7 Dock Base\nA8 Power Cord\nA9 Disposable Dust Bag\nA10-1—Water Tank Handle\nA10-2—Water Tank Latch\nA10-3—Dirty Water Tank\nA10-4—Dust Container Cover\nA10-5—Charging Contacts\nA10-6—Robot Refill Port\nA10-7—Suction Inlet\nA10-8—Clean Water Tank\nA10-9—Status Indicator Light\n • Breathing: Emptying/Mop washing\n • Red: Dock error\n • Off: Powered off/Charging\nA10-10—Water Outlet\nA10-11—Air Outlets\nA10-12—Dock Base\nA10-13—Filter\nA10-14—Dust Bag Slot\nA10-15—Dock Location Beacon\nA10-16—Clean Water Dispensers\nA10 Dock', '08\nInstructions\nNotes:\n • To prevent corrosion or damage, only use the Roborock \nbranded floor cleaner in the water tank.\n • To avoid water tank deformation, do not place hot water \nin the tank.\n • If water marks remain on the water tank, wipe them clean \nbefore reinstallation.\nFilling the Clean Water Tank\nOpen the clean water tank. Fill with water \nuntil the Max line. Close the lid, lock the \nlatch, and fit the tank back in place.\nThe robot cannot be turned off when it is being \ncharged.\nNote:\nPress and hold the  button to turn on the \nrobot. The power indicator will turn on and \nthe robot will enter standby mode. Press \nand hold the  button to turn off the robot \nand complete the cleaning cycle.\nOn/Off\nPress the  button to start cleaning. The \nrobot will plan its cleaning route according \nto its scan of the room. It splits a room into \nzones, first draws out zone edges, and then \nfills the zone in a zigzag pattern. In so \ndoing, the robot cleans all zones one by \none, efficiently cleaning the house.\nStarting Cleaning\nZone 1 – Cleaned\nZone 4 – Next Zone\nZone 2 – Cleaned\nZone 3 – In Progress\nNotes:\n • To allow the robot to automatically vacuum and return to \nthe dock, start the robot from the dock. Do not move the \ndock during cleaning.\n • Cleaning cannot start if the battery level is too low. Allow the \nrobot to charge before starting cleanup.\n • If cleaning is completed in less than 10 minutes, the area \nwill be cleaned twice.\n • If the battery runs low during the cleaning cycle, the robot \nwill automatically return to the dock. After charging, the \nrobot will resume where it left off.\n • Automatic mop washing will not work if the dock \nencounters an error during cleaning. Wash the mop \nmanually to restore.\n • When the mop mount is attached, the robot will retract it \nwhen cleaning the carpet. You can also set the carpet as a \nno-go zone in the app to avoid it.\n • Before starting each mopping task, make sure that the \nVibraRise mop has been properly installed.\nAfter spot cleaning, the robot will automatically return \nto the starting point and enter Standby mode.\nNote:\nPress the  button to start spot cleaning.\nCleaning range: The robot cleans a 1.5 m \n(4.9 ft) x 1.5 m (4.9 ft) square area centered \non itself.\nSpot Cleaning Manually Activated Emptying\nAuto-Emptying\nEmptying can be triggered manually by \npressing the  button while the robot is \ncharging.\nAuto-emptying will begin when the robot \nreturns to the dock after cleaning.\nAvoid frequent manual emptying.Note:\nNotes:\n • If the dock has not emptied for an extended period, \nempty the robot dustbin manually and clear the air \ninlet of any debris to ensure optimum performance.\n • If necessary, auto-emptying can be disabled in the \napp.\nManually Activated Mop \nWashing\nDuring cleaning, press any button to pause, \nthen press and hold the  button to send \nthe robot back for mop washing.\nAuto Mop Washing\nDuring cleaning, the robot automatically \ndetermines when it should return to dock \nfor mop washing and water tank refilling to \nmaximize its mopping performance.\nTo allow the robot to wash the mop automatically, \nstart the robot from the dock once it is fully charged. Do \nnot move the dock during cleaning.\nNote:', '17\nCommon Issues\nIssue Solution\nThe robot begins \nto miss certain \nspots\n • The wall sensor, cliff sensors, or carpet sensor may be \ndirty. Clean them with a soft, dry cloth.\nPoor cleaning \nperformance \nand/or dust \nleakage\n • The dustbin is full and needs emptying.\n • The filter is blocked and needs cleaning.\n • The main brushes are tangled up. Clean the main \nbrushes.\nNo or little water \nduring mopping\n • Use the mobile app to increase the scrub intensity & \nwater flow.\nThe status \nindicator light is \nsteady red\n • The dust container cover is not in place. Check and \ninstall in place.\n • Voltage error. Check that the local voltage meets the \nrequirements listed on the dock.\n • The refill and drainage pipes are not installed or not \nproperly installed.\n • Check that the water filter has been correctly installed.\nReduced \nemptying \nperformance or \nunusual noise \nwhen emptying\n • The main brushes or main brush cover is not properly \ninstalled. Check and install in place.\n • The filter, suction inlet, air inlet, or dustbin is blocked. \nClean to remove blockage.\nVoice alert Error \n42 occurs and \nthe maintenance \nbrush module \nstops at one side \nof the cleaning \ntank\n • If the brush module stops at the left side, it may be \njammed. Remove any items jamming it.\n • If the brush module stops at the right side, the filter \nmay be blocked or is not installed in place. Clean and \ninstall in place.\nIssue Solution\nReduced \nmop washing \nperformance\n • The mop cloths are not attached properly. Reinstall \nthem.\n • The floor is dirty. Change the mop washing mode to \n""Deep"" in the app for better cleaning.\nUnable to \nauto-empty\n • Auto-emptying is disabled. Check in-app settings.\n • Dock dust container cover is not installed. Check and \ninstall.\n • Auto-emptying will not be triggered if the robot \nreturns to the dock without cleaning.\n • The robot will not auto-empty after returning to the \ndock in DND mode. Adjust cleaning or DND period, or \nstart emptying manually. \nUnable to wash \nthe mop cloths\n • The mop cloths will not be washed if not used.\n • If the robot does not start from the dock or no dock \nis found on the app map, it will not return to the dock \nfor mop washing.\n • The refill and drainage pipes are not installed or not \nproperly installed.\n • Check that the water filter has been correctly installed.\nUnable to start \nauto-drying\n • Auto-drying is disabled. Check in-app settings.\n • If you press a robot button or the robot departs the \ndock during drying, the drying will end in advance.\n • In a humid environment, it is recommended to extend \nthe drying duration in the app to improve the drying \nperformance.\nUnable to wash \nthe mop cloths \nwith hot water\n • Check that Mop Washing with Hot Water is enabled in \nthe app.']",The Roborock S8 MaxV Ultra and the Roborock Qrevo Pro both feature automatic mop washing.,"Roborock S7 Pro Ultra, S8 MaxV Ultra and Qrevo Pro support automatic mop washing.",0.5,0.0,0.0,20,5,1000,200
